417267467|The Good Life|Steve Berra|Art House & International, Comedy, Drama|Jan 18, 2007|Nov 4, 2008||R (for language)|87|Warner Bros. Pictures|Steve Berra|Mette Beckmann was the wife of Valdemar Beckmann, the son of a wealthy Danish family who owned a successful shipbuilding firm in Portugal; Valdemar inherited his family's fortune, and Mette lived a life of luxury from that point on, while their daughter, Anne Mette Beckmann, grew up free of want. The Beckmanns spent most of their time in Portugal, where Valdemar lackadaisically looked after the family business, but in 1974 the Portuguese government nationalized his business, and the Beckmann fortune was suddenly wiped out. In 2007, Valdemar died, and since then Mette and Anne have lived in a tiny apartment on the Portuguese coast, trying to get by on a small pension and simmering with resentment for one another. Middle-aged Anne is angry that her mother and father never taught her how to make a life for herself, and elderly Mette is bitter that the life of privilege she once knew is gone forever, and concerned about what will become of her daughter. Filmmaker Eva Mulvad profiles a family struggling to get by after decades free of responsibility in the documentary Det Gode Liv (aka The Good Life), which features home movies of the Beckmanns in their salad days along with extensive interviews with Mette and Anne as they struggle to make ends meet. The film received its North American premiere at the 2011 Tribeca Film Festival. ~ Mark Deming, Rovi|4.2/10|5|1|4|||||3.3/5|1,970
392808053|Milarepa|Neten Chokling|Action & Adventure, Art House & International, Drama, Science Fiction & Fantasy|Sep 7, 2007|Nov 4, 2008||PG (for some violence/disturbing images and thematic elements)|94|Luminous Velocity|Neten Chokling, Tenzing Choyang Gyari|Bhutanese director Neten Chokling's fantasy Milarepa mounts and cinematizes an ancient Buddhist legend -- a moral fable from the eponymous monk's colorful early life. The story unfolds in the 11th century, when Milarepa (Jamyang Lodro) -- christened Thopaga -- unexpectedly loses his father, and finds his life plunged into a bleak hell. His vile aunt and uncle, Peydon and Gyalsten (played by Lhakpa Tsamchoe and Gonpo, respectively), seize control of the deceased's inheritance and force Thopaga, his mother, Kargyen (Kelsang Chukie Tethtong), and his sister, Peta (Tashi Lhamo), into a period of seemingly limitless domestic slavery. When Thopaga turns 16, Kargyen seizes the opportunity to throw an engagement party for him, hoping that she can use the circumstances to reclaim property and title. The townspeople fail to come to her aid, however, causing Kargyen to spur Thopaga onward toward an apprenticeship in the dark arts and an onslaught of ugly, black magic-fueled revenge. In the end, her plan backfires -- thus demonstrating the nasty consequences for anyone who seeks unbridled vengeance against evildoers.|5.6/10|27|11|16|5.5/10|9|4|5|3.5/5|570
326391700|Goal II: Living the Dream|Jaume Collet-Serra|Drama|Feb 9, 2007|Nov 4, 2008||PG-13 (for some sexual content)|115|Freestyle Releasing|Adrian Butchart, Mike Jefferies, Terry Loane|The Jaume Collet-Serra-directed comedy drama Goal! 2: Living the Dream finds star European soccer player Santiago Muñez (Kuno Becker) bumped by his agent (Stephen Dillane) from England's Newcastle United team to Real Madrid's Galácticos, where he is thrilled to play alongside field legends David Beckham, Ronaldo, Zinedine Zidane, and others. In off-time, temptation lingers in the form of amorous dalliances with spicy local women, especially the TV hostess Jordana (Leonor Varela) -- a relationship that threatens the security of his marital engagement to Geordie nurse Roz (Anna Friel), who has accompanied him to Spain. During his time in Madrid, Santiago also discovers, most unexpectedly and poignantly, what happened to the mother who abandoned him during his early childhood. Alessandro Nivola co-stars as Santiago's pal Gavin.|4.8/10|18|7|11|||||3.6/5|24,448
4844265|The Wild Parrots of Telegraph Hill|Judy Irving|Documentary, Special Interest|Feb 9, 2005|Oct 28, 2008|$2,720,531|G|83|Shadow Distribution|Mark Bittner|"Telegraph Hill is a neighborhood in one of the hillier sections of San Francisco that over the years has become home to a large flock of wild parrots. While no one is certain how they got there, the birds were for the most part left to their own devices until they were discovered by Mark Bittner. A street musician and self-described ""Dharma bum,"" Bittner had no practical background in ornithology when he first encountered the parrots, but it wasn't long before he developed a close bond with them and took it upon himself to feed and care for the birds, and even gave many of them names. Bittner's friendship with the parrots became a growing experience that taught the guitarist as much about himself as it did about the birds, and with the passage of time, his work earned him the respect of his community as well as a home. The Wild Parrots of Telegraph Hill is a documentary which recounts the story of Bittner and his birds, as well as an unexpected twist of fate which added a poignant note to their tale."|7.7/10|100|95|5|7.8/10|31|31|0|3.9/5|5,239
18010|Quo Vadis?|Mervyn LeRoy|Classics, Documentary, Drama, Special Interest, Romance, Faith & Spirituality|Feb 23, 1951|Nov 11, 2008||PG|171|MGM Home Entertainment|John Lee Mahin, S.N. Behrmann, Sonya Levien|A Christian woman falls for an agnostic Roman soldier during a time when Emperor Nero plans to wipe out Christianity completely and rebuild Rome after burning it to the ground. As their love deepens, the soldier begins to discover a faith he didn't have before. A Best Picture nominee.|6.4/10|16|14|2|5/10|5|4|1|3.6/5|3,707
770799365|24: Redemption|Jon Cassar|Action & Adventure, Drama, Mystery & Suspense, Television|Nov 23, 2008|Nov 23, 2008||NR|100|Fox Network||"Film based on the real-time television series ""24"" (2001), which chronicles a day in the life of Federal Agent Jack Bauer (Sutherland)."|6.6/10|19|15|4|6.5/10|6|5|1|3.7/5|6,217
770771598|The Longshots|Fred Durst|Comedy, Drama|Aug 22, 2008|Dec 2, 2008|$11,389,715|PG (for some thematic elements, mild language and brief rude humor)|94|The Weinstein Company|Doug Atchison, Nick Santora|Former Limp Bizkit frontman Fred Durst directs Ice Cube and Keke Palmer in this battle-of-the-sexes sports comedy about a former high-school football star who coaches his niece to become the first-ever girl quarterback in the history of Pop Warner football. Based on a true story, The Longshots opens in the struggling American town of Minden, IL. The Minden Browns used to be one of the strongest teams in the Pop Warner league, but lately things have taken a turn for the worst. Recognizing that his old team needs some fresh blood in order to make a comeback, a former player (Cube) trains his 11-year-old niece, Jasmine (Palmer), to throw the ball like a true gridiron giant. While the powers that be scoff at the idea of a female quarterback, they soon begin to sing a different tune as Jasmine leads the Browns to the championships and an invigorating shot at redemption. ~ Jason Buchanan, Rovi|5.2/10|71|29|42|5/10|23|7|16|3.5/5|22,653
770771305|Garden Party|Jason Freeland|Art House & International, Drama|May 30, 2008|Nov 18, 2008||NR|90|Lionsgate|Jason Freeland|Filmmaker Jason Freeland draws inspiration from the eponymous song for this tale of five lost souls attempting to navigate the treacherous urban landscape of contemporary Los Angeles. April is an ambitious beauty in search of success, but can she learn to get by and keep on her clothes at the same time? Sally St. Clair is a sexy realtor with a secret past. She's got a great eye for spotting lost souls, and thrives on giving them direction in life. One of those lost souls is Nathan, her new assistant. Nathan moved to Los Angeles from Nebraska seeking to find success as a dancer, but now most of his time is spent making photocopies for Sally and her clients. One of those clients is Todd, a porn-addicted artist who agrees to help Sally get revenge for a past indiscretion in exchange for her helping him realize his greatest fantasy. Meanwhile, as starry-eyed street musician Sammy moves in with Nathan, the new roommates both have disparate ideas about the direction their relationship is headed, and everyone involved becomes hopelessly ensnared in Sally's kinky entanglements. ~ Jason Buchanan, Rovi|3.8/10|20|3|17|3.3/10|7|0|7|2.7/5|2,407
770767562|Hofshat Kaits (My Father My Lord)|David Volach|Art House & International, Drama|Jul 11, 2008|Dec 2, 2008||NR|74|Kino International|David Volach|Israeli director David Volach's chamber drama My Father, My Lord (aka Hofshat Kaits, 2006) provides an intense character study of a rabbi in an Orthodox neighborhood, whose letter-of-the-law application of Talmudic tenets takes an exacting toll on his life. He must thus grapple with the conflicting demands of his belief system and his familial obligations to his wife and child.|7.5/10|37|35|2|7.7/10|17|16|1|3.7/5|1,424
770767471|Kiss the Bride|C. Jay Cox|Comedy, Romance, Gay & Lesbian|Apr 18, 2008|Nov 25, 2008||R (for sexual content and language)|115|Regent Releasing|Ty Lieberman|"Director C. Jay Cox explores the complex social and sexual landscapes of contemporary America with this heartfelt romantic comedy about a gay male who just discovered that the love of his life is about to tie the knot -- with a woman! Back in high school, Matt (Philipp Karner) and Ryan (James O'Shea ) were more than just best friends. But ten years after graduation, this once-inseparable pair has lost contact. One day, seemingly out of the blue, Matt receives an invitation to Ryan's wedding. Of course, there has been plenty of time for Ryan to develop new relationships in the ten long years since he and Matt last spoke, but the last thing Matt would ever expect is for his former high-school love to fall for a member of the ""fairer sex."" Convinced that Ryan is about to be taken advantage of by a scheming she-devil, Matt races back to the small hometown he once left behind and prepares to save his true love from a life of marital despair. Upon meeting perky bride-to-be Alex (Tori Spelling), however, Matt slowly begins to understand what it is that Ryan sees in her. Still, Matt can't mess up the opportunity to let the love of his life slip through his fingers, and ultimately decides to come clean about his true feelings for Ryan. Trouble is, Ryan views his romance with Matt as nothing more than a high school fling. As the wedding day draws near and long-buried emotions begin to bubble to the surface, Matt realizes that his feelings for Ryan are stronger than ever before, and his attempts to reconcile the past with the present will ultimately pave the road into an uncertain future."|4.2/10|7|2|5|||||3.1/5|625
770753776|Loudmouth Soup|Adam Watstein|Comedy|Sep 22, 2005|Nov 25, 2008||NR|96|Vanguard|Adam Watstein, Nancy Bell, Jennifer D. Lyne|A couple finds that breaking into the Hollywood elite is harder than they ever imagined in this improvised, independent comedy of manners. Loudmouth Soup takes place over the course of a long dinner party thrown by Jason (Joe Mellis) and Catherine (Melanie Chapman), a married couple from New York whose recent feature-film effort landed them some buzz at Sundance. Now relocated to L.A., the pair throw a dinner part for some potential investors, including producer Charlie (Kevin Chamberlin), ambitious actress Blake (Nancy Bell), and surprisingly, Blake's superstar boyfriend, Sam (Michael James Reed). Blind-sided by the A-list guest, each diner tries to cozy up to the money man to try to attain some cash and credibility for his or her next project. The action in Loudmouth Soup was captured in near real time by a handful of video cameras; director Adam Watstein would provide plot suggestions to the performers when they walked off-camera.|4.8/10|6|1|5|4.8/10|5|1|4||43
770729335|Space Chimps|Kirk De Micco|Action & Adventure, Animation, Comedy, Kids & Family|Jul 17, 2008|Nov 24, 2008|$29,942,542|G|81|20th Century Fox|Kirk De Micco, Rob Moreland, Robert Moreland|When a $5 billion Space Agency probe disappears into an intergalactic wormhole, the agency recruits Ham III, grandson of the first chimpanzee in space, to help retrieve the wayward craft. But Ham is a free-spirited circus performer more interested in zero gravity high jinks than living up to his illustrious heritage. The simian slacker becomes a reluctant hero and learns the true meaning of courage as he and his crewmates, the plucky Lieutenant Luna and their by-the-book commander, Titan, risk everything in an effort to save the peaceful inhabitants of a distant planet from an evil dictator.|4.6/10|91|30|61|4.3/10|25|8|17|2.8/5|124,311
770728557|Meet Dave|Brian Robbins|Comedy, Science Fiction & Fantasy|Jul 9, 2008|Nov 25, 2008|$11,644,832|PG (for bawdy and suggestive humor, action and some language)|90|20th Century Fox|Bill Corbett, Rob Greenberg, Robert Greenberg|With their home planet in danger and no place in the known universe to seek shelter, a desperate crew of miniature alien humanoids boards a human spacecraft in hopes of saving their doomed world. Eddie Murphy stars in a sci-fi comedy that re-teams the longtime comic actor with Norbit director Brian Robbins.|4.1/10|101|20|81|4.5/10|31|7|24|3/5|159,859
770682590|Up the Yangtze|Yung Chang|Documentary, Special Interest|Sep 30, 2007|Nov 18, 2008|$605,037|NR|93|Zeitgeist Films|Yung Chang, Yung Chang|"Director Yung Chang uses the construction of China's massive Three Gorges Dam as a springboard to better understanding the social hierarchies and changing times in his homeland in this documentary focusing on the luxury cruise ship that carries predominately Western tourists down the Yangtze River. Constructed as a symbol of modern progress in China, the Three Gorges Dam has forced millions of common people out of their ancestral homes, and will soon swallow up numerous nearby towns and villages. Despite the fact that the government has funded alterative housing for the dislocated families, however, many citizens make their way to higher ground feeling as if they have been duped by the powers that be. In order to truly understand how this affects the people, Chang focuses on telling the stories of middle-class scion Chen Bo Yu (renamed ""Jerry"" by the cruise line) and Yu Shui (who answers to the call of ""Cindy"" while on duty). As the ship sets sail, this hard-working pair do their best to familiarize themselves with Western social cues, striving to perform to the best of their abilities, and ponder the prospects of a brighter future. ~ Jason Buchanan, Rovi"|7.7/10|52|50|2|8/10|21|21|0|3.9/5|2,429
770682510|Gonzo: The Life and Work of Hunter S. Thompson|Alex Gibney|Documentary, Special Interest|Jan 20, 2008|Nov 18, 2008|$1,031,095|R (for drug and sexual content, language and some nudity)|119|Magnolia Pictures|Alex Gibney|"Alex Gibney (director of (Enron: The Smartest Guys in the Room) turns his attention from corporate scandal to Gonzo journalism with this tribute to the libido-driven, Wild Turkey-swilling writer who never knew the meaning of the word ""excess."" Comprised largely of never-before-seen archival materials, Gibney's film focuses on the years between 1965 and 1975, when Hunter S. Thompson was truly firing on all cylinders. Rare home movies, audiotapes, and excerpts from unpublished manuscripts combine to paint an affectionate portrait to the wild-eyed father of Gonzo journalism. ~ Jason Buchanan, Rovi"|7/10|97|84|13|7.3/10|29|26|3|3.5/5|41,175
770682046|Diminished Capacity|Terry Kinney|Comedy|Jul 4, 2008|Nov 25, 2008||NR|87|IFC First Take|Sherwood Kiraly, Doug Bost|Author Sherwood Kiraly pens the screenplay adaptation of his own comedic novel concerning a man (Matthew Broderick) who gets amnesia after suffering a blow to the head and the road trip he embarks on with his Alzheimer's-afflicted uncle (Alan Alda) and high-school sweetheart (Virginia Madsen). Convinced that they will make a fortune by selling an ultra-rare baseball card at a high-profile memorabilia show, the trio sets out on the open road in search of adventure. Bobby Cannavale and Lois Smith co-star in the feature directorial debut of actor-turned-director Terry Kinney.|5.3/10|31|11|20|4.8/10|15|4|11|2.7/5|27,666
770681826|Tropic Thunder|Ben Stiller|Comedy|Aug 13, 2008|Nov 18, 2008|$110,416,702|R (for pervasive language including sexual references, violent content and drug material)|107|DreamWorks/Paramount Studios|Justin Theroux, Etan Cohen, Ben Stiller|Ben Stiller's satirical look at Hollywood, Tropic Thunder concerns the production of an epic Vietnam War film that quickly derails thanks to the giant egos of everyone involved in the production. Stiller stars as Tugg Speedman, an action hero trying to segue out of that genre. Jack Black plays Jeff Portnoy, a drug-addicted fat comic also attempting to change his image by taking on such a serious film. They star alongside Kirk Lazarus (Robert Downey Jr.), one of the world's most awarded actors, and a man who insists on immersing himself totally in a role. In this case, that means Lazarus has had his skin dyed in order to portray an African-American soldier. After their outrageous behavior lands the film's director, Damien Cockburn (Steve Coogan), in very hot water with producer Les Grossman (Tom Cruise), Cockburn takes the advice of grizzled Vietnam vet Four Leaf Tayback (Nick Nolte); in order to gain control of his performers, Cockburn drops the actors off in the jungle, planning to film the movie guerrilla-style with hidden cameras. When the group stumbles upon a heroin production camp, the actors are unaware that they are in very real danger. ~ Perry Seibert, Rovi|7.1/10|242|197|45|6.9/10|50|39|11|3.5/5|296,398
770681189|Fly Me to the Moon|Ben Stassen|Animation, Kids & Family, Science Fiction & Fantasy|Aug 15, 2008|Dec 2, 2008|$13,592,311|G|84|Summit Entertainment|Domonic Paris, Dominic Paris|Christopher Lloyd, Kelly Ripa, Nicollette Sheridan, and Tim Curry lend their voices to director Ben Stassen's (Haunted Castle and Encounter in the Third Dimension) animatedchildren's fantasy about three preteen flies who hitch a ride into space on the Apollo 11 moon mission. The year is 1969, and Americans all across the country are buzzing about the first manned mission to the moon. Even the insects aren't immune to the excitement, as evidenced by the enthusiasm of adolescent flies Nat (voice of Trevor Gagnon), IQ (voice of Philip Daniel Bolden), and Scooter (voice of David Gore). Over the years, Nat's grandpa (voice of Lloyd) has often recalled the time he hitched a ride on Amelia Earhart's airplane during the famed aviator's cross-Atlantic flight, and now Nat's dreams of recreating that feat on a much larger scale are finally set to come true. But while the three young flies only believe that they'll be gone for a few minutes, the fact is that they'll be drifting through space for almost an entire week. Just as they're about to sneak aboard the ship, the flies are spotted by a keen-eyed NASA ground control official and stored in a test tube for future study. Later in the flight, when the ship's engine malfunctions, the only ones capable of fixing the problem are the three tiny stowaways. But their mission isn't accomplished just yet, because grandpa's old flame Nadia (voice of Sheridan) has just arrived from Russia to warn him that a tiny fly-spy named Yegor (voice of Curry) has been assigned the task of traveling to Cape Canaveral and sabotaging the computer flight plans. Should Nat, IQ, and Scooter fail to act in time, Yegor's mission could spell disaster not only for the three thrill-seeking flies, but the entire U.S. space program. ~ Jason Buchanan, Rovi|4/10|83|16|67|4.1/10|27|6|21|2.6/5|6,938
770680072|The Trap (Klopka)|Srdjan Golubovic|Art House & International, Comedy, Drama, Mystery & Suspense|Mar 27, 2007|Dec 1, 2008||NR|106|Film Movement||A man must make a terrible decision for the sake of his family in this downbeat drama. It's 2006, and in Serbia the divide between the rich and the poor has never been wider or more punishing. Mladen (Nebojsa Glogovac) is an engineer stuck in a low-paying job that barely supports him, his wife, Marija (Natasa Ninkovic), and their ten-year-old son. Already walking on thin ice financially, Mladen and Marija crash through when they learn that their son has been diagnosed with a serious illness, and he'll die soon unless they can arrange for him to have specialized surgery in Europe. Mladen and Marija are unable to pay for the operation, and with few other options, Marija places an ad in the paper asking for financial help. One person answers the ad -- Milos (Miki Manojlovic), a sinister gentleman who is willing to pay the couple handsomely if Mladen will kill a man who has been taking business away from him. Mladen's conscience demands he refuse the offer, but as his son's health deteriorates, he begins to wonder if he could take a life in order to spare his child. Klopka (aka The Trap) was adapted from a stage drama by Nenad Teofilovic. ~ Mark Deming, Rovi|5.1/10|5|3|2|||||4/5|1,346
770679901|Welcome to the Sticks|Dany Boon|Comedy|Feb 8, 2008|Dec 2, 2008||NR|106|Christal Films|Dany Boon, Alexandre Charlot, Franck Magnier|Dany Boon wrote, directed and costars in this rousing rural comedy about a man born and raised on France's Southern coast who is exiled to the Northern territories. Philippe (Kad Merad) helps run a small-town post office in France. His wife Julie has been down in the dumps, so he hatches a plan to move to the Cote d'Azur. But Philippe fails to secure a transfer and is relocated to Bergues, a village in Northern France where the language is unfamiliar and the culture is strangely foreign.|6.3/10|9|6|3|||||3.9/5|21,973
770679092|Hancock|Peter Berg|Action & Adventure, Comedy, Drama|Jun 16, 2008|Nov 25, 2008|$227,946,274|PG-13 (for some intense sequences of sci-fi action and violence, and language)|92|Columbia Pictures|Vincent Gilligan, Vince Gilligan, Vy Vincent Ngo|A hard-drinking lush finds himself thrust into superhero mode in director Peter Berg's unconventional look at the private life of a crime-fighter. Will Smith stars as the embittered do-gooder whose lifestyle is more akin to a rock star than a role model, and who has grown as disillusioned with his once-admiring public as they have of him. ~ Jason Buchanan, Rovi|5.4/10|223|92|131|5.2/10|48|18|30|3.6/5|557,038
770678072|The X-Files: I Want to Believe (The X Files 2)|Chris Carter|Drama, Mystery & Suspense, Science Fiction & Fantasy|Jul 24, 2008|Dec 2, 2008|$20,847,266|PG-13 (for violent and disturbing content and thematic material)|104|20th Century Fox|Chris Carter, Frank Spotnitz|David Duchovny and Gillian Anderson reprise their roles as Fox Mulder and Dana Scully with this long-delayed big-screen continuation that revives the series six years after it headed off the air in 2002. Creator Chris Carter returns to direct, co-writing the script with series veteran Frank Spotnitz for 20th Century Fox. Billy Connolly, Amanda Peet and rapper Xzibit co-star in the stand-alone sequel.|4.8/10|165|51|114|4.6/10|37|11|26|2.8/5|253,691
770677583|Encounters at the End of the World|Werner Herzog|Documentary|Sep 1, 2007|Nov 18, 2008|$723,966|G|99|ThinkFilm|Werner Herzog|"Werner Herzog confirms his standing as poet laureate of men in extreme situations with ""Encounters at the End of the World."" In this visually stunning exploration, Herzog travels to the Antarctic community of McMurdo Station, headquarters of the National Science Foundation and home to 1,100 people during the austral summer (Oct-Feb). Over the course of his journey, Herzog examines human nature and Mother nature, juxtaposing breathtaking locations with the profound, surreal, and sometimes absurd experiences of the marine biologists, physicists, plumbers, and truck drivers who choose to form a society as far away from society as one can get."|7.6/10|110|103|7|8/10|30|30|0|3.5/5|35,814
770675607|Wanted|Timur Bekmambetov|Action & Adventure, Mystery & Suspense, Science Fiction & Fantasy|Jun 12, 2008|Dec 2, 2008|$134,294,280|R (for strong bloody violence throughout, pervasive language and some sexuality)|110|Universal Pictures|J.G. Jones, Chris Morgan, Derek Haas, Michael Brandt|Wesley's (James McAvoy) life is over - his pathetic old one, anyway... Fortunately, it is all because of a girl. Enter sizzling-hot Fox (Angelina Jolie), who crashes into his life and introduces him to the Fraternity, a secret society of assassins, led by the enigmatic Sloan (Morgan Freeman). Seems Wes's long-lost father was killed while working for the Fraternity and Wes has been selected to target the rogue member who murdered him. But before he can complete his assignment, Wes must first uncover the dark secrets behind the Fraternity in order to determine his own destiny. -- (C) Universal|6.6/10|203|144|59|6.5/10|45|31|14|3.6/5|1,546,049
