770682499|Flow: For Love of Water|Irena Salina|Documentary, Special Interest|Jan 20, 2008|Dec 9, 2008||G|84|New Day Films||Irena Salina directs this feature-length documentary about the industry and consumption of humankind's most precious resource: water. As African villages survive on potentially toxic water supplies out of sheer necessity, Salina explores how the corporate structure has come to control humanity's water supply, creating a dire situation that experts have come to refer to as the World Water Crisis. With issues of pollution, politics, and human rights all coming to a head with the issue, Salina points the finger at the specific corporate and governmental figures responsible for the crisis, and takes a look at how grassroots organizations work to fight the increasing privatization of water, hoping to end the imbalance in access to the precious resource that has already had mortal consequences for so many. ~ Cammila Albertson, Rovi|6.6/10|48|39|9|6.6/10|17|14|3|3.9/5|1,532
770682459|Baghead|Jay Duplass, Mark Duplass|Comedy, Drama|Jun 13, 2008|Dec 27, 2008||R (for language, some sexual content and nudity)|88|Sony Pictures Classics|Jay Duplass, Mark Duplass|"While the Duplass Brothers were shooting their last feature film ""The Puffy Chair,"" a crew member raised the question ""what's the scariest thing you can think of?"" Someone immediately said ""a guy with a bag on his head staring into your window."" Some agreed, but some thought it was downright ridiculous and, if anything, funny (but definitely not scary). Thus, ""Baghead"" was born, an attempt to take the absurdly low-concept idea of a ""guy with a bag on his head"" and make a funny, truthful, endearing film that, maybe, just maybe, was a little bit scary, too."|6.6/10|95|75|20|7/10|34|28|6|3/5|3,055
770682451|American Teen|Nanette Burstein|Documentary, Special Interest|Jan 19, 2008|Dec 21, 2008|$785,817|PG-13 (for some strong language, sexual material, some drinking and brief smoking-all involving teens)|101|Paramount Vantage|Nanette Burstein|"""American Teen"" follows the lives of five teenagers--a jock, a popular girl, a heartthrob, an artsy girl and a geek--in one small town in Indiana through their senior year of high school. We see the insecurities, the cliques, the jealousies, the first loves and heartbreaks, and the struggle to make profound decisions about the future. Filming daily for 10 months, filmmaker Nanette Burstein developed a deep understanding of her subjects. The result is a film that goes beyond the enduring stereotypes of high school to render complex young people trying to find their way into adulthood. With extraordinary intimacy and a great deal of humor, ""American Teen"" captures the pressures of growing up--pressures that come from one's peers, one's parents, and not least, oneself."|6.5/10|151|105|46|6.7/10|41|30|11|3/5|102,256
770681647|Ghost Town|David Koepp|Comedy, Documentary, Science Fiction & Fantasy, Special Interest|Sep 5, 2008|Dec 27, 2008|$13,214,030|PG-13 (for some strong language, sexual humor and drug references)|102|DreamWorks/Paramount Distribution|David Koepp, John Kamps|Bertram Pincus is a man whose people skills leave much to be desired. When Pincus dies unexpectedly, but is miraculously revived after seven minutes, he wakes up to discover that he now has the annoying ability to see ghosts. Even worse, they all want something from him, particularly Frank Herlihy, who pesters him into breaking up the impending marriage of his widow Gwen.|6.9/10|184|156|28|6.8/10|43|37|6|3.3/5|432,924
770681327|The House Bunny|Fred Wolf (II)|Comedy|Aug 22, 2008|Dec 19, 2008|$48,237,389|PG-13 (for sex-related humor, partial nudity and brief strong language)|97|Sony Pictures/Columbia|Karen McCullah Lutz, Kirsten Smith|When Playboy playmate Shelley (Anna Faris) is unceremoniously evicted from Hugh Hefner's lavish mansion in order to make room for some younger beauties, her quest for employment finds her serving as den mother to an unpopular L.A. sorority in this Happy Madison production directed by Fred Wolf. Colin Hanks, Rumer Willis, Katharine McPhee, Monet Mazur, and Beverly D'Angelo co-star. ~ Jason Buchanan, Rovi|5.2/10|123|53|70|5.4/10|30|13|17|3.2/5|211,345
770680865|Mamma Mia!|Phyllida Lloyd|Comedy, Musical & Performing Arts, Romance|Jun 30, 2008|Dec 16, 2008|$143,704,210|PG-13 (for some sex-related comments)|109|Universal Pictures|Catherine Johnson|Longing to discover the identity of her true father before she exchanges her wedding vows, the daughter of a once-rebellious single mother secretly invites a trio of paternal candidates to her upcoming wedding in this feature adaptation of the beloved stage musical. Independent-minded single mother Donna (Meryl Streep) has always done her best to raise her spirited daughter, Sophie (Amanda Seyfried), while simultaneously running a successful hotel on a small Greek island, but now the time has come for this hardworking mom to finally let go. In just a few days, Sophie will be married, and Donna will stand by bittersweetly as her little girl takes flight. Of course, Donna's lifelong friends Rosie (Julie Walters) and Tanya (Christine Baranski) will both be present at the wedding, but unbeknownst to the mother, Sophie has furtively invited three very special guests of her own. When Sophie walks down the aisle on that fateful day, she wants her father to hand her off. The only problem is that Donna has never revealed the true identity of Sophie's father, leaving the resourceful future bride to narrow the list down to three potential candidates. Now, as three key figures from Donna's past return to the picturesque Mediterranean shores they all walked 20 years prior, one beautiful bride will discover the secret of her past while one lonely mother finds out that it's never too late for a little romance. Phyllida Lloyd, director of both the original London sensation as well as the hit Broadway incarnation, makes her feature directorial debut with this big-screen version of the beloved musical featuring 22 classic ABBA hits. Pierce Brosnan, Colin Firth, Stellan Skarsgård, and Dominic Cooper co-star. ~ Jason Buchanan, Rovi|5.5/10|181|99|82|5.1/10|44|19|25|3.6/5|438,073
770680850|Make It Happen|Darren Grant|Drama, Romance|Aug 8, 2008|Dec 9, 2008||PG-13 (for sequences of sensuality)|90|The Weinstein Co./MGM|Duane Adler, Nicole Avril|Grindhouse star Mary Elizabeth Winstead headlines the dance-themed picture Make It Happen -- a bleak drama about a small-town girl who migrates to the Windy City, where she hopes to build a career as a respected dancer. Instead, her life spirals hopelessly downward and she ends up working at a burlesque club to pay the bills and support herself. Scribe Duane Adler -- known for such dance-themed pictures as Step Up and Save the Last Dance -- authored the script; Darren Grant (Diary of a Mad Black Woman) directs.|4.2/10|18|4|14|||||3.3/5|13,107
770679727|Battle for Haditha|Nick Broomfield|Art House & International, Drama|Dec 14, 2007|Dec 30, 2008||R (for war violence, disturbing images, and for pervasive language)|93|HanWay Films|Nick Broomfield, Marc Hoeferlin, Anna Telford|The fate of two cultures becomes locked on a tragic collision course in director Nick Broomfield's dramatization of the events that led to the massacre of 24 Iraqi men, women, and children by American Marines. A squadron of American soldiers goes speeding across the Iraqi desert in a convoy of armored Humvees, eventually stopping at a local store where the soldiers jump out to stretch and browse the DVD selection. Meanwhile, as the Marines strike up a conversation with the young male clerk behind the counter, two Iraqi men climb into the back of a pick-up truck to get a crash course in IED mechanics. Both the Marines and the Iraqis are simply going about their daily business as usual, just doing their best to survive in a land where war is just another fact of life. For the Marines it's all about patrolling the desert and waiting for the next bomb to go off. When a roadside IED kills one Marine and wounds two others, the vengeance with which the American soldiers strike back at the locals may cause even the most hard-line warhawks to take pause and consider the true cost of a war which has no end in sight.|6.1/10|30|20|10|6.9/10|14|12|2|3.6/5|3,034
770677906|Anamorph|H.S. Miller|Drama, Mystery & Suspense|Apr 16, 2008|Dec 9, 2008||R (for distributing grisly images, some violence and language)|103|IFC First Take|Henry Miller, Tom Phelan, H.S. Miller|"A haunted New York City detective must delve into his dark past in order to stop a serial killer whose highly artistic modus operandi seems uncannily similar to that of a madman who stalked the city streets five years prior. When reclusive detective Stan Aubray (Willem Dafoe) gunned down the man suspected of being the ""Uncle Eddie"" murderer, he thought his nightmare had come to an end. But now a new crop of victims has begun to turn up, each bearing the distinctive mark of the maniac whom everyone had presumed to be dead. Much like the unfortunate victims of ""Uncle Eddie,"" the bodies in this latest batch have been carefully arranged in a manner that reflects the artistic style known as anamorphosis -- where hidden meanings can be revealed by viewing the crime scenes from different perspectives. Could this be the work of a copycat killer, or is it possible that Detective Aubray and his men killed the wrong man on that fateful day five years ago? All signs indicate that the latest killings were carried out with Detective Aubray specifically in mind, prompting him to reexamine the painful questions that he had struggled all these years to suppress. On one side, Detective Aubray faces the scrutiny of a bright young detective (Scott Speedman) who has his own unique ideas about the killings, and on the other, a disturbed young woman (Clea Duvall) who proves a dangerous link to Detective Aubray's mystery-shrouded past. Only by confronting the possibility that he fears most will Detective Aubray finally be able to overcome his own stifling sense of guilt and finally uncover the truth about the most gruesome crimes ever committed in New York City. ~ Jason Buchanan, Rovi"|4.6/10|26|7|19|5/10|9|4|5|2.6/5|3,102
770675744|Eagle Eye|D.J. Caruso|Drama, Mystery & Suspense|Sep 16, 2008|Dec 27, 2008|$101,111,837|PG-13 (for intense sequences of action and violence, and for language)|117|Paramount Studios|Hillary Seitz, John Glenn, Travis Wright, Dan McDermott|Shia LaBeouf and Michelle Monaghan star in Disturbia director D.J. Caruso's race-against-time thriller concerning two strangers thrust together by a mysterious telephone call, and their frantic efforts to discover why they have inexplicably become the nation's most wanted fugitives. Jerry Shaw (LaBeouf) and Rachel Holloman (Monaghan) were complete strangers at the beginning of the day, but that changed the instant a strange woman called to threaten both their lives and the lives of their loved ones. Suddenly forced into a series of increasingly dangerous situations, Jerry and Rachel must now take orders from a woman who's using everyday technology to track and control their every move. As the situation intensifies and the hapless duo are deemed the country's most wanted fugitives, they must work together in order to discover who it was that turned their lives upside down, and what they can do to thwart the criminal mastermind's cunning yet diabolical plan. Billy Bob Thornton, Rosario Dawson, Michael Chiklis, and Anthony Mackie co-star. ~ Jason Buchanan, Rovi|4.7/10|179|48|131|4.5/10|41|7|34|3.6/5|307,323
770674034|Savage Grace|Tom Kalin|Drama|May 18, 2007|Dec 23, 2008|$243,055|NR|94|IFC First Take|Howard A. Rodman|"""Savage Grace"" tells the incredible true story of Barbara Daly, who married above her class to Brooks Baekeland, the dashing heir to the Bakelite plastics fortune. Beautiful, red-headed and charismatic, Barbara is still no match for her well-bred husband. The birth of the couple's only child, Tony, rocks the uneasy balance in this marriage of extremes. Tony is a failure in his father's eyes. As he matures and becomes increasingly close to his lonely mother, the seeds for a tragedy of spectacular decadence are sown. Spanning 1946 to 1972, the film unfolds in six acts. The Baekelands' pursuit of social distinction and the glittering ""good life"" propels them across the globe. We follow their heady rise and tragic fall against the backdrop of New York, Paris, Cadaques, Mallorca and London."|5/10|92|35|57|4.9/10|32|12|20|2.9/5|12,772
770671944|Burn After Reading|Joel Coen, Ethan Coen|Comedy, Drama|Aug 27, 2008|Dec 21, 2008|$60,338,891|R (for pervasive language, some sexual content and violence)|96|Focus Features|Joel Coen, Ethan Coen|"At the headquarters of the Central Intelligence Agency in Arlington, Va., analyst Osborne Cox arrives for a top-secret meeting. Unfortunately for Cox, the secret is soon out: he is being ousted. Cox does not take the news particularly well and returns to his Georgetown home to work on his memoirs and his drinking, not necessarily in that order. His wife Katie is dismayed, though not particularly surprised; she is already well into an illicit affair with Harry Pfarrer, a married federal marshal, and sets about making plans to leave Cox for Harry. Elsewhere in the Washington, D.C., suburbs, and seemingly worlds apart, Hardbodies Fitness Centers employee Linda Litzke can barely concentrate on her work. She is consumed with her life plan for extensive cosmetic surgery, and confides her mission to can-do colleague Chad Feldheimer. Linda is all but oblivious to the fact that the gym's manager Ted Treffon pines for her even as she arranges dates via the Internet with other men. When a computer disc containing material for the CIA analyst's memoirs accidentally falls into the hands of Linda and Chad, the duo are intent on exploiting their find. As Ted frets, ""No good can come of this,"" events spiral out of everyone's and anyone's control, in a cascading series of darkly hilarious encounters."|6.9/10|238|185|53|6.3/10|51|33|18|3.3/5|187,620
770671911|Death Race|Paul W.S. Anderson|Action & Adventure, Mystery & Suspense, Science Fiction & Fantasy|Aug 21, 2008|Dec 21, 2008|$36,064,910|R (for strong violence and language)|105|Universal Pictures|Paul W.S. Anderson|The Transporter star Jason Statham takes the wheel in director Paul W.S. Anderson's remake of the Roger Corman classic about a hyper-violent cross-country race that breaks all of the traditional rules of the road. The time is the not-so-distant future, and as America's prisons begin overflowing with violent criminals, the powers that be devise a grisly game that will free up space in the cells and entertain the masses at the same time. Jensen Ames (Statham) is a three-time speedway champion with a dark past. A survival expert and ex-con whose sordid history comes back to haunt him when he is framed for a murder he didn't commit, Ames is forced to choose between donning the metallic mask of a mythical racer known as Frankenstein or languishing away on Terminal Island -- America's most notorious penitentiary. Over the course of the next three days, this unlikely champion will get behind the wheel of a nightmare machine outfitted with machine guns, grenade launchers, and flamethrowers in a desperate attempt to outrun some of the most violent criminals ever imprisoned. Should Ames be the first to cross the checkered flag, he will win his freedom; should he come in second, however, death would be preferable to a grim future in a cramped concrete cell. Co-stars include Joan Allen, Ian McShane, Natalie Martinez, and Tyrese Gibson, who takes over the role of Machine Gun Joe, made famous by Sylvester Stallone in the original. ~ Jason Buchanan, Rovi|4.8/10|157|66|91|5/10|30|12|18|3.5/5|207,631
770671522|The Mummy: Tomb of the Dragon Emperor|Rob Cohen, Simon Duggan|Action & Adventure, Comedy, Drama|Jul 24, 2008|Dec 16, 2008|$101,600,000|PG-13 (for adventure and violence)|112|Universal Pictures|Alfred Gough, Miles Millar|The Fast and the Furious director Rob Cohen continues the tale set into motion by director Stephen Sommers with this globe-trotting adventure that finds explorer Rick O'Connell and son attempting to thwart a resurrected emperor's (Jet Li) plan to enslave the entire human race. It's been 2,000 years since China's merciless Emperor Han and his formidable army were entombed in terra cotta clay by a double-dealing sorceress (Michelle Yeoh), but now, after centuries in suspended animation, an ancient curse is about to be broken. Thanks to his childhood adventures alongside father Rick (Brendan Fraser) and mother Evelyn (Maria Bello), dashing young archeologist Alex O'Connell (Luke Ford) is more than familiar with the power of the supernatural. After he is tricked into awakening the dreaded emperor from his eternal slumber, however, the frightened young adventurer is forced to seek out the wisdom of his parents -- both of whom have had their fair share of experience battling the legions of the undead. Should the fierce monarch prove capable of awakening his powerful terra cotta army, his diabolical plan for world domination will finally be set into motion. Of course, the one factor that this emperor mummy failed to consider while solidifying his power-mad plans was the O'Connells, and before this battle is over, the monstrous monarch will be forced to contend with the one family that isn't frightened by a few rickety reanimated corpses. ~ Jason Buchanan, Rovi|3.7/10|173|22|151|3.7/10|43|5|38|2.9/5|340,630
770669822|Dr. Seuss' Horton Hears a Who!|Steve Martino, Jimmy Hayward|Action & Adventure, Animation, Kids & Family|Mar 3, 2008|Dec 9, 2008|$154,388,002|G|86|20th Century Fox|Cinco Paul, Ken Daruio|Horton the Elephant struggles to protect a microscopic community from his neighbors who refuse to believe it exists.|7/10|132|104|28|7/10|37|29|8|3.6/5|415,447
769959054|The Dark Knight|Christopher Nolan|Action & Adventure, Drama, Science Fiction & Fantasy|Jul 18, 2008|Dec 9, 2008|$533,316,061|PG-13 (for intense sequences of violence and some menace)|152|Warner Bros. Pictures/Legendary|Christopher Nolan, Jonathan Nolan|Christopher Nolan steps back into the director's chair for this sequel to Batman Begins, which finds the titular superhero coming face to face with his greatest nemesis -- the dreaded Joker. Christian Bale returns to the role of Batman, Maggie Gyllenhaal takes over the role of Rachel Dawes (played by Katie Holmes in Batman Begins), and Brokeback Mountain star Heath Ledger dons the ghoulishly gleeful Joker makeup previously worn by Jack Nicholson and Cesar Romero. Just as it begins to appear as if Batman, Lt. James Gordon (Gary Oldman), and District Attorney Harvey Dent (Aaron Eckhart) are making headway in their tireless battle against the criminal element, a maniacal, wisecracking fiend plunges the streets of Gotham City into complete chaos. ~ Jason Buchanan, Rovi|8.6/10|331|312|19|8.2/10|53|49|4|4.4/5|1,830,714
691076729|Welcome to Dongmakgol|Park Gwang-hyeon, Park Kwang-Hun|Action & Adventure, Comedy, Drama|Aug 4, 2005|Dec 23, 2008||NR|133|Asian Crush|Park Gwang-hyeon, Kim Jung, Jang Jin|Opening in September of 1950, after U.S.-led forces had landed in Incheon, turning the tide of the Korean War, Welcome to Dongmakgol tells the (fictional) story of a remote little village where the residents have never seen guns, and are completely ignorant of the conflict going on in their country. Their simple, quiet lives are disrupted when an American pilot, Smith (Steve Taschler), crashes just outside the village. While the kindly villagers tend to Smith's injuries, a pair of North Korean soldiers, young gung-ho Seo Taek-gi (Ryu Deok-hyeon) and the older Jang Young-hee (Lim Ha-ryong), and their commander, Lee Su-hwa (Jeong Jae-yeong), as well as a pair of South Korean soldiers, deserter Pyo Hyun-chul (Shin Ha-kyun of Save the Green Planet!) and medic Mun Sang-sang (Seo Jae-gyeong), all find themselves stranded in the little village. There's a lengthy standoff, but when the soldiers accidentally destroy the town's food supply, they all reluctantly agree to work together to help the town restore the food so they'll survive the coming winter. Before long, the soldiers begin to connect with one another and form a strong bond with the locals. There's even a budding romance between Taek-gi and a kooky, carefree village girl, Yeo-il (Kang Hye-jeong). Unfortunately for everyone, UN forces believe that Smith was shot down by North Korean forces, and are prepared to bomb the region to protect an important supply route. Welcome to Dongmakgol was a surprise blockbuster in South Korea. The film marks the feature debut of writer/director Park Gwang-hyeon, and is based on a play by Jang Jin. It had its U.S. premiere at the 2006 New York Asian Film Festival, presented by Subway Cinema.|6.6/10|7|6|1|||||4.2/5|3,710
611219118|I Do (Prête-moi ta main)|Eric Lartigau|Comedy||Dec 9, 2008||NR|90|Alliance Atlantis Vivafilm|Philippe Mechelen, Laurent Tirard, Grégoire Vigneron, Alain Chabat, Laurent Zeitoun|Life is easy for 43-year-old Luis, a happy single guy, fulfilled in his job of star nose with a perfume creation company, cosseted by his mother and five sisters. It could have lasted for a whole life, but fed up with mollycoddling and helping him, his mother and sisters decide it's time he got married, and the sooner the better!Surrounded and hounded by his family who think only of marrying him off, he comes up with an infallible plan: he'll find the perfect woman who'll pretend to be his fiancee and then, on the day of the wedding, will cruelly dump him. After that, for certain no one will dare even mention the word 'marriage' in front of him. But how do you go about finding such a gem? Luis sees only one solution: hire her! And it just so happens that Emma, his best friend and colleague's sister, has recently arrived in Paris and is looking for a job. The plan is underway. At the end of it lies Luis' freedom!|5/10|15|8|7|||||3.6/5|5,042
573371291|Amu|Shonali Bose|Drama|Mar 17, 2006|Dec 2, 2008||NR|102|Emerging Pictures|Shonali Bose|Kaju, a 21-year-old Indian American woman, returns to India to visit her family, only to stumble upon secrets and lies from her past. A horrifying genocide that took place 20 years ago turns out to hold the key to her mysterious origins.|6.5/10|22|18|4|6.2/10|14|11|3|3.7/5|1,316
371357838|The Women|Diane English|Comedy, Drama|Sep 4, 2008|Dec 19, 2008|$26,814,683|PG-13 (for sex-related material, language, some drug use and brief smoking)|114|Picturehouse Entertainment|Diane English|"Mary Haines is a clothing designer who seems to have it all--a beautiful country home, a rich financier husband, an adorable 11-year-old daughter and a part-time career creating designs for her father's venerable clothing company. Her best friend, Sylvie Fowler, leads another enviable life--a happily single editor of a prominent fashion magazine, a possessor of a huge closet of designer clothes and a revered arbiter of taste and style poised on New York's cutting edge. But when Mary's husband enters into an affair with Crystal Allen, a sultry ""spritzer girl"" lurking behind the Saks Fifth Avenue perfume counter, all hell breaks loose. Mary and Sylvie's relationship is tested to the breaking point while their tight-knit circle of friends, including mega-mommy Edie Cohen and author Alex Fisher, all start to question their own friendships and romantic relationships as well."|3.9/10|147|19|128|3.7/10|39|4|35|3/5|62,059
351526991|Open Window|Mia Goldman|Drama|Sep 1, 2006|Dec 9, 2008||R (for violence involving rape, language, some sexuality and nudity)|97|Image Entertainment|Mia Goldman|Mia Goldman's psychological drama Open Window stars Joel Edgerton and Robbin Tunney as a husband and wife who have intense professional lives, but are able to rely on each other during their time together at home. One night the wife is raped, sending her into a depression that threatens to crumble the marriage. Elliott Gould and Cybil Shepherd portray the wife's parents.|3.8/10|5|1|4|||||3/5|921
