770681151|Body of Lies|Ridley Scott|Drama, Mystery & Suspense|Oct 8, 2008|Feb 17, 2009|$39,380,442|R (for strong violence including some torture, and for language throughout)|128|Warner Bros. Pictures|William Monahan|Fresh off of their success with director Martin Scorsese's The Departed, star Leonardo DiCaprio and screenwriter William Monahan team with director Ridley Scott for this screen adaptation of David Ignatius' novel Body of Lies. When CIA operative Roger Ferris (DiCaprio) uncovers evidence indicating that a major terrorist leader may be operating out of Jordan, he enlists the aid of CIA veteran Ed Hoffman (Russell Crowe) in infiltrating the elusive saboteur's vast underground network. During the course of his dangerous mission, Ferris gradually comes to question how much he can trust his presumed allies -- who include not just Hoffman, but the outwardly helpful head of Jordanian intelligence as well. ~ Jason Buchanan, Rovi|5.9/10|209|115|94|5.6/10|49|27|22|3.5/5|129,932
770680691|Sex Drive|Sean Anders|Comedy|Oct 16, 2008|Feb 24, 2009|$8,364,827|R (for strong crude and sexual content, nudity, language, some drug and alcohol use - all involving teens)|129|Summit Entertainment|Sean Anders, John Morris (XIX)|"Eighteen-year-old Ian Lafferty sets out on a cross country drive with his best friends Lance and Felicia in order to lose his virginity to a red-hot babe he met on the Internet. But the journey, filled with hilarious misadventures and raunchy escapades, teaches all three more than they expected about life and love. Randy, raucous and unexpectedly romantic, ""Sex Drive"" follows three friends on the road trip of a lifetime!"|5.2/10|110|50|60|5.7/10|31|16|15|3.4/5|74,288
770680030|Badland|Francesco Lucente|Drama|Nov 30, 2007|Feb 24, 2009||R (for some strong disturbing violence and pervasive language)|165|Arcangelo Entertainment|Francesco Lucente|"Jerry is a Marine reservist who was a young patriot and idealist when he served in the first Gulf War. But when he is called up for deployment to Afghanistan and Iraq, Jerry is a father of three; older and embittered by a life besieged by broken promises, and unfulfilled desires. Jerry returns a changed man, transformed by horrors committed that go beyond comprehension and sanity, pain inflicted that cannot be forgiven. He lives a life of poverty, his children afraid of his unexplained outbursts of rage, his wife, Nora, unsympathetic to the nosebleeds and night terrors he suffers. She hides money her sons earn from their paper route in case they need to leave. Their crowded trailer home becomes a prison. His failure as a man, his actions as a soldier, is the punishment which they share. He realizes that the respect and dignity he has spent his life trying to achieve will always elude him. When Jerry discovers that Nora has betrayed him, his anger and despair drive him to commit an act so heinous and irreversible that nothing he has experienced in combat could have prepared him for. ""Badland"" is examines the aftermath of war on a returning Iraq war veteran and his family. It is the story of a man who loses his soul and how a daughter's love and faith brings redemption to his unspeakable crimes."|3.7/10|18|3|15|3.9/10|7|2|5|3.3/5|291
770679404|How to Lose Friends & Alienate People|Robert B. Weide|Comedy|May 15, 2008|Feb 17, 2009|$2,458,092|R (for language, some graphic nudity and brief drug material)|110|MGM|Toby Young, Peter Straughan|"Frequent Curb Your Enthusiasm director Robert B. Weide makes his feature directorial debut with this screen adaptation of British writer Toby Young's comedic novel of the same name. When self-promoting scribe Sidney Young (Simon Pegg) accepts a position as a contributing editor for iconic fashion magazine ""Sharps,"" his subsequent attempts to ingratiate himself with both his egotistical boss, Clayton Harding, and the superficial celebrities who populate the pages of the magazine prove disastrously hilarious. ~ Jason Buchanan, Rovi"|5/10|112|41|71|4.3/10|31|7|24|3.1/5|48,718
770679090|The Midnight Meat Train|Ryuhei Kitamura|Drama, Horror, Mystery & Suspense|Aug 14, 2008|Feb 17, 2009|$34,394|R (for sequences of strong bloody gruesome violence, grisly images involving nudity, sexual content and language)|98|Lionsgate Films|Jeff Buhler|Struggling photographer Leon Kauffman's obsessive pursuit of dark subject matter leads him into the path of a serial killer, Mahogany, the subway murderer who stalks late-night commuters -- ultimately butchering them in the most gruesome ways imaginable.|6/10|32|23|9|||||3.1/5|143,498
770677185|Changeling|Clint Eastwood|Drama, Mystery & Suspense|Oct 24, 2008|Feb 17, 2009|$35,707,327|R (for some violent and disturbing content, and language)|141|Universal Pictures|J. Michael Straczynski, Joe Michael Straczynski|Inspired by actual events that occurred in 1920s-era Los Angeles, Clint Eastwood's The Changeling tells the story of a woman driven to confront a corrupted LAPD after her abducted son is retrieved and she begins to suspect that the boy returned to her is not the same boy she gave birth to. The year was 1928, and the setting a working-class suburb of Los Angeles. As Christine (Angelina Jolie) said goodbye to her son, Walter, and departed for work, she never anticipated that this was the day her life would be forever changed. Upon returning home, Christine was distressed to discover that Walter was nowhere to be found. Over the course of the following months, the desperate mother would launch a search that would ultimately prove fruitless. Yet just when it seemed that all hope was lost, a nine-year-old boy claiming to be Christine's son seemed to appear out of thin air. Overcome with emotions and uncertain how to face the authorities or the press, Christine invites the child to stay in her home despite knowing without a doubt that he is not her son. As much as Christine would like to accept the fact that her son has been returned to her, she cannot accept the injustice being pushed upon her and continues to challenge the Prohibition-era Los Angeles police force at every turn. As a result, Christine is slandered by the powers that be, and painted as an unfit mother. In this town, a woman who challenges the system is putting her life on the line, and as the situation grows desperate, the only person willing to aid her in her search is benevolent local activist Reverend Briegleb (John Malkovich).|6.3/10|204|125|79|5.6/10|47|23|24|3.8/5|226,998
770676333|High School Musical 3: Senior Year|Kenny Ortega|Musical & Performing Arts|Oct 24, 2008|Feb 17, 2009|$90,535,406|G|109|Walt Disney Pictures|Peter Barsocchini|Seniors Troy and Gabriella face the prospect of being separated from one another as they head off in different directions to college. Joined by the rest of the Wildcats, they stage an elaborate spring musical reflecting their experiences, hopes and fears about their future. With incredible new music and exciting dance numbers designed to take maximum advantage of the big screen, this motion picture extravaganza delivers plenty of high-energy entertainment from East High's talented ensemble.|5.9/10|128|82|46|5.9/10|33|20|13|3.5/5|354,094
770676002|Religulous|Larry Charles|Comedy, Documentary, Faith & Spirituality|Sep 6, 2008|Feb 17, 2009|$12,995,673|R (for some language and sexual material)|101|Lionsgate Films|Bill Maher|This documentary follows political humorist and author Bill Maher as he travels around the globe interviewing people about God and religion. Known for his analytical skills, wit and commitment to never pulling a punch, Maher brings his characteristic honesty to an unusual spiritual journey.|6.3/10|154|107|47|6/10|40|25|15|3.8/5|39,307
770675037|Self Medicated|Monty Lapica|Art House & International, Drama|Mar 24, 2006|Mar 1, 2009||R (for substance abuse, language and some sexual material)|108|ThinkFilm|Monty Lapica|Monty Lapica's drama Self-Medicated tells the story of a 17-year-old boy who is having a very difficult time dealing with the grief he experiences after his father dies. After the boy slides into a wicked drug addiction, as well as legal problems, his mother reaches the end of her tether and has her son admitted to an adolescent hospital designed to force him into confronting his issues. ~ Perry Seibert, Rovi|5.1/10|36|13|23|4.8/10|17|5|12|3.3/5|814
770674386|Une Vieille Maîtresse (The Last Mistress) (An Old Mistress)|Catherine Breillat|Art House & International, Drama|May 25, 2007|Mar 1, 2009|$621,567|NR|115|IFC Films|Catherine Breillat|Catherine Breillat's adaptation of An Old Mistress stars Fu'ad Ait Aatou as Ryno de Marigny, and Asia Argento as Vellini, two lovers in 19th century Paris. The two have been passionately involved for nearly a decade, but de Marigny attempts to end their relationship now that he is engaged to Hermangarde (Roxane Mesquida), a respectable young woman. As the bride-to-be's grandmother forces de Marigny to confront his past as a notorious womanizer, the film flashes back to reveal the intense decade the lovers shared. Although de Marigny appears to want to shut Vellini out forever, her passions may be far too much for him to deny. ~ Perry Seibert, Rovi|6.7/10|96|74|22|7.6/10|31|29|2|3.4/5|3,172
770674093|Roman de gare|Claude Lelouch|Drama, Mystery & Suspense|May 24, 2007|Mar 1, 2009|$1,735,301|R (for brief language and sexual references)|103|Samuel Goldwyn Films|Claude Lelouch|"Claude Lelouch's thriller Roman de Gare (aka Crossed Tracks) features a number of characters and a timeline that skips back and forth, keeping the audience guessing as to how these characters all relate to each other. Fanny Ardant plays a novelist named Judith whose famous works might have been ghost-written by a serial killer dubbed ""The Magician"" for his habit of performing acts of prestidigitation in front of his victims. Early in the film, the police quiz her about her relationship with the criminal. Other characters include a hairdresser (Audrey Dana) who offers to give a ride to a stranger who may be the killer."|7.1/10|73|64|9|7.1/10|29|24|5|3.7/5|2,755
712557927|Ironweed|Hector Babenco|Art House & International, Drama|Dec 18, 1987|Feb 24, 2009||R (adult situations/language, nudity, violence)|135|Vestron Video|Tom Benedek, William Kennedy|Based on the William Kennedy novel of the same name Ironweed is set in the waning years of the Depression. Jack Nicholson plays Francis Phelan, a washed-up ballplayer (a onetime infielder for the Washington Senators) who deserted his family back in the 1910s when he accidentally killed his infant son by dropping him. Since that time, Phelan has been a shabby barfly, living from drink to drink; he spends his days palling around with Rudy (Tom Waits), with whom he works a motley series of jobs in exchange for a place to lay his head and an occasional jug of wine. Wandering into his hometown of Albany, New York, Phelan blearily seeks out his girlfriend and erstwhile drinking companion of nine years, Helen Archer (Meryl Streep), who has begun prostituting herself for drink and lodging. The two derelicts touch base in a mission managed by minister James Gammon, and later in Fred Gwynne's squalid gin mill. Over the next few days, Phelan takes a few minor jobs to support his habit, while his mind wavers between past and present. Eventually, a chance for a reconciliation with his wife (Carroll Baker) emerges. Directed by Hector Babenco following his enormous success with Kiss of the Spider Woman , Ironweed netted Oscar nominations for Nicholson and Streep.|6.6/10|21|13|8|5.5/10|8|3|5|3.4/5|2,803
546952812|Four Flies on Grey Velvet (4 mosche di velluto grigio)|Dario Argento|Art House & International, Drama, Horror, Mystery & Suspense|Dec 17, 1971|Feb 24, 2009||PG|102|Paramount Pictures|Dario Argento|A drummer's nightmare unfolds after he encounters a malevolent stranger and stumbles into a mystery, culminating in a string of murders, in this tale directed by horror master Dario Argento.|7.1/10|8|6|2|||||3.5/5|1,999
341816613|Islander|Ian McCrudden|Drama|Mar 9, 2007|Feb 17, 2009||R (for language and brief sexuality)|103|Slowhand Releasing|Ian McCrudden, Thomas Hildreth|A man tries to rebuild his life and reconnect with his family after a stretch in prison in this independent drama. Eben Cole (Thomas Hildreth) is a lobster fisherman who lives and works on a small island off the coast of Maine. Eben takes pride in his work and works hard to provide for his wife, Cheryl (Amy Jo Johnson), and daughter, Sara (Mackenzie Young). However, Eben also has a temper, and when a pair of commercial fishermen from the mainland try to take over one of his fishing spots, the argument escalates into violence. Eben's attack on the fishermen earns him five years behind bars, and his father (Larry Pine) tells him he'll no longer have anything to do with him. After serving his time, Eben is released from jail only to find that many of his worst fears have been confirmed: Cheryl refuses to see him anymore, she's moved in with Jimmy (Mark Kiely), another local lobster trapper, and she won't allow Eben to visit with Sara (now played by Emma Ford). Regarded as a black sheep by the local fisherman, Eben takes a job at a scrap yard to keep body and soul together, but it's not until Popper (Philip Baker Hall), a veteran fisherman, befriends him that he begins to regain his self-respect and show the world he's changed. Islander was screened at the 2006 Los Angeles Film Festival.|7/10|8|7|1|||||3.3/5|1,628
770801882|Luck by Chance|Zoya Akhtar|Comedy, Mystery & Suspense|Jan 30, 2009|Mar 17, 2009|$326,187|NR|156|Adlabs Films|Javed Akhtar, Javed Akhtar, Zoya Akhtar|A Bollywood starlet and a struggling newcomer are brought together by kismet, working their way through the Hindi film industry as romance blossoms and their lives are forever changed. Arriving in Bombay with stars in her eyes and dreams of success, Sona has the luxury of a rented apartment, and passes the time in the company of her loyal friends. Everyone has a dream in this city, and as Sona works hard to make a name for herself on the big screen, Vikram leaves his parents' Delhi home and sets his sights on the city. Vikram's no fool; he has a way of getting what he wants, and when he meets Sona, the sparks start to fly. Meanwhile, superstitious producer Romy Rolly is developing a potential blockbuster designed to launch the career of 18-year-old Nikki, the daughter of '70s-era superstar Neena. Headlining the film is Rolly's biggest star, box-office heavy Zaffar Khan. When things start going south on Rolly's film, Vikram is called in for an audition. One audition is all Vikram needs in order to make a big impression, and before long things are looking decidedly brighter for all involved. ~ Jason Buchanan, Rovi|6.8/10|12|9|3|3.8/10|5|2|3|3.4/5|7,178
770801374|In the Electric Mist|Bertrand Tavernier|Drama, Mystery & Suspense|Mar 3, 2009|Mar 3, 2009||R (for violence, language and brief sexuality/nudity)|117|Image Entertainment|Mary Olson-Kromolowski, Jerzy Kromolowski, Tommy Lee Jones, Marco Beltrami|A detective tracking a serial killer who preys on young women finds his investigation complicated by a glamorous Hollywood starlet and a ruthless crime kingpin in director Bertrand Tavernier's adaptation of the James Lee Burke novel In the Electric Mist with Confederate Dead. Jerzy Kromolowski, Mary Olson-Kromolowski, and Tommy Lee Jones collaborate on the screenplay for the film, which stars Jones, John Goodman, Peter Sarsgaard, Ned Beatty, and Tom Sizemore.|6.1/10|11|7|4|||||2.9/5|60,810
770798813|Lake City|Perry Moore, Hunter Hill|Drama, Mystery & Suspense|Nov 7, 2008|Mar 3, 2009||R (for language and some violence)|93|Screen Media Films|Hunter Hill, Perry Moore|Sissy Spacek, Troy Garity, and music icon Dave Matthews star in this tale of an estranged mother and son who reluctantly come together in hopes of saving their home. Maggie (Spacek) and Billy (Garity) are a desperate mother and damaged son who went their separate ways following a long-ago tragedy. South African-born singer/songwriter Matthews portrays a drug dealer willing to harm anyone keeping him from recovering cocaine that was stolen from him by Billy's troubled wife.|3.6/10|26|3|23|3.4/10|15|2|13|2.9/5|3,672
770796579|Cadillac Records|Darnell Martin|Drama, Musical & Performing Arts|Dec 5, 2008|Mar 10, 2009|$8,134,217|R (for pervasive language and some sexuality)|108|Sony Pictures|Darnell Martin|"""Cadillac Records"" is about the rise and fall of Chess Records, which launched the careers of Muddy Waters, Etta James and Chuck Berry. Leonard Chess scoured the South, checking out the various blues scenes and selling records from the back of his Cadillac."|6.1/10|121|80|41|6.2/10|42|28|14|3.4/5|63,203
770795897|The Village Barbershop|Chris Ford|Comedy, Drama|Dec 1, 2008|Mar 3, 2009||R (for language, some sexual content, nudity and drug material)|99|Monterey Media|Chris Ford|Hair is the only thing two people have in common before they come into each other's lives in this independent comedy-drama. For thirty years, Arthur Leroldi (John Ratzenberger) has operated a barbershop with his business partner Enzo. Arthur is a fine barber, but Enzo is the member of the team with the business sense and a talent for charming people, so when Enzo suddenly dies, Arthur soon finds himself flirting with bankruptcy. As Arthur scrambles to pay his bills, his landlord Jacobi (Amos Glick) would love nothing more than to move a higher paying tenant into his place. Arthur advertises for a new barber to help him run the shop, and his best applicant turns out to be Gloria (Shelly Cole); while Arthur doesn't like the idea of having a woman working in the shop, she's a licensed and experienced cosmetologist, she knows how to keep track of the books, and customers like her. Sharon may be a boon to business, but she has some serious problems of her own; her boyfriend has just left her, she has no where to live besides the trailer she's swiped from her ex, and she's just found out she's pregnant. The Village Barbershop was the first feature film from writer and director Chris Ford. ~ Mark Deming, Rovi|6.7/10|5|4|1|||||3.5/5|320
770784406|Wonder Woman|Lauren Montgomery|Action & Adventure, Animation, Drama, Kids & Family|Mar 3, 2009|Mar 3, 2009||PG-13 (for violence throughout and some suggestive material)|93|Warner Bros. Animation|Michael Jelenic|A graceful Amazon princess of untold strength and beauty attempts to prevent the god of war from instigating a conflict that will last for centuries and destroy the human race as the animated adventure marking the return of DC Comics heroine Wonder Woman. On the mystical island of Themyscira lives a fierce race of warrior Amazons who have raised a powerful daughter named Princess Diana. The Amazons live in secrecy from the outside world, but when Army fighter pilot Steve Travor crash-lands in their tropical paradise, the headstrong princess defies the law of the land by accompanying Trevor back to civilization. But her transition into the modern world won't be an easy one, because when Ares escapes from his Amazonian prison and begins plotting his revenge, Princess Diana is the only person who stands between the god of war, and the destruction of the human race - beginning with the Amazons. Now, as Princess Diana harnesses her unique powers to boldly fight back against Ares and save the planet from certain destruction, Wonder Woman is born and the battle for civilization begins.|7.1/10|10|9|1|||||3.8/5|8,508
770784369|Role Models|David Wain|Comedy|Nov 7, 2008|Mar 10, 2009|$67,300,000|R (for crude and sexual content, strong language and nudity)|99|Universal Pictures|David Wain, Ken Marino, Paul Rudd, Tim Dowling|Danny and Wheeler trash a company truck on an energy drink-fueled bender. Upon their arrest, the court gives them a choice: do hard time or spend 150 service hours with a mentorship program. After one day with the kids, however, jail doesn't look half bad. Surrounded by annoying do-gooders, Danny struggles with his every neurotic impulse to guide Augie through the trials of becoming a man. Unfortunately, the guy just dumped by his girlfriend has only sarcasm to offer a bashful 16-year-old obsessed with medieval role play. Meanwhile, charming Wheeler tries to trade in an addiction to partying and women to assist a fifth-grader named Ronnie redirect his foul-mouthed ways. It would probably help if Ronnie's new mentor wasn't an overgrown adolescent whose idea of quality time includes keggers in Venice Beach. Once the center's ex-con director gives them an ultimatum, Danny and Wheeler are forced to tailor their brand of immature wisdom to their charges. And if they can just make it through probation without getting thrown in jail, the world's worst role models will prove that, sometimes, it takes a village idiot to raise a child.|6.5/10|161|124|37|6.3/10|42|29|13|3.6/5|278,482
770784042|Rachel Getting Married|Jonathan Demme|Drama, Romance|Sep 3, 2008|Mar 10, 2009|$12,748,504|R (for language and brief sexuality)|113|Sony Pictures Classics|Jenny Lumet|When Kym returns to the Buchman family home for the wedding of her sister Rachel, she brings a long history of personal crisis, family conflict and tragedy along with her. The wedding couple's abundant party of friends and relations has gathered for a joyful weekend of feasting, music and love, but Kym--with her biting one-liners and flair for bombshell drama--is a catalyst for long-simmering tensions in the family dynamic.|7.4/10|198|166|32|7.8/10|49|45|4|3.3/5|37,850
770771479|The Boy in the Striped Pajamas (The Boy in the Striped Pyjamas)|Mark Herman|Drama|Nov 7, 2008|Mar 10, 2009|$9,030,581|PG-13 (for some mature thematic material involving the Holocaust)|106|Miramax|Mark Herman|"Vera Farmiga, David Thewlis, and Asa Butterfield star in Little Voice writer/director Mark Herman's adaptation of John Boyne's novel concerning the forbidden friendship that between an eight-year-old German boy and a Jewish concentration camp prisoner in World War II-era Germany. The innocent son of a high-ranking Nazi commandant, Bruno has been largely shielded from the harsh realities of the war. When Bruno discovers that his father has been promoted and that their family will be moving from Berlin into the countryside, he doesn't take the news well. Increasingly bored in his sprawling yet dreary country abode and forbidden by his mother from exploring the backyard, young Bruno searches for something to do while his older sister plays with dolls and vies for the attention of handsome Lieutenant Kotler (Rupert Friend). One day, bored and gazing out his bedroom window, Bruno spies what first appears to be a nearby farm; his parents refuse to discuss it, and all of the inhabitants there are curiously clad in striped pajamas. But while Bruno's mother naïvely believes the ""farm"" to be an internment camp, her husband has sworn under oath never to reveal that it is in fact an extermination camp specifically designed to help the Nazis achieve their horrific ""Final Solution."" Eventually defying his mother's rules and venturing out beyond the backyard, Bruno arrives at a barbed wire fence to find a young boy just his age emptying rubble from a wheel barrel. Like Pavel, the kitchen worker who cooks all of Bruno's meals, the young boy is wearing striped pajamas. His name is Shmuel (Jack Scanlon), and before long the two young boys become fast friends. But the closer these two boys grow, the more Bruno becomes awakened to the horrors unfolding all around them. His mother is catching on quickly as well, a fact that causes great tension in her marriage to Bruno's father. Later, after Bruno swipes a piece of cake for Shmuel, Lt. Kotler accuses the Jewish boy of stealing and delivers a swift punishment. When Bruno's father announces that the young boy and his mother will be going to live with their aunt in Heidelberg, Bruno grabs a shovel and makes his way to the camp, setting into motion a tragic and devastating sequence of events. ~ Jason Buchanan, Rovi"|6.3/10|137|86|51|6.5/10|35|23|12|3.9/5|114,307
