770681977|The A-Team|Joe Carnahan|Action & Adventure, Comedy|Jun 11, 2010|Dec 14, 2010|$77,213,489|PG-13 (for intense sequences of action and violence throughout, language and smoking)|119|20th Century Fox|Joe Carnahan, Brian Bloom, Skip Woods|"Director Joe Carnahan resurrects the popular 1980s-era action series with this explosive reboot following the adventures of four Iraq War veterans who begin a second career as mercenaries for hire. Col. John ""Hannibal"" Smith (Liam Neeson), Templeton ""Face"" Peck (Bradley Cooper), B.A. Baracus (Quinton ""Rampage"" Jackson), and H.M. ""Howlin' Mad"" Murdock (Sharlto Copley) are a group of former Special Forces operatives who have been fighting the good fight for eight years when they're sentenced to military prison for a crime they didn't commit. Breaking out with relative ease, they embark on a treacherous quest to clear their names while being hunted across the globe by Charissa Sosa (Jessica Biel), a high-ranking military officer and one of Face's many former lovers. Meanwhile, mysterious CIA operative Lynch (Patrick Wilson) offers tips that help point the federal fugitives in the right direction, which seems to lead straight to former military contractor Pike (Brian Bloom), who may have been responsible for setting them up in the first place. Just when it seems that the A-Team has all the evidence needed to prove their innocence, however, they discover that their latest mission is just getting started. ~ Jason Buchanan, Rovi"|5.4/10|210|101|109|5.1/10|41|16|25|3.6/5|199,344
770682481|A Complete History of My Sexual Failures|Chris Waitt|Comedy, Documentary, Special Interest||Dec 14, 2010||NR|90|Optimum Releasing||Freshly dumped and deeply despondent over what seems to be an endless string of disastrous relationships, lovelorn filmmaker Chris Waitt attempts to root out the source of his romantic woes by tracking down each of his ex-girlfriends and asking them point blank about his shortcomings as a boyfriend. The answers Waitt receives are frequently as pointed as his questions, providing unguarded insight into the psyche of a self-absorbed, semi-delusional Lothario who rarely managed to arrive for a date on time much less follow through on his pillow-talk promises. Later taken to task by his own mother, the long-suffering relationship bungler eventually turns to therapy, acupuncture, and even Viagra in hopes of learning the secrets to loving like a true grown-up. ~ Jason Buchanan, Rovi|5.5/10|9|5|4|||||3.3/5|2,407
770686296|Micmacs (Micmacs à tire-larigot)|Jean-Pierre Jeunet|Art House & International, Comedy|May 28, 2010|Dec 14, 2010|$1,260,917|R (for some sexuality and brief violence)|105|Sony Pictures Classics|Jean-Pierre Jeunet, Guillaume Laurant|Bazil doesn't have much luck with weapons. The first made him an orphan, the second holds him on the brink of sudden, instant death. Released from the hospital after his accident, Bazil is homeless. Luckily, he is taken in by a motley crew of junkyard dealers. The group's talents and aspirations are as surprising as they are diverse: Remington, Calculator, Buster, Slammer, Elastic Girl, Tiny Pete and Mama Chow. Then one day, Bazil recognizes the logos of the weapons manufacturers that caused all of his misfortune. He sets out to take revenge, with the help of his faithful gang of wacky friends. The gang relives the battle of David and Goliath, with all the imagination and fantasy of Buster Keaton.|6.6/10|135|99|36|6.4/10|34|23|11|3.7/5|10,933
770690957|Soul Kitchen|Fatih Akin|Comedy|Aug 20, 2010|Dec 21, 2010|$200,000|NR|99|IFC Films|Fatih Akin, Adam Bousdoukos|Celebrated filmmaker Fatih Akin, known for celebrated dramas like HEAD-ON and THE EDGE OF HEAVEN, serves up a delightfully fresh comedy with his latest award-winning film. SOUL KITCHEN is a delicious, free spirited story of food, friends, and rock & roll, winner of the Special Jury Prize and the Young Cinema Award for Best Film at the Venice Film Festival, and a smash with audiences at the Toronto and Tribeca film festivals. SOUL KITCHEN film centers on a likable but hopelessly disorganized restauranteur, Zinos (co-screenwriter Adam Bousdoukos) whose cafe is second home to a motley crew of lovable eccentrics. When his girlfriend Nadine up and moves to Shanghai, a love-sick Zinos decides to fly after her, leaving his restaurant in the hands of his unreliable ex-con brother Illias. Both decisions turn out disastrous: Illias gambles away the restaurant to a shady real estate agent, and Zinos finds Nadine with a new lover. If the brothers can stop arguing and get it together, the Soul Kitchen might still have one last chance at staying in business. The mayhem that follows is a hilariously entertaining story of self-realization, set to an irresistibly soulful soundtrack. -- (C)IFC|6.5/10|59|43|16|6.8/10|23|20|3|3.7/5|5,384
770733841|Step Up 3|Ken Seng, Jon M. Chu|Drama, Musical & Performing Arts, Romance|Aug 6, 2010|Dec 21, 2010|$42,385,520|PG-13 (for brief strong language)|107|Touchstone Pictures|Amy Andelson, Emily Meyer|The filmmakers of the hit Step Up and Step Up 2: The Streets movies reunite to bring you Step Up 3. Urban street dancing goes global in an electrifying new story with mind blowing dance moves. The House of Pirates dance crew are pitched against their long time rivals, the House of Samurai at the upcoming World Jam Competition. In an exhilarating and energetic dance battle against the world's best hip hop dancers, this high-stakes showdown will change all their lives forever..|5.1/10|119|55|64|5.3/10|28|15|13|3.6/5|100,562
770790841|Barry Munday|Chris D'Arienzo|Comedy|Oct 1, 2010|Dec 7, 2010||R (for sexual content and language)|98|Magnolia Pictures|Chris D'Arienzo|"Barry Munday, a suburban wanna-be ladies man, wakes up in the hospital after being attacked in a movie theater, only to realize that he is missing one of his most prized possessions... his testicles. To make matters worse, Barry learns he's facing a paternity lawsuit filed by a woman he can't remember having sex with. With this being Barry's last chance to ever be a father, Barry reaches out and embraces the journey of parenthood and the onslaught of bumps that face him along the way. Filled with an ensemble of unusual characters, ""Barry Munday"" is the surprisingly heart-warming tale of a guy who finds it took losing his manhood to be a better man.-- (C) Official Site"|5.1/10|14|6|8|||||3/5|2,417
770799466|Mother and Child|Rodrigo García|Drama|May 7, 2010|Dec 14, 2010|$1,110,286|R (for sexuality, brief nudity, and language)|126|Sony Pictures Classics|Rodrigo García|Writer/director Rodrigo Garca (Nine Lives) teams with executive producer Alejandro Gonzlez Irritu to craft this drama highlighting the powerful bond between a mother and her son. It's been years since Karen (Annette Bening) gave her daughter, Elizabeth, up for adoption, and the decision to abandon her child has always haunted her. Upon meeting laid-back Paco (Jimmy Smits), Karen permits her anxiety and mistrust to get the best of her. On the surface it appears that Elizabeth (Naomi Watts) is none the worse for never knowing her biological mother; she's a fast-talking lawyer who's just landed a high-profile job at a firm fronted by Paul (Samuel L. Jackson), though her unsavory penchant for exploiting others is about to blow up in her face. Meanwhile, maternal-minded baker Lucy (Kerry Washington) longs to experience the joys of motherhood, eventually deciding that adoption is the best bet to start a family with her husband, Joseph (David Ramsey). ~ Jason Buchanan, Rovi|6.7/10|127|99|28|6.7/10|35|28|7|3.7/5|6,936
770802052|The Immaculate Conception of Little Dizzle|David Russo|Comedy||Dec 14, 2010||NR|98|Visit Films|David Russo|After losing his job, Dory is forced to become a janitor. He and his group of cast-off co-workers soon find themselves being used as unwitting guinea pigs by a corrupt cookie company... Quirky, humorous and dark, David Russo's feature debut is a stylish meditation on the meaning of garbage in our throwaway society. Featuring a hallucinatory animation sequence by renowned animator Rosto and a stellar ensemble cast, Little Dizzle is a bittersweet post-modern fable and a genre-defying cult classic in the making.|7/10|9|8|1|6.7/10|5|4|1|3.6/5|472
770805190|Despicable Me|Pierre Coffin, Chris Renaud|Animation, Comedy, Kids & Family|Jul 9, 2010|Dec 14, 2010|$251,476,985|PG (for rude humor and mild action)|95|Universal Pictures|Ken Daurio, Cinco Paul|A mysterious criminal mastermind has stolen one of the pyramids in Egypt, sparking a fit of jealous envy in evil genius Gru (Steve Carell), who hasn't managed to make headlines since he and his minions swiped the Times Square JumboTron years back. Ever since Gru was a little boy, he dreamed of going to the moon. Now, if Gru can just build a rocket and get his hands on a powerful shrink-ray, he can cement his reputation as the greatest thief who ever lived by stealing the Earth's satellite right out of the sky. But immediately after Gru heists the shrink-ray, the cunning super-nerd Vector (Jason Segel) swoops in and snatches it right out of his hands. Now, in order to claim the moon, Gru must first reacquire the weapon from Vector. Armed with the knowledge that his nemesis has a mean sweet tooth, Gru adopts cookie-selling orphans Margo (Miranda Cosgrove), Agnes (Elsie Fisher), and Edith (Dana Gaier) and commissions a new line of cookie robots from the evil Dr. Nefario (Russell Brand), his personal weapons specialist. But as Gru and his diminutive yellow minions prepare to carry out the biggest heist in history, something strange happens. Gru discovers that the three little girls who have come into his life are much more than simple pawns. They actually seem to care about Gru, and it turns out the scheming evildoer makes a pretty good father. When Gru realizes that his upcoming moon mission clashes with a ballet performance by the girls, he must decide what's more important -- being a present parent or cementing his nefarious reputation once and for all. ~ Jason Buchanan, Rovi|6.8/10|197|160|37|7.2/10|38|34|4|4/5|267,103
770805346|The Milk of Sorrow (La Teta Asustada)|Claudia Llosa|Art House & International, Drama|Aug 27, 2010|Dec 7, 2010|$10,376|NR|94|Olive Films|Claudia Llosa|Director Claudia Llosa follows her award-winning feature directorial debut, Madeinusa, with this stark meditation on a grim period of South American history in which approximately 70,000 people were murdered between the years 1980 and 2000. Fausta (Magaly Solier) has fallen ill with a disease passed down from mother to daughter through breast milk. But Fausta's affliction isn't biological; it strictly affects Peruvian women who were raped or abused during those two terrible decades of persecution. While those days are long gone, Fausta stands as a living reminder of the horrors that once plagued her country, her malady a deep-rooted fear that stripped the young innocent of her soul. After Fausta's mother dies, the horrified girl is forced to confront her greatest fear by staring straight into the black heart of her own paranoia. Now, as Fausta sets out to discover her own path to freedom, she inserts a potato into her vagina in order to protect her body from unwanted intruders. ~ Jason Buchanan, Rovi|6.8/10|38|31|7|7.1/10|9|8|1|3.4/5|8,795
770805418|Inception|Christopher Nolan|Action & Adventure, Drama, Mystery & Suspense, Science Fiction & Fantasy|Jul 16, 2010|Dec 7, 2010|$292,568,851|PG-13 (for sequences of violence and action throughout)|148|Warner Bros. Pictures|Christopher Nolan|Visionary filmmaker Christopher Nolan (Memento, The Dark Knight) writes and directs this psychological sci-fi action film about a thief who possesses the power to enter into the dreams of others. Dom Cobb (Leonardo DiCaprio) doesn't steal things, he steals ideas. By projecting himself deep into the subconscious of his targets, he can glean information that even the best computer hackers can't get to. In the world of corporate espionage, Cobb is the ultimate weapon. But even weapons have their weakness, and when Cobb loses everything, he's forced to embark on one final mission in a desperate quest for redemption. This time, Cobb won't be harvesting an idea, but sowing one. Should he and his team of specialists succeed, they will have discovered a new frontier in the art of psychic espionage. They've planned everything to perfection, and they have all the tools to get the job done. Their mission is complicated, however, by the sudden appearance of a malevolent foe that seems to know exactly what they're up to, and precisely how to stop them. ~ Jason Buchanan, Rovi|8.1/10|346|299|47|7.8/10|57|49|8|4.2/5|569,017
770805753|Salt|Phillip Noyce|Action & Adventure, Mystery & Suspense|Jul 23, 2010|Dec 21, 2010|$118,311,368|PG-13 (for intense sequences of violence and action)|100|Sony Pictures|Kurt Wimmer, Brian Helgeland|"As a CIA officer, Evelyn Salt (Jolie) swore an oath to duty, honor and country. Her loyalty will be tested when a defector accuses her of being a Russian spy. Salt goes on the run, using all her skills and years of experience as a covert operative to elude capture. Salt's efforts to prove her innocence only serve to cast doubt on her motives, as the hunt to uncover the truth behind her identity continues and the question remains: ""Who Is Salt?""-- (C) Sony"|6/10|238|150|88|6.2/10|49|30|19|3.4/5|200,682
770807285|Turning Green|Michael Aimette, John G. Hofmann|Comedy, Drama|Jun 11, 2005|Dec 21, 2010||R|85|New Films International|John G. Hofmann, Michael Aimette|Un adolescente es forzado a vivir en Irlanda tras la muerte de sus padres pero anhela con volver a EEUU.|4.9/10|12|5|7|||||3.1/5|69
770809320|Frost (The Last International Playboy)||Comedy, Drama, Romance|Jun 12, 2009|Dec 14, 2010||R|95|C Plus Pictures|Thomas Moffett|Roswell star Jason Behr assumes the role of a New York City playboy who sinks into a deep depression after learning that his childhood love is engaged to another man. Still haunted by his mother's recent suicide, professional charmer Jack Frost (Behr) is shattered to discover that his one true love is about to take the plunge -- but not with him. As Jack begins spiraling into a self-destructive cycle of whisky and reckless behavior, his best friends Ozzy, Scotch, and Kate struggle to find a means of jarring their depressed pal back to reality. Strangely enough, it isn't Jack's grown-up friends who offer him the most useful relationship advice, but his 11-year-old neighbor, Sophie, whose unusually wise and thoughtful words have a special way of helping the self-absorbed urbanite shake off the nostalgia and excess that threaten to consume him.|3.9/10|7|2|5|||||3.1/5|2,123
770810774|Mugabe and the White African|Andrew Thompson, Lucy Bailey|Documentary, Special Interest|Jul 23, 2010|Dec 14, 2010|$4,542|NR|90|First Run Features||Michael Campbell is one of a handful of white farmers still left in Zimbabwe since President Robert Mugabe began enforcing his controversial land seizure program, an initiative intended to reclaim white-owned land and redistribute it to poor black Zimbabweans. Since 2000, formerly thriving farms that employed thousands, now sit derelict while poverty and hunger are rife amongst the majority of the country's citizens; but 74-year-old Mike refuses to back down. Set against the backdrop of the tumultuous 2008 presidential election, 'Mugabe and the White African' follows Mike and son-in-law Ben Freeth's harrowing attempt to take Mugabe to an international court for racism and violation of their human rights. It is an unprecedented case, upon which rests not only Mike and his family's future, but also the future of millions of ordinary Zimbabweans who continue to suffer at the hands of one of the world's most infamous tyrants.|7.6/10|34|33|1|7.6/10|9|9|0|4.2/5|977
770812328|The Horde (La Horde)|Benjamin Rocher, Yannick Dahan|Action & Adventure, Art House & International, Horror, Mystery & Suspense|Jul 1, 2009|Dec 21, 2010||NR|90|IFC Films|Benjamin Rocher, Arnaud Bordas, Stephane Moissakis, Yannick Dahan|In order to avenge the murder of one of their own by a gang of ruthless gangsters, four corrupt cops go on a rampage in a condemned building which serves as the mobsters' hangout. Now trapped, the officers are about to be executed when the unimaginable occurs: hordes of bloodthirsty, cannibalistic creatures invade the building, savagely attacking everyone. Unexpected alliances are made when their lives are threatened by the unthinkable. Directed by Yannick Dahan & Benjamin Rocher.-- (C) IFC Films|4.8/10|18|7|11|||||3/5|2,649
770813310|Easy A|Will Gluck|Comedy, Romance|Sep 17, 2010|Dec 21, 2010|$58,401,464|PG-13 (for mature thematic elements involving teen sexuality, language and some drug material)|92|Sony Pictures/Screen Gems|Bert V. Royal|Nathaniel Hawthorne's The Scarlet Letter is re-imagined as a contemporary high school comedy in this tale of a scheming student who plots to give her popularity a boost by painting herself the easiest lay in school. Like most high school kids, Olive Penderghast (Emma Stone) just wants to be popular. So much so than when her best friend, Rhiannon (Aly Michalka), asks Olive how her weekend went, the bored teen decides to whip up a spicy white lie just to make things interesting. But that minor exaggeration begins to take on a life of its own when it reaches the ears of motor-mouth gossip Jesus freak Marianne (Amanda Bynes), and in no time the entire student body is abuzz over unassuming Olive's unrepentant weekend of debauchery. Of course not a word of it is true, but that doesn't stop everyone in school from talking, and an amused Olive from deciding to go with the flow. Playing the role of the hussy to the hilt, the girl who used to be invisible begins dressing provocatively and turning heads in the hallways. The students aren't the only ones taking notice, either; Olive's English teacher, Mr. Griffith (Thomas Haden Church), is concerned that the kind of attention she's receiving isn't healthy for a developing girl, and his wife (Lisa Kudrow), the school guidance counselor, is in full agreement. The only people who seem remotely interested in the truth are Olive's trusting and open-minded parents (Stanley Tucci and Patricia Clarkson). As Olive takes note of the parallels between her own situation and the plight of the Scarlet Letter heroine Hester Prynne, she realizes that she may be able to manipulate her newfound notoriety to give fellow classmate Brandon's (Dan Byrd) popularity a much-needed shot in the arm. Olive never thought her little game could possibly have any negative effect on anyone but herself, but when loose lips start sinking ships all around her, she realizes that it's high time for the truth to come out. ~ Jason Buchanan, Rovi|7.1/10|186|158|28|7/10|37|34|3|3.8/5|128,730
770813852|Beautiful Kate|Rachel Ward|Art House & International, Drama, Mystery & Suspense|Nov 7, 2009|Dec 21, 2010||R (for strong sexual content and nudity, language and some violent images)|90|Roadshow Films||Celebrated British-born actress Rachel Ward (The Thorn Birds, Against All Odds) makes her feature directorial debut with this unique and occasionally provocative drama, featuring longtime husband Bryan Brown and produced in Brown's native Australia. A loose adaptation of the 1982 novel by Newton Thornburg (Cutter's Way), it transposes the events of that roman from Chicago to an Australian farm. Ben Mendelsohn stars as Ned Kendall, a fortyish author who takes his young, slightly uncouth girlfriend, Toni (Maeve Dermody) along to visit his dying father, Bruce (Brown) a failed politician and farmer now cared for by daughter Sally (Rachel Griffiths) on the clan's Aussie property. The relationship between Ned and Bruce remains supremely dysfunctional, as father constantly berates and pushes his son; the focal points of their conflicts spring from the teenage death of Ned's twin sister Kate (Sophie Lowe) and the suicide of his older brother Cliff (Josh McFarlane). After Toni and Sally each storm out of the home in a nasty huff, director Ward intercuts two parallel narratives: the circumstances (including Kate's insatiable sexual curiosity during adolescence) that once led to the family's two tragic losses, and, in a contemporary framework, the delicate steps that Bruce and Ned begin to take toward reconciliation, in the period immediately preceding Bruce's death. ~ Nathan Southern, Rovi|6.8/10|31|26|5|||||3.2/5|12,633
770814363|The Town|Ben Affleck|Action & Adventure, Drama, Mystery & Suspense, Romance|Sep 17, 2010|Dec 17, 2010|$92,173,235|R (for strong violence, pervasive language, some sexuality and drug use)|151|Warner Bros. Pictures|Peter Craig, Ben Affleck, Aaron Stockard|Boston bank robber Doug MacRay (Ben Affleck) falls for a woman his gang had previously taken hostage after feigning a chance meeting with her to ensure that she can't identify them in Affleck's adaptation of author Chuck Hogan's novel Prince of Thieves. The son of a tough Charlestown, MA thief, Doug passed on his chance to walk the straight and narrow in favor of becoming a career bank robber. Not only is Doug's crew one of the most ruthless in Boston, but they're also one of the best; they never leave a trace of evidence, and always make a clean break. Over the years, Doug's fearless partners in crime have become something of a surrogate family to him; Jem (Jeremy Renner), the most dangerous of the bunch, is the closest thing Doug has ever had to a brother. But a divide begins to open between the two career criminals when Jem takes bank manager Claire Keesey (Rebecca Hall) hostage during a particularly tense heist, and the group subsequently discovers that she hails from their own tight-knit suburb. When Jem proposes that the gang make an effort to find out just how much Claire recalls about the crime, Doug fears that his volatile partner may do more harm than good and volunteers himself for the job. Later, Doug turns on the charm while pretending to bump into Claire by chance, and becomes convinced that she doesn't suspect him of being the same man who just robbed her bank. As the feds turn up the heat on the gang, Doug finds himself falling for Claire, and searching desperately for a means of cutting his ties to his criminal past. But with each passing day, Jem grows increasingly suspicious of Doug's true motivations. Now caught between two worlds with no chance of turning back, Doug realizes that his only hope for finding a happy future is to betray the only family he's ever known. ~ Jason Buchanan, Rovi|7.7/10|223|207|16|7.5/10|45|40|5|3.9/5|141,728
770814365|Wall Street: Money Never Sleeps|Oliver Stone|Drama|Sep 24, 2010|Dec 21, 2010|$52,474,616|PG-13 (for brief strong language and thematic elements)|133|20th Century Fox|Allan Loeb, Stephen Schiff|"Ambitious young investment banker Jacob Moore (Shia LaBeouf) discovers that greed is still the name of the game when he forges a fragile alliance with onetime Wall Street hotshot Gordon Gekko (Michael Douglas) shortly after Gekko is released from prison. Having served eight years for securities fraud, money laundering, and racketeering, Gekko emerges from prison to find that his daughter, Winnie (Carey Mulligan), prefers to remain estranged, and that his former Wall Street cohorts are still raking in the cash. Flash-forward to 2008, and Winnie is dating a proprietary trader named Jake Moore (LaBeouf), who expresses a passion for green energy while working for his mentor Louis Zabel (Frank Langella), of Keller Zabel Investments. Despite heading up one of the most prominent investment firms in the country, Louis Zabel is forced to personally fight for the future of Keller Zabel before the Federal Reserve after the company's stock takes a hit due to persistent rumors that it's being dragged down by debt. Denied a bailout from the government, Keller Zabel soon falls victim to a hostile takeover lead by powerful investment bank partner Bretton James (Josh Brolin), of Churchill Schwartz. His job on the line and his mentor out of the picture, Jake discovers that Gordon Gekko is out promoting his new book ""Is Greed Good?"" and decides to attend a lecture being given by the author at Fordham University. According to Gekko, greed is now sanctioned by the government, and the U.S. economy is on the verge of collapse as a direct result of leveraged debt and wild conjecture. When Jake goes behind Winnie's back to try and repair her relationship with her father, Gekko reveals his compelling theories on the likely reasons for Zabel's downfall. Later, as Jake begins plotting to avenge his mentor, Gekko starts to reveal his true colors. ~ Jason Buchanan, Rovi"|6/10|229|125|104|6.4/10|49|32|17|3.1/5|110,709
