770859309|Lucky|Jeffrey Blitz|Documentary, Special Interest|Dec 31, 2010|Apr 26, 2011||R|87|HBO Documentary Films||"Americans spend $62 billion each year on lottery tickets, and every time someone buys one they likely imagine what their life would be like if they suddenly won a multi-million dollar prize. But the dream and the reality are often very different, and filmmaker Jeffrey Blitz offers a look into the lives of several folks who won big with unexpected results in this documentary. In Lucky, we meet Quang and Mai Dao, a couple from Vietnam who won over $22 million after settling in Nebraska, and have struggled to hold onto the values and work ethic that first brought them to the United States. Kristine and Steven White won a $110 million prize in the Pennsylvania lottery and found it seriously impacted their friendships and their identity, while they were also inundated with letters from strangers asking for a share of the money. William ""Buddy"" Post III won $16 million, but lost most of it through poor money management and was nearly killed by his own brother over a financial dispute. Robert Uomini still teaches math in California after winning $22 million though he can now indulge his passion for sports cars, and James Gatzke, who was near the end of his rope, got a second chance at life when an Illinois lottery ticket paid off to the tune of $5 and a half million. Lucky was an official selection at the 2010 Sundance Film Festival."|5.7/10|5|3|2|||||3.1/5|268
771040112|Ip Man 2: Legend of the Grandmaster|Wilson Yip, Yip Wai-Shun|Action & Adventure, Art House & International, Drama, Sports & Fitness|Jan 28, 2011|Apr 19, 2011|$100,000|R (for violence)|108|Variance Films|Edmond Wong|"International megastar Donnie Yen reprises his iconic role as the real-life kung fu grandmaster Ip Man in this martial arts spectacular. After escaping the Japanese occupation of his hometown of Fo Shan, China, Ip Man and his family have arrived in Hong Kong, which is living under the iron fist of British colonial rule. Ip wants to support his family by opening up a martial arts academy to teach his unique Wing Chun style. But a corrupt cabal of Hong Kong martial arts masters, led by Hung Chun-nam (the legendary Sammo Hung), refuses to allow Ip to teach until he proves himself - and prove himself he does, in an intense series of fights against the masters showcasing a dazzling variety of martial arts styles, culminating in a highly anticipated brawl between Ip and Hung atop a rickety table. But even after gaining the respect of the masters, Ip's troubles are far from over. Hong Kong under British rule is a world of corruption, and when a Western-style boxer named Taylor ""Twister"" Milos comes to town to entertain the British upper-class, and insults both Chinese martial arts and the native citizens in a horrifically violent way, Ip must step up and fight for the honor of both his kung fu and the Chinese people. Forced by honor to enter a brutal ""King of the Ring"" boxing match against Twister, it's East versus West in an amazing, knock-down drag-out fight to the finish, the likes of which have never been seen on-screen before. Presented in the original, un-dubbed and uncut, international version that's been breaking box-office records across Asia, Ip Man 2: Legend of the Grandmaster is a throwback to the golden age of Hong Kong martial arts cinema that will delight kung fu fans and newcomers alike. -- (C) Well Go USA and Variance"|6.9/10|26|25|1|6.4/10|6|6|0|4/5|21,933
771041141|The Dilemma|Ron Howard|Comedy|Jan 14, 2011|May 3, 2011|$48,430,355|PG-13 (for mature thematic elements involving sexual content)|110|Universal Pictures|Allan Loeb|Vince Vaughn and Kevin James headline an all-star comedy from director Ron Howard and producer Brian Grazer about a man who finds out that what you don't say to a friend is just as important as what you do. Jennifer Connelly, Winona Ryder, Channing Tatum and Queen Latifah join them in The Dilemma, a story of how far you can bend a brotherly bond before it snaps. Since college, confirmed bachelor Ronny (Vaughn) and happily married Nick (James) have been through thick and thin. Now partners in an auto design firm, the two pals are vying to land a dream project that would launch their company. With Ronny's girlfriend, Beth (Connelly), and Nick's wife, Geneva (Ryder), by their sides, they're unbeatable. But Ronny's world is turned upside down when he inadvertently sees Geneva out with another man and makes it his mission to get answers. As the amateur investigation dissolves his world into comic mayhem, he learns that Nick has a few secrets of his own. Now, with the clock ticking and pressure mounting on the biggest presentation of their careers, Ronny must decide how and when he will reveal the truth to his best friend. -- (C) Universal|4.3/10|161|39|122|4.6/10|36|10|26|2.8/5|56,471
771204248|Vision: From the Life of Hildegard von Bingen|Margarethe von Trotta|Art House & International, Documentary, Drama, Special Interest, Faith & Spirituality, Sports & Fitness|Oct 13, 2010|Apr 19, 2011|$300,000|NR|110|Zeitgeist Films|Margarethe von Trotta|Hildegard von Bingen was truly a woman ahead of her time. A visionary in every sense of the word, this famed 12th-century Benedictine nun was a Christian mystic, composer, philosopher, playwright, poet, naturalist, scientist, physician, herbalist and ecological activist. In Vision, New German Cinema auteur Margarethe von Trotta (Marianne and Juliane, Rosa Luxemburg, Rosenstrasse) reunites with recurrent star Barbara Sukowa (Zentropa, Berlin Alexanderplatz) to bring the story of this extraordinary woman to life. In a staggering performance, Sukowa portrays von Bingen's fierce determination to expand the responsibilities of women within the order, even as she fends off outrage from some in the Church over the visions she claims to receive from God. Lushly shot in the original medieval cloisters of the fairytale-like German countryside, Vision is a profoundly inspirational portrait of a woman who has emerged from the shadows of history as a forward-thinking and iconoclastic pioneer of faith, change and enlightenment. -- (C) Zeitgeist|6.9/10|37|30|7|7/10|15|13|2|3.6/5|1,178
771206376|Fubar: Balls to the Wall|Michael Dowse|Comedy||Apr 19, 2011|$555,847|R (for pervasive language, sexual content, drug use and crude behavior)|95|Screen Media Ventures|David Lawrence, Paul Spence, Michael Dowse, Dave Lawrence|Director Michael Dowse's sequel to his heavy-metal comedy FUBAR picks up the story of Dean (Paul Spence) and Terry (Dave Lawrence) who take off on a road-trip looking for a paycheck and gigs. But when Terry meets a great woman and considers reordering his priorities, Dean refuses to give up his dreams of taking his band Night Seeker to the big time.|7.1/10|8|7|1|||||3.6/5|579
771210545|Queen of the Lot|Henry Jaglom|Comedy, Drama|Nov 19, 2010|May 1, 2011|$178,308|R (for language and some sexual content)|114|Rainbow Releasing|Henry Jaglom, Ron Vignone|Maverick indie filmmaker Henry Jaglom moves from the sweet poignancy of his 2009 Irene in Time to knowing Hollywood satire with this romantic comedy that finds him teaming with actress Tanna Frederick for the third time. Frederick portrays Maggie Chase, a B-list star who longs to find love and fulfillment and achieve household-name status, but must contend with twin products of her wild behavior: a court-ordered electronic ankle bracelet and temporary house arrest. Fortunately, Maggie has a team of clever spin doctors (Ron Vignone, David Proval, Zack Norman, and Diane Salinger), who manage to turn her drunk-driving activities into attention-grabbing tabloid fodder. She also draws on the support of a movie-star beau, Dov Lambert (Christopher Rydell), equally known for his no-holds-barred behavior. For a time, it looks as though Maggie's grandest dreams will actualize, as her national fame crescendos, but her life grows more complicated when she follows Dov home to meet his kin, and runs headfirst into a series of show-business legends (played by Peter Bogdanovich, Dennis Christopher, Kathryn Crosby, Mary Crosby, Sabrina Jaglom, and Jack Heller). She also meets Dov's brother, failed writer Aaron Lambert (Noah Wyle), who seems tailor-made for Maggie with his ability to penetrate her superficial facades, but must deal with lingering issues in his own life and past.|4.3/10|13|4|9|4.7/10|8|2|6|3.5/5|669
771231860|Fly Away|Janet Grillo|Drama|Apr 15, 2011|Apr 26, 2011||NR|80|New Video|Janet Grillo|Based on the award-winning short Flying Lessons, Fly Away tells the moving story of a single mother, Jeanne, grappling with the challenge of raising her autistic teenage daughter, Mandy. As Mandy becomes more and more unmanageable, so too does Jeanneʼs life. Over the period of two weeks, Jeanne is confronted with the most difficult decision a parent can make: to let go, allowing her child to grow, but also grow apart, or to hold on tight and fall together. --(c) Official Site|6.8/10|13|11|2|6.8/10|8|7|1|3.5/5|215
771232696|Square Grouper: The Godfathers of Ganja|Billy Corben|Comedy, Documentary, Drama, Special Interest|Apr 15, 2011|Apr 19, 2011||R (for images of drug use - some involving children)|99|Magnolia Pictures||In 1979, the U.S. Customs Service reported that 87% of all marijuana seizures in the U.S. were made in the South Florida area. Due to the region's 5,000 miles of coast and coastal waterways and close proximity to the Caribbean and Latin America, South Florida was a pot smuggler's paradise. In sharp contrast to the brazenly violent cocaine cowboys of the 1980s, Miami's marijuana smugglers were cooler, calmer, and for the most part, nonviolent. Square Grouper paints a vivid portrait of Miami's pot smuggling culture in the 1970s and 1980s through three of the city's most colorful stories.--(c) Official Site|5.9/10|12|9|3|5.9/10|6|4|2|3.3/5|900
771234184|Mysteries Of The Jesus Prayer|Norris J. Chumley|Documentary, Drama||May 3, 2011||NR|||||4.4/10|5|1|4|||||4.9/5|20
9903|Limelight|Charles Chaplin|Classics, Comedy, Drama|Oct 23, 1952|Mar 28, 2011||G|150|Criterion Collection|Charles Chaplin|In this film, Calvero saves young Terry from killing herself. Calvero asks the girl why she is so determined to kill herself. The girl explains that she has always dreamed of becoming a great dancer, but her legs are paralyzed. Calvero vows to raise enough money to help the girl.|7.9/10|30|29|1|8.8/10|7|6|1|4.1/5|7,259
770671153|The Chronicles of Narnia: The Voyage of the Dawn Treader|Michael Apted|Action & Adventure, Kids & Family, Science Fiction & Fantasy|Dec 10, 2010|Apr 8, 2011|$104,383,624|PG (for some frightening images and sequences of fantasy action)|113|20th Century Fox|Christopher Markus, Stephen McFeely, Michael Petroni|Upon returning to Narnia to join Prince Caspian for a voyage on the majestic royal vessel known as The Dawn Treader, Lucy, Edmund, and their cousin Eustace encounter merfolk, dragons, dwarves, and a wandering band of lost warriors. As the edge of the world draws near, their remarkable adventure at sea sails toward an exciting, yet uncertain, conclusion. ~ Jason Buchanan, Rovi|5.7/10|164|81|83|5.7/10|37|16|21|3.5/5|157,296
770674540|Sunday in New York|Peter Tewksbury|Comedy, Drama|Nov 13, 1963|Mar 29, 2011||NR|105|Warner Home Video|Norman Krasna|In this sexy comedy, an innocent, but attractive virgin heads off to find adventure in the Big Apple and winds up falling in love. The highly principled lass goes to the New York apartment of her airline pilot brother to escape her over-amorous fiance who is increasingly unwilling to wait until their wedding night. Her brother supports her decision to stay pure and tells her that men prefer to marry virgins. He then secretly makes new plans to spend a spicy weekend with his lover in another city. Unfortunately, he is called to work after he makes his plans and is unable to contact his girl friend to tell her. Meanwhile, his innocent sister, left alone in the apartment, discovers that her brother lives by a double standard. Enraged, she decides to become a swinger too and so boards a downtown bus where she encounters a handsome, worldly bachelor. They are both attracted to each other and spend a lazy Sunday sightseeing and falling in love. A heavy downpour leads the drenched couple to the pilots apartment where they dry off. It's all innocent enough, but when both the repentant fiance and the girl's brother show up it's comical chaos.|7.3/10|6|6|0|||||3.9/5|505
770678818|Tangled|Nathan Greno, Byron Howard|Animation, Comedy, Kids & Family, Musical & Performing Arts|Nov 24, 2010|Mar 29, 2011|$200,803,309|PG (for brief mild violence)|100|Walt Disney Pictures|Jacob Grimm, Dan Fogelman|When the kingdom's most wanted-and most charming-bandit Flynn Rider hides out in a mysterious tower, he's taken hostage by Rapunzel, a beautiful and feisty tower-bound teen with 70 feet of magical, golden hair. Flynn's curious captor, who's looking for her ticket out of the tower where she's been locked away for years, strikes a deal with the handsome thief and the unlikely duo sets off on an action-packed escapade, complete with a super-cop horse, an over-protective chameleon and a gruff gang of pub thugs.|7.5/10|221|197|24|7.2/10|43|38|5|4.1/5|149,893
770680906|Not as a Stranger (Morton Thompson's Not as a Stranger)|Stanley Kramer, Frank Kramer|Classics, Drama|Jun 28, 1955|Mar 29, 2011||NR|135|United Artists|Edna Anhalt, Edward Anhalt|"Ambitious but impecunious medical student Lucas Marsh (Robert Mitchum) marries the older and (in this film, at least) not especially attractive Kristina Hedvigson (Olivia de Havilland) so that she can pay his tuition fees. Kristina loves Lucas, but he loves nothing but his work. Emotionally shutting himself off from everyone -- including best friend, Alfred Boone (Frank Sinatra), and drunken dad, Job Marsh (Lon Chaney Jr.) -- Lucas survives his training and goes to work as the assistant to tough but tender small-town medico Dr. Runkleman (Charles Bickford). He enters into an affair with wealthy Harriet Lang (Gloria Grahame) (watch for the symbolism-laden tryst in the horse barn!), obliging Alfred, now a big-city doctor, to try to patch up his pal's marriage. But Lucas feels nothing and needs no one because he's come to think of himself as the perfect physician, incapable of making an error. When Lucas fails to revive his mentor Dr. Runkleman during heart surgery (a genuine heart is used in the ""massage"" close-ups), the young doctor suddenly realizes that he's not infallible after all. He wanders aimlessly through town, finally returning to his wife and collapsing into her arms, sobbing ""Help me! Please help me!"" Cameo players range from Broderick Crawford as a Jewish doctor denied entry into medicine's upper circles to Carl Switzer as a bug-eyed patient. The film was adapted from the best-selling novel by Morton Thompson. ~ Hal Erickson, Rovi"|3.8/10|8|1|7|||||3.4/5|252
770685374|Little Fockers|Paul Weitz|Comedy|Dec 22, 2010|Apr 5, 2011|$148,383,780|PG-13 (for mature sexual humor throughout, language and some drug content)|98|Universal Pictures|John Hamburg, Larry Stuckey|A birthday party for the twins gives Greg an opportunity to redeem himself after he takes a job that raises the suspicions of his overbearing father-in-law, Jack (Robert De Niro), in this installment of the hit comedy series. Greg (Ben Stiller) and Pam (Teri Polo) have been together for ten years, and now they're the proud parents of two adorable twins. But money is tight, and in order to keep his family afloat, devoted nurse Greg takes a second job working for a drug company. But that development doesn't sit well with Jack, whose previous suspicions regarding his hapless son-in-law soon come back in full force after learning of this development. With the twins' birthday fast approaching, the proud parents invite the entire clan over to celebrate in style, including Kevin (Owen Wilson), who still carries a torch for his pretty ex Pam. As the festivities get under way, Greg takes every opportunity available to prove to Jack that he's fully capable of providing for his family. Now Greg has one last chance to prove that he's trustworthy. Should he fail, the circle of trust will be broken for good. Dustin Hoffman, Barbra Streisand, Laura Dern, and Jessica Alba co-star. ~ Jason Buchanan, Rovi|3.4/10|148|14|134|3.9/10|36|1|35|2.9/5|133,013
770688140|Mesrine: Public Enemy #1|Jean-François Richet|Action & Adventure, Drama|Sep 3, 2010|Mar 29, 2011||R (adult situations/language, sex, violence)|133|Music Box Films|Jean-François Richet, Abdel Raouf Dafri|Now back in France, Mesrine is finally in police custody and facing justice for his crimes. After escaping a courtroom and kidnapping the judge at gunpoint, Mesrine is declared Public Enemy Number 1 and is eventually condemned to a maximum-security prison where he writes his memoirs, establishing himself as a household name and the anti-hero across France. Mesrine stages another daring escape and disappears into the lawless underworld, taunting the police and reinventing himself as a celebrity criminal through his savvy manipulation of the media. After such a monumental rise, comes the inevitable fall as the police close in, bringing the life of Jacques Mesrine to full bloody circle. -- (C) Music Box Films|7.2/10|86|70|16|7/10|17|13|4|3.8/5|14,726
770728354|All Good Things|Andrew Jarecki|Drama, Mystery & Suspense|Dec 3, 2010|Mar 29, 2011|$578,382|R (for drug use, violence, language and some sexuality)|101|Magnolia Pictures|Marcus Hinchey, Marc Smerling|Inspired by the most notorious missing person's case in New York history, ALL GOOD THINGS is a love story and murder mystery set against the backdrop of a New York real estate dynasty in the 1980s. Produced and directed by Andrew Jarecki (director of the Academy Award-nominated doc Capturing the Friedmans and producer of Catfish), the film was inspired by the story of Robert Durst, scion of the wealthy Durst family. Mr. Durst was suspected but never tried for killing his wife Kathie who disappeared in 1982 and was never found. The film stars Ryan Gosling, Kirsten Dunst and Frank Langella as the powerful patriarch, and captures the emotion and complexion of this real-life unsolved mystery. -- (C) Magnolia|5.5/10|96|32|64|6/10|30|11|19|3/5|39,158
770738135|Black Swan|Darren Aronofsky|Drama, Mystery & Suspense|Dec 3, 2010|Mar 29, 2011|$106,952,327|R (for strong sexual content, disturbing violent images, language and some drug use)|108|Fox Searchlight|Andres Heinz, Mark Heyman, John J. McLaughlin|A psychological thriller set in the world of New York City ballet, BLACK SWAN stars Natalie Portman as Nina, a featured dancer who finds herself locked in a web of competitive intrigue with a new rival at the company (Mila Kunis). A Fox Searchlight Pictures release by visionary director Darren Aronofsky (THE WRESTLER), BLACK SWAN takes a thrilling and at times terrifying journey through the psyche of a young ballerina whose starring role as the duplicitous swan queen turns out to be a part for which she becomes frighteningly perfect. BLACK SWAN follows the story of Nina (Portman), a ballerina in a New York City ballet company whose life, like all those in her profession, is completely consumed with dance. She lives with her retired ballerina mother Erica (Barbara Hershey) who zealously supports her daughter,s professional ambition. When artistic director Thomas Leroy (Vincent Cassel) decides to replace prima ballerina Beth MacIntyre (Winona Ryder) for the opening production of their new season, Swan Lake, Nina is his first choice. But Nina has competition: a new dancer, Lily (Kunis), who impresses Leroy as well. Swan Lake requires a dancer who can play both the White Swan with innocence and grace, and the Black Swan, who represents guile and sensuality. Nina fits the White Swan role perfectly but Lily is the personification of the Black Swan. As the two young dancers expand their rivalry into a twisted friendship, Nina begins to get more in touch with her dark side with a recklessness that threatens to destroy her. -- (C) Official Site|8.2/10|297|253|44|8.1/10|47|40|7|4/5|177,496
770782173|I Love You Phillip Morris|John Requa, Glenn Ficarra|Comedy, Drama|Dec 3, 2010|Apr 5, 2011|$2,026,852|R (for sexual content including strong dialogue, and language)|98|Roadside Attractions|Glenn Ficarra, John Requa|Bad Santa co-screenwriters Glenn Ficara and John Requa re-team for this fact-based black comedy starring Jim Carrey as a Texas police officer-turned-con man who makes the leap to white-collar criminal after being sent to prison and falling in love with his sensitive cellmate. Steve Russell (Carrey) is a small-town cop. Bored with his bland lifestyle, Russell turns to fraud as a means of shaking things up. Before long, Russell's criminal antics have landed him behind bars, where he encounters the charismatic Phillip Morris (Ewan McGregor). Smitten, Russell devotes his entire life to being with Morris regardless of the consequences -- which could well include a life sentence. ~ Jason Buchanan, Rovi|6.6/10|156|111|45|6.5/10|36|22|14|3.3/5|88,813
770785471|Tron Legacy|Joseph Kosinski|Action & Adventure, Science Fiction & Fantasy|Dec 17, 2010|Apr 5, 2011|$172,051,787|PG (for sequences of sci-fi action violence and brief mild language)|125|Walt Disney Pictures|Edward Kitsis, Adam Horowitz, Steven Lisberger, Bonnie MacBird|The Master Control Program is booted back up in this revamped Tron continuation that sees the return of original star Jeff Bridges as Kevin Flynn, the brilliant computer programmer whose disappearance leads his son, Sam (Garrett Hedlund), to search for him in and out of the computer world. Original director and co-writer Steven Lisberger produces the new film, which is helmed by commercial director Joseph Kosinski. James Frain, Olivia Wilde, Beau Garrett, and Michael Sheen also star, with Bruce Boxleitner returning as Alan Bradley and Tron, the heroic protagonist of the original film.|5.9/10|238|120|118|5.6/10|48|16|32|3.5/5|171,238
770802770|Everything Strange and New|Frazer Bradshaw|Drama|Feb 25, 2011|Mar 22, 2011||NR|84|Lucky Hat Entertainment|Frazer Bradshaw|"Already bent by the demands of his home life - fatherhood, a faltering marriage, and a submerged mortgage - a tradesman struggles to balance his own appetites and expectations with those of a friend in need. ""Everything Strange and New"" is an intimate portrait of ordinary people and their longing for certainty in uncertain times.Wayne is a carpenter, no longer young but uneasy with the emotional complexities of adulthood. Aimless hours spent with Leo, his newly-divorced drinking buddy, offer some relief to the heavy gravity at home, where his kids run roughshod over his increasingly unstable wife. Living between these worlds leaves Wayne feeling like a character in someone else's story. Ultimately, a violent spasm rouses him from this fevered American dream. -- (C) Official Site"|5.8/10|5|3|2|||||2.9/5|516
770804869|The Resident|Antti Jokinen|Drama, Mystery & Suspense|Mar 15, 2012|Mar 29, 2011||R (for violence, language and brief sexuality/nudity)|91|Imaeg Entertainment|Antti Jokinen, Robert Orr|Every year, several million single women in America move into an apartment. They don't know who lived in the apartment before them, they don't know their landlords, and they don't bother to change the locks. This is the story of one such woman. After separating from her adulterous husband, the beautiful Dr. Juliet Devereau moves to Brooklyn, NY, and settles into a new life in a stunning loft apartment that seems too good to be true. Soon mysterious occurrences lead her to suspect she is not alone in her home and quickly her fears become all too real.|4.5/10|30|11|19|||||2.7/5|7,548
770809925|Fair Game|Doug Liman|Action & Adventure, Drama, Mystery & Suspense|Nov 5, 2010|Mar 29, 2011|$9,528,092|PG-13 (for some language)|108|Summit Entertainment|Jez Butterworth, John-Henry Butterworth|As a covert officer in the CIA's Counter-Proliferation Division, Valerie leads an investigation into the existence of weapons of mass destruction in Iraq. Valerie's husband, diplomat JOE WILSON (Sean Penn), is drawn into the investigation to substantiate an alleged sale of enriched uranium from Niger. But when the administration ignores his findings and uses the issue to support the call to war, Joe writes a New York Times editorial outlining his conclusions and ignites a firestorm of controversy.|6.9/10|172|135|37|6.9/10|39|29|10|3.4/5|28,617
