770682052|Henry Poole Is Here|Mark Pellington|Comedy, Drama|Aug 15, 2008|Jan 20, 2009|$1,749,146|PG (for thematic elements and some language)|100|Overture Fillms|Albert Torres|"Given a grim diagnosis during a routine doctor's checkup, a man who once had it all finds his attempt to disappear into a working-class suburb and spend his remaining days subsisting on vodka and junk food hopelessly disrupted when he falls for the beautiful divorcée next door and a busybody neighbor notices a miraculous stain on his stucco wall. Henry Poole (Luke Wilson) had a comfortable life and a beautiful fiancée. But just when it seemed that the future couldn't look any brighter for Henry, a visit to the doctor's office casts a dark cloud over his sunny outlook. Shattered, Henry wants nothing more in life than to simply vanish into his surroundings, and what better way to accomplish that feat than to purchase a cookie-cutter house in a working-class suburb and spend his final days awaiting the inevitable in peaceful solitude. Unfortunately for Henry, his new neighbors aren't about to let the handsome neighborhood newcomer spend his days sulking. The first to stop by and welcome Henry to his new home is local yenta Esperanza (Adriana Barraza), who comes knocking on his door with a fresh plate of homemade tamales and laundry list of questions.Later, after taking notice of sad-eyed divorcée Dawn (Radha Mitchell) and her taciturn eight-year-old daughter, Millie (Morgan Lily), who hasn't spoken a work since her father left, Henry finds his self-imposed exile shattered when Esperanza notices a stain on his stucco wall that seems to possess miraculous powers. Before Henry can say ""Hail Mary,"" Esperanza is leading pilgrimages to the ""holy site"" in his backyard and inviting Father Salizar (George Lopez) to give his blessings to the sacrosanct blemish. As skeptical as Henry may be about the healing powers of the curious apparition, however, his growing friendship with young Millie not only brings him closer to Dawn, but also proves to him that there's no escaping the power of hope. Cheryl Hines, Richard Benjamin, and Jessica Walter co-star in a wry existential comedy drama penned by first-time feature film screenwriter Albert Torres, and directed by Mark Pellington (Arlington Road, The Mothman Prophecies). ~ Jason Buchanan, Rovi"|5.2/10|99|39|60|5.4/10|33|14|19|3.2/5|9,427
770681833|City of Ember|Gil Kenan|Action & Adventure, Kids & Family, Science Fiction & Fantasy|Sep 25, 2008|Jan 20, 2009|$7,800,000|PG (for mild peril and some thematic elements)|95|Fox Walden|Caroline Thompson|For generations, the people of the City of Ember have flourished in an amazing world of glittering lights. But Ember's once powerful generator is failing... and the great lamps that illuminate the city are starting to flicker. Now, two teenagers in a race against time, must search Ember for clues that will unlock the ancient mystery of the city's existence, and help the citizens escape before the lights go out forever.|5.7/10|126|67|59|5.9/10|33|20|13|3.2/5|64,164
770681829|Lakeview Terrace|Neil LaBute|Drama, Mystery & Suspense|Sep 19, 2008|Jan 27, 2009|$39,263,506|PG-13 (for intense thematic material, violence, sexuality, language and some drug references)|110|Sony Pictures/Screen Gems|David Loughery, Howard Korder|An interracial couple moves into their California dream home, only to find themselves the target of their volatile next-door neighbor -- a racist LAPD officer -- in this tightly wound thriller starring Samuel L. Jackson and Kerry Washington. Newlyweds Chris and Lisa seem like they have the perfect marriage and now, with their new home in the exclusive community Lakeview Terrace, the perfect life as well, but things soon turn ugly in the posh neighborhood when they begin to receive threats from their neighbor Abel, a middle-aged LAPD officer who has obvious objections to the couple's interracial marriage. What starts as an attitude problem soon morphs into full-on harassment, and before long the couple finds that their worries go far beyond their property values -- or the encroaching California wildfire burning in view of their community -- as they begin to fear for their lives.|5.5/10|163|72|91|5.4/10|41|20|21|3.1/5|139,051
770681350|RocknRolla|Guy Ritchie|Action & Adventure, Drama|Sep 4, 2008|Jan 27, 2009|$5,665,302|R (for pervasive language, violence, drug use and brief sexuality)|114|Warner Bros. Pictures/Dark Castle|Guy Ritchie|"Lock, Stock and Two Smoking Barrels director Guy Ritchie heads back to the London underworld for this hyperkinetic crime comedy concerning a shady land deal that leaves every schemer in the city determined to get rich or die trying. When a Russian mobster orchestrates a lucrative real estate scam, every criminal in London wants a piece of the action. Greed is the universal language, and everyone from unrelenting crime boss Lenny Cole (Tom Wilkinson) to street-smart criminal One Two (Gerard Butler), corrupt accountant Stella (Thandie Newton), and unpredictable punk rocker Johnny Quid (Toby Kebbell) seem to speak it fluently. As the bullets start to fly and the double crosses multiply, there's no telling who will walk away with the fortune after the gun smoke has cleared. Jeremy Piven, Chris ""Ludacris"" Bridges, and Quantum of Solace Bond girl Gemma Arterton co-star. ~ Jason Buchanan, Rovi"|6/10|147|88|59|5.9/10|42|27|15|3.6/5|56,739
770680718|Vicky Cristina Barcelona|Woody Allen|Comedy, Drama, Romance|May 17, 2008|Jan 27, 2009|$23,164,041|PG-13 (for mature thematic material involving sexuality, and smoking)|96|The Weinstein Co.|Woody Allen|Vicky and Cristina, these two young Americans spend a summer in Spain and meet a flamboyant artist and his beautiful but insane ex-wife. Vicky is straight-laced and about to be married. Cristina is a sexually adventurous free spirit. When they all become amorously entangled, both comedic and harrowing results ensue.|6.9/10|207|167|40|7.1/10|46|40|6|3.6/5|103,924
770680512|The Duchess|Saul Dibb|Drama|Sep 5, 2008|Jan 27, 2009|$13,800,000|PG-13 (for sexual content, brief nudity and thematic material)|110|Paramount Vantage|Jeffrey Hatcher, Saul Dibb, Anders Thomas Jensen|"""The Duchess"" is the story of an extraordinary woman who rose to fame by staying true to her passions in a world of protocol, gossip and social rules--and paid the price. Long before the concept existed, the Duchess of Devonshire, Georgiana Spencer, was the original ""It Girl."" Like her direct descendent Princess Diana, she was ravishing, glamorous and adored by an entire country. Determined to be a player in the wider affairs of the world, she proved that she could out-gamble, out-drink and outwit most of the aristocratic men who surrounded her. She helped usher in sweeping changes to England as a leader of the forward-thinking Whig Party. But even as her power and popularity grew, she was haunted by the fact that the only man in England she seemingly could not seduce was her very own husband, the Duke. And, when she tried to find her own way to be true to her heart and loyal to her duty, the resulting controversies and convoluted liaisons would leave all of London talking."|6.3/10|168|103|65|6.4/10|42|28|14|3.5/5|68,842
770680256|Saw V|David Hackl|Action & Adventure, Horror|Oct 24, 2008|Jan 20, 2009|$56,729,973|R (for sequences of grisly bloody violence and torture, language and brief nudity)|95|Lionsgate|Patrick Melton, Marcus Dunstan|One man. One plan. One foot. Yes, the doctor is in! With a strange twist of fate and a revengeful plot, get ready for the most anticipated event of Saw. Face your fears at his operating table. Know that no one is safe from his sickness. Chills and screams are his true pleasure. Oh...and Blood? You'll be drenched in it.|2.9/10|75|10|65|2.7/10|18|2|16|3.4/5|239,428
770679064|Igor|Anthony Leondis, Tony Leondis|Animation, Comedy, Kids & Family|Sep 19, 2008|Jan 20, 2009|$19,420,496|PG (for some thematic elements, scary images, action and mild language)|86|MGM|Chris McKenna (II)|"In a land of mad scientists and diabolical inventions, what do you do when youre born with a hunch on your back? You become an Igor. A twist on the classic monster movie, that tells the story of one Igor--who's sick of being a lowly lab assistant with a ""Yes Master's"" degree--and dreams of becoming a scientist. When his cruel master kicks the bucket a week before the annual Evil Science Fair, Igor finally gets his chance. With the help of two of his experimental creations--Brain, a brain in a jar who's a little light on brains, and Scamper, a cynical bunny brought back from being road kill, Igor embarks on building the most evil invention of all time, a huge, ferocious monster. Unfortunately, instead of turning out evil, the monster turns out as Eva, a giant aspiring actress who wouldn't hurt a fly. Just when the load on his back can't get any heavier, Igor and his band of monstrous misfits uncover an evil plot that threatens their world. Now, they must fight to save it and prove that heroes come in all shapes and sizes."|4.8/10|91|34|57|4.5/10|25|7|18|3/5|82,490
770679048|The Visitor|Tom McCarthy|Drama|Apr 25, 2008|Jan 27, 2009|$9,234,510|PG-13 (for brief strong language)|104|Overture Films|Tom McCarthy|A lonesome widower and college economics professor finds his mundane existence suddenly shaken up when he befriends a pair of illegal immigrants, one of whom has recently been threatened with deportation by U.S. immigration authorities, in the sophomore feature from The Station Agent director Tom McCarthy. Years after losing his wife, 62-year-old Walter Vale (Richard Jenkins) has also lost his passion for writing and teaching. In an effort to fill the empty void that his life has become, Walter makes a half-hearted attempt to learn to play classical piano. Later, when Walter's college sends him to a conference in Manhattan, he is surprised to discover that a young couple has moved into his seldom-used apartment in the city. Tarek (Haaz Sleiman) and his Senegalese girlfriend Zainab (Danai Gurira) have fallen victims to an elaborate real-estate scam, and as a result they no longer have a place to call home. When Walter reluctantly allows the couple to remain in his apartment, talented musician Tarek insists on repaying his host's kindness by teaching him to play the African drum. Over the course of Walter's lessons, the ageing academic finds his spirits revitalized while gaining a newfound appreciation for New York jazz clubs and Central Park drum circles. Later, Tarek is arrested in the subway and threatened with deportation after police learn that he is an undocumented citizen. Suddenly, in his attempt to help his new friend, Walter's passion for life is unexpectedly awakened. When Tarek's radiant mother Mouna (Hiam Abbass) arrives in the city in search of her son, that passion turns to romance -- something that Walter had previously thought he would never experience again. ~ Jason Buchanan, Rovi|7.6/10|117|104|13|7.6/10|31|27|4|3.6/5|127,066
770678739|Holly|Guy Moshe|Drama|Nov 9, 2007|Jan 27, 2009||R (for disturbing sexual situations involving children, and for language)|114|Priority Films/Slowhand Cinema Releasing|Guy Jacobson, Guy Moshe|Set in Cambodia, depicts child prostitution through the non-sexual, complex relationship between Holly, a beautiful 12-year-old Vietnamese girl, and Patrick, an obsessive 40-year-old American stolen artifacts dealer.|6.3/10|23|15|8|5.7/10|12|5|7|3.5/5|443
770676705|Repo! The Genetic Opera|Darren Lynn Bousman|Horror, Musical & Performing Arts, Science Fiction & Fantasy|Jan 20, 2008|Jan 20, 2009|$100,000|R (for strong bloody violence and gore, language, some drug and sexual content)|97|Lionsgate Films|Darren Smith, Terrance Zdunich|Saw series mainstay Darren Lynn Bousman reunites with Twisted Pictures producers Oren Koules and Mark Burg for this futuristic shocker detailing a terrifying epidemic of organ failures. The denizens of planet Earth have been devastated by inexplicable and widespread organ failures, and as a result scientists begin planning a substantial organ harvest. Though an innovative biotech conglomerate subsequently offers the fearful public a means of maintaining their health by enacting a series of hassle-free organ payment plans, things begin to get messy when it's revealed that the financed body parts are subjected to legal default, and that failure to maintain proper payment will result in forceful repossession of the organs. Paul Sorvino and Spy Kids' Alexa Vega star alongside celebrity socialite Paris Hilton in the Lionsgate film. ~ Jason Buchanan, Rovi|4.4/10|58|22|36|3.8/10|17|3|14|3.7/5|27,760
770676248|Closing the Ring|Richard Attenborough|Drama, Romance|Dec 28, 2007|Jan 27, 2009||R (for brief sexuality, nudity and violent images)|119|Alliance Atlantis|Peter Woodward|Sixty-five years after making his screen debut as a young stoker in co-directors Noël Coward and David Lean's World War II drama In Which We Serve, Richard Attenborough perfects the balance between epic story and intimate tale with this drama starring Shirley MacLaine and Neve Campbell as a mother and daughter who find a relic from the past sparking an incendiary series of events. The year is 1991, and as a small American town mourns the passing of beloved World War II veteran Chuck Harris, his wife Ethel (MacLaine) numbs herself with alcohol to the point where she completely neglects her grieving daughter Marie (Campbell). Later, after Marie receives a telephone call from a boy in Northern Ireland who claims to have recently discovered a ring belonging to Ethel, a mystery nearly five decades in the making comes slowly into focus as the story drifts back into Chuck's wartime past and the days when he and Ethel first formed their powerful bond.|4.6/10|18|6|12|||||3.4/5|3,224
770675892|Goodbye, Mr. Chips|Herbert Ross|Drama, Musical & Performing Arts, Romance|Nov 5, 1969|Jan 27, 2009||G|151|MGM|Terence Rattigan|This is a musical remake of the 1939 film. Arthur Chipping (Peter O'Toole) is the staid instructor at a posh school for boys where he dreams of becoming headmaster. He falls in love with Katherine (Petula Clark) and he helps the singing dance-hall girl polish her social skills. The two are married, but Katherine is killed during in an airplane crash on her way to entertain Allied troops. Arthur carries on, dedicating his life to her memory and teaching two generations of students who were lucky enough to have him for a teacher and a friend. Herbert Ross makes his directorial debut in this sentimental musical that never approached the success of the original.|7/10|5|5|0|||||3.7/5|631
770669668|Far From the Madding Crowd|John Schlesinger|Drama, Romance|Oct 18, 1967|Jan 27, 2009||PG|165|MGM Home Entertainment|Frederic Raphael|This 1967 version of Thomas Hardy's novel should have done better at the box office than it did, given the star power of Julie Christie and the visual and aural fidelity to its source material. Julie Christie plays Bathsheba Everdene, a country heiress who is loved by three different men: Terence Stamp, Peter Finch and Alan Bates. Convinced that she is the intellectual superior of all three, Bathesheba loses many early opportunities for lasting happiness. Finally shedding herself of her haughty attitude, Bathsheba unconditionally accepts the love of Bates. The euphoric exuberance of Nicolas Roeg's photography is matched by the direction of John Schlesinger and the screenplay by Frederick Raphael. Only the nittiest of nitpickers would complain that some of the medium shots don't match the closeups (watch Terence Stamp's clown makeup in one scene). ~ Hal Erickson, Rovi|7.8/10|25|18|7|9.2/10|8|4|4|3.9/5|1,077
770669554|Pride and Glory|Gavin O'Connor|Drama, Kids & Family|Oct 24, 2008|Jan 27, 2009|$15,709,385|R (for strong violence, pervasive language and brief drug content)|130|New Line Cinema|Joe Carnahan, Gavin O'Connor|Director Gavin O'Connor collaborates with Narc director/screenwriter Joe Carnahan on this family-focused police drama concerning an honest homicide detective (Edward Norton) assigned to investigate the precinct run by his potentially crooked older brother (Noah Emmerich). As the investigation begins to reveal some troubling facts about the precinct, it gradually becomes apparent that the policeman who is also the older brother's best friend (Colin Farrell) may be the man orchestrating many of the suspected crimes. ~ Jason Buchanan, Rovi|5/10|154|53|101|4.9/10|38|10|28|3.3/5|78,520
547704585|Cannery Row|David S. Ward|Classics, Comedy, Drama, Romance|Feb 12, 1982|Jan 27, 2009||PG|120|WARNER BROTHERS PICTURES|David S. Ward|This highly anecdotal film centers upon Doc (Nick Nolte), a self-employed marine biologist who lives by the ocean and interacts with the neighborhood denizens, trying to conceal a troubled past. Across from Doc's digs stands the local bordello, the Bear Flag Restaurant. Across the entrance ambles Suzy (Debra Winger), a drifter who tries to become one of the girls and fails miserably. However, she does set her sights on Doc and acts accordingly.|6.7/10|5|4|1|||||3.5/5|968
528394726|The Children of Huang Shi|Roger Spottiswoode|Art House & International, Drama|May 23, 2008|Jan 20, 2009|$652,604|R (for some disturbing and violent content)|125|Sony Pictures Classics|James MacManus, Jane Hawksley|Inspired by true events, the film tells the story of George Hogg, a young British journalist, who rescues 60 orphaned children. He leads them on a treacherous 1000-mile journey along the Silk Road, through the Liu Pan Shan Mountains into the spectacular Gobi desert. Over the course of the journey he falls in love with a determined, self-trained nurse, and makes a friend in Chen, the leader of a Chinese partisan group. Madame Wang, a surviving aristocrat, assists in guiding them to safety in a remote village near the western end of China's Great Wall.|4.7/10|78|24|54|4.9/10|29|10|19|3.2/5|70,053
528367246|Save Me|Alan Roberts|Drama, Mystery & Suspense|Jan 1, 1993|Jan 20, 2009||R|96|First Run Features||Three stalwarts of made-for-TV productions -- Harry Hamlin, Michael Ironside, and Steve Railsback -- team up for this erotic thriller. Hamlin plays a mild-mannered accountant who takes up with an intriguing stranger (Lysette Anthony), who happens to harbor multiple personalities: seductress, prude, and saint.|6.1/10|31|21|10|6.2/10|13|9|4|3.6/5|1,033
385330012|Magnificent Obsession|Douglas Sirk|Classics, Drama, Romance|Aug 4, 1954|Jan 20, 2009||NR|108|Universal|Robert Blees, Wells Root|"In this film version of Lloyd C. Douglas' spiritual novel, Rock Hudson plays a reckless playboy who is indirectly responsible for the death of a kindly doctor. The dead man's wife, Jane Wyman, refuses to accept Hudson's apologies. When Wyman is blinded, Hudson decides to ""do right"" by her anonymously."|7.4/10|21|19|2|6/10|5|5|0|3.7/5|1,085
259260118|Fetching Cody|David Ray|Comedy, Drama, Science Fiction & Fantasy|Jan 1, 2005|Jan 27, 2009||NR|87|Vanguard|David Ray|A small-time Vancouver drug dealer traverses through time in a desperate bid to alter the grim fate of his comatose girlfriend in this bittersweet time travel fantasy from first-time director David Ray. Art (Jay Baruchel) is a petty drug slinger whose relationship with girlfriend and addict Cody (Sarah Lind) is starting to get serious. After Art arrives home one evening to find Cody overdosed on the floor and drifting into a coma, he seeks refuge at the home of eccentric junk collector Harvey (Jim Byrnes) -- an old street friend who claims that the ratty recliner he has recently acquired is actually a cleverly disguised time machine. Immediately dismissing his friend's outlandish claim but desperate to fulfill his promise that he will always be there to protect her, Art collapses in the chair and wishes himself back to the time before Cody became addicted to drugs. Upon awakening in another time, Art realizes that the chair is in fact the real deal and embarks on a desperate mission to change the future and save Cody's life.|4.1/10|5|0|5|||||3.6/5|1,160
136194851|Waterloo Bridge|Mervyn LeRoy|Classics, Drama, Romance|May 17, 1940|Jan 27, 2009||NR|109|Warner Home Video|George Froeschel, Hans Rameau, S.N. Behrmann|In this film, Robert Taylor, a British officer from a wealthy family, falls in love with ballerina Vivien Leigh. Taylor's uncle reluctantly agrees to the upcoming marriage. When Taylor marches off to war, Vivien abandons an important dance recital to bid her fiance goodbye, losing her job as a result.|6.4/10|5|4|1|||||4/5|4,615
770797616|The Lodger|David Ondaatje|Drama, Horror, Mystery & Suspense|Jan 23, 2009|Feb 10, 2009||R (for violent content, language and brief nudity)|96|Samuel Goldwyn Films/IDP|David Ondaatje|Malcolm Slaight arrives at the home of Joe and Ellen Bunting. Ellen is happy to make a little extra money, but also becomes enamored by the charm and eccentricities of this mysterious Lodger. Meanwhile, police detective Chandler Manning begins to track a ruthless killer slaughtering prostitutes along West Hollywood's Sunset Strip. This killer's methods are identical to that of London's infamous psychopath, Jack the Ripper. This is especially troublesome for Manning because earlier in his career he brought a killer to justice who also mimicked Jack the Ripper. Closing in on the killer, Manning finds himself following a trail that leads to a secluded residence located just off the Sunset Strip--right near the Bunting home.|3.6/10|24|5|19|2.4/10|9|0|9|2.9/5|6,619
770797383|Noah's Arc: Jumping the Broom|Patrik-Ian Polk|Drama, Gay & Lesbian|Oct 24, 2008|Feb 3, 2009|$389,194|R (for sexual content and language)|101|Logo Features|Patrik-Ian Polk, John R. Gordon|The popular Logo series about the lives and loves of four gay African-American men gets the feature-film treatment with this road movie that finds longtime friends Noah, Alex, Ricky, and Chance traveling to Martha's Vineyard with their significant others for a weekend wedding retreat. Aspiring Los Angeles screenwriter Noah (Darryl Stephens) and his partner, Wade (Jensen Atwood), are about to be married in an intimate Martha's Vineyard ceremony, and to celebrate in style Noah has invited Alex (Rodney Chester), Ricky (Christian Vincent), and Chance (Douglas Spearman) to join the couple on a cross-country road trip from California to Massachusetts. However, the trip is far from the relaxing getaway that Noah had hoped for, because along the way secrets are revealed, hearts are bruised, and friendships are put to the ultimate test. Not only are Chance and Eddie beginning to feel the urge to scratch their seven-year itch, but playboy Ricky has a secret that's sure to rock everyone's world, and the appearance of a surprise visitor quickly threatens to overshadow the main event. Add a closeted rapper and a high-maintenance studio executive into the mix, and you've got the recipe for an endearing romantic comedy that's as poignant as it is hilarious.|5.7/10|8|4|4|5.4/10|7|3|4|3.9/5|655
770789932|Freakdog (Red Mist)|Paddy Breathnach|Art House & International, Drama, Horror, Mystery & Suspense, Science Fiction & Fantasy|Feb 10, 2009|Feb 10, 2009||NR|85|Starz Entertainment||Shrooms director Paddy Breathnach returns to terrify horror hounds with this supernatural shocker about a dangerous loner who falls into a deep coma, and travels out of body to seek revenge against his tormentors. Kenneth Chisholm is a depraved hospital janitor with a penchant for snapping voyeuristic cell phone pictures. One night, while out at a local bar, a group of trainee medical students work up the courage to confront the sleazy shutterbug. Devastated, Kenneth suffers from an epileptic fit and falls into a deep coma. Later, when remorseful trainee Catherine Thomas attempts to revive Kenneth by administering an experimental drug cocktail designed especially for coma patients, she inadvertently sets off a horrifying series of events that will put the lives of both herself and her fellow students in grave danger. As a result, Kenneth is jolted into an out of body state that allows him to enter the bodies of his enemies and manipulate them into doing his bloody bidding. But who can you turn to for help when the person you always counted on could be possessed by a madman? When anyone can be the killer, no one can be trusted. ~ Jason Buchanan, Rovi|2.9/10|14|1|13|||||2.5/5|690
770783450|Bachna Ae Haseeno|Siddharth Anand|Art House & International, Comedy, Romance|Aug 15, 2008|Feb 11, 2009|$691,678|NR|152|Yash Raj Films|Aditya Chopra, Devika Bhagat, Anvita Dutt Guptan|Why do girls always fall for the wrong guy? Their mothers warn them about him. Their friends shake their heads disapprovingly. Their minds tell them to escape while the going is good. But no! oh no! Their hearts are another story. You see, they are sending all the wrong signals. His name alone is enough to scramble their brains and set their hearts racing.Meet Raj. He is the stuff of dreams, with the looks of a 'butter wouldn't melt in my mouth' good boy. Who can blame him for falling in love as many times as love is fortunate enough to find him. It's not his fault that he's a heartbreaker, it's in his DNA. Come discover his three love stories; Raj and Mahi, Raj and Radhika, Raj and Gayatri. Different lady loves at different times in his life. And each of them, teach him a little bit about love and a little bit about life, in their own sweet, sexy or sassy way.Come fall in love... three times.|6.1/10|5|4|1|||||3.5/5|3,185
