770808302|A Shine of Rainbows|Vic Sarin|Drama, Kids & Family|Apr 23, 2010|Mar 15, 2011||PG (for some thematic elements, mild peril and smoking)|100|Freestyle Releasing|Vic Sarin, Catherine Spear, Dennis Foon|A young boy struggles to find love and acceptance with his new family in this drama from director Vic Sarin. Tomas (John Bell) is an eight-year-old orphan living in a home for children without parents on an island off the Irish coastline. Tomas has become a target for bullies and knows little peace at the orphanage, so he's overjoyed when he's adopted by Maire O'Donnell (Connie Nielsen), a lovely and caring woman who takes the boy under her wing. However, while Maire shows Tomas plenty of kindness, the same cannot be said for her husband, Alec (Aidan Quinn), who doesn't hide his disappointment with his frail new son. As Tomas tries to understand Alec and live up to his expectations, he finds a baby seal on the beach, and begins caring for the abandoned animal, showing it the compassion he's longed for in his own life. A Shine of Rainbows was an official selection at the 2009 Toronto International Film Festival. ~ Mark Deming, Rovi|5.3/10|9|4|5|||||3.7/5|661
770808366|Morning Glory|Roger Michell|Comedy|Nov 10, 2010|Mar 8, 2011|$30,982,329|PG-13 (for some sexual content including dialogue, language and brief drug references)|107|Paramount Studios|Aline Brosh McKenna|"A new romantic comedy set in the hilarious and dysfunctional world of morning television. When hard-working TV producer Becky Fuller (McAdams) is fired from a local news program, her career begins to look as bleak as her hapless love life. Stumbling into a job at ""Daybreak"" (the last-place national morning news show), Becky decides to revitalize the show by bringing on legendary TV anchor Mike Pomeroy (Ford). Unfortunately, Pomeroy refuses to cover morning show staples like celebrity gossip, weather, fashion and crafts, let alone work with his new co-host, Colleen Peck (Keaton), a former beauty queen and longtime morning show personality, who is more than happy covering morning ""news."" As Mike and Colleen clash, first behind the scenes and then on the air, Becky's blossoming love affair with fellow producer, Adam Bennett (Wilson) begins to unravel. And soon Becky is struggling to save her relationship, her reputation, her job and ultimately, the show itself."|6/10|177|98|79|5.7/10|47|19|28|3.3/5|50,194
770809218|No One Knows About Persian Cats (Les Chats Persans)|Bahman Ghobadi|Art House & International, Comedy, Drama|Apr 16, 2010|Mar 15, 2011||NR|106|IFC Films|Bahman Ghobadi, Roxana Saberi, Hossein M. Abkenar|Recently released from prison, two young musicians decide to form a band. Together they search the underworld of contemporary Tehran for other players. Forbidden by the authorities to play in Iran, they plan to escape from their clandestine existence, and dream of performing in Europe. But with no money and no passports, it won't be easy... -- (C) IFC|7.3/10|59|56|3|7.5/10|19|19|0|3.7/5|2,569
770810632|The Switch|Josh Gordon, Will Speck|Comedy, Drama, Romance|Aug 20, 2010|Mar 15, 2011|$27,400,000|PG-13 (for mature thematic content, sexual material including dialogue, some nudity, drug use and language)|101|Miramax|Allan Loeb|"""The Switch,"" is an offbeat comedy about Kassie, a smart, fun-loving single woman who, despite her slightly neurotic best friend Wally's objections, decides it's time to have a baby-even if it means doing it by herself- with a little help from a charming sperm donor. But, unbeknownst to her, Kassie's plans go awry because of a last-minute switch that isn't discovered until seven years later when Wally finally gets acquainted with Kassie's precocious-though slightly neurotic-son. From the people behind ""Little Miss Sunshine"" and ""Juno"" comes ""The Switch,"" due in theaters this summer."|5.5/10|150|77|73|5.4/10|38|17|21|3.1/5|79,041
770813276|Four Lions|Christopher Morris|Comedy, Drama|Nov 5, 2010|Mar 8, 2011|$308,769|R (for language throughout, including some sexual references)|102|Drafthouse Films|Christopher Morris, Jesse Armstrong, Sam Bain, Simon Blackwell|"In a British city, four men have a secret plan. Omar is disillusioned about the treatment of Muslims around the world and is determined to become a soldier. This is the most exciting idea Waj has ever heard. Opposed to Omar and everyone else on earth is the white islamic convert Barry. He'd realize he joined the cell to channel his nihilism -- if he had half the self knowledge of a duck. Faisal is the odd man out. He can make a bomb -- but he can't blow himself up just now coz his sick dad has ""started eating newspaper."" Instead he's training crows to fly bombs through windows. This is what Omar has to deal with. They must strike a decisive blow on their own turf but can any of them strike a match without punching himself in the face?"|7.3/10|132|109|23|6.7/10|33|24|9|3.8/5|23,300
770856666|Waste Land|Lucy Walker, João Jardim, Karen Harley|Art House & International, Documentary, Musical & Performing Arts|Oct 29, 2010|Mar 15, 2011|$100,000|NR|95|Arthouse Films||"Filmed over nearly three years, WASTE LAND follows renowned artist Vik Muniz as he journeys from his home base in Brooklyn to his native Brazil and the world's largest garbage dump, Jardim Gramacho, located on the outskirts of Rio de Janeiro. There he photographs an eclectic band of ""catadores"" -- or self-designated pickers of recyclable materials. Muniz's initial objective was to ""paint"" the catadores with garbage. However, his collaboration with these inspiring characters as they recreate photographic images of themselves out of garbage reveals both dignity and despair as the catadores begin to re-imagine their lives. Walker (Devil's Playground, Blindsight) has great access to the entire process and, in the end, offers stirring evidence of the transformative power of art and the alchemy of the human spirit.-- (C) Official Site"|8.1/10|70|70|0|7.7/10|22|22|0|4.3/5|8,014
770858010|Yogi Bear|Eric Brevig|Action & Adventure, Animation, Comedy, Kids & Family|Dec 17, 2010|Mar 22, 2011|$100,169,068|PG|82|Warner Bros. Pictures|Joshua Sternin, Jeffrey Ventimilia, Brad Copeland, Josh Sternin, Jeff Ventimilia|"Everyone's favorite pic-a-nic basket-stealing bear comes to the big screen in ""Yogi Bear,"" a new adventure, filmed in 3D, that combines live action with computer animation. Dan Aykroyd stars as the voice of Yogi, Jellystone Park's notorious troublemaker, and Justin Timberlake as the voice of Boo Boo, Yogi's faithful pal and co-conspirator in his never-ending schemes to separate park visitors from their lunches. Yogi has always relied on his quick wit and fast feet to stay one step ahead of irate campers while dodging his long-suffering nemesis, Ranger Smith. But he and Boo Boo are about to face a situation worse than anything Yogi has ever gotten them into... Jellystone Park is being sold! To cover his mismanagement of city funds and fuel his election campaign, Mayor Brown plans to sell the park to loggers. Families will no longer be able to experience the natural beauty of the outdoors Jellystone has always provided--and, even worse, Yogi, Boo Boo, and all their friends will be tossed out of the only home they've ever known. Faced with his biggest challenge ever, Yogi must prove he really is ""smarter than the average bear,"" as he and Boo Boo join forces with Ranger Smith to find a way to save the park from closing forever. -- (C) Warner Bros"|3.6/10|103|13|90|3.7/10|21|3|18|2.8/5|56,168
770859253|Kenny Chesney: Summer In 3d|Joe Thomas|Musical & Performing Arts, Special Interest|Apr 21, 2010|Mar 8, 2011||NR|99|Sony Pictures||"Kenny Chesney, the biggest ticket-seller of this century in any musical genre, has wrapped his latest concert tour, the Sun City Carnival. This spring, Sony Pictures Releasing's special programming division, The Hot Ticket, will take audiences for another ride. For a limited engagement beginning in April 2010 in movie theaters nationwide, ""Kenny Chesney: Summer in 3D,"" will give fans the chance to live the fun, the friends, the songs and the moments that make Kenny Chesney the must-see concert experience to kickoff the summer season."|6.1/10|7|4|3|6.1/10|6|3|3|4/5|842
770863872|Hereafter|Clint Eastwood|Drama, Mystery & Suspense|Oct 22, 2010|Mar 15, 2011|$32,741,596|PG-13 (for mature thematic elements including disturbing disaster and accident images, and for brief strong language)|126|Warner Bros. Pictures|Peter Morgan|"""Hereafter"" tells the story of three people who are touched by death in different ways. George is a blue-collar American who has a special connection to the afterlife. On the other side of the world, Marie, a French journalist, has a near-death experience that shakes her reality. And when Marcus, a London schoolboy, loses the person closest to him, he desperately needs answers. Each on a path in search of the truth, their lives will intersect, forever changed by what they believe might -- or must -- exist in the hereafter."|5.7/10|229|107|122|6.5/10|45|26|19|2.9/5|67,190
770872034|The Parking Lot Movie|Meghan Eckman, Christopher Hlad|Documentary, Special Interest|Aug 6, 2010|Mar 15, 2011||NR|84|Redhouse Productions|Meghan Eckman|"The Parking Lot Movie is a documentary about a singular parking lot in Charlottesville, Virginia and the select group of Parking Lot Attendants that inhabit its microcosm. The Attendants are a uniquely varied group of men comprised of both undergraduate and graduate students, philosophers, intellectuals, musicians, artists, and marginal-type characters. Three years in the making, this documentary is a strange rite of passage for all involved. Themes receiving daily scrutiny and detailing include cars and license plates, capitalism, anger, justice, drunkenness, spiritual awareness, class struggle, entitlement, and working in the Service Sector. These all mesh together in the orbit of the Parking Lot Attendant. For these Parking Attendants, the intersection between the status quo and the quest for freedom becomes the challenge. Something as simple as a parking lot becomes an emotional way station for The American Dream. As one Attendant interestingly puts it, ""We had it all in a world that had nothing to offer us."" -- (C) Official Site"|6.6/10|8|6|2|||||3.8/5|834
770872129|The Wildest Dream: Conquest of Everest|Anthony Geffen|Documentary, Special Interest|Aug 6, 2010|Mar 15, 2011|$873,594|PG (for thematic elements involving hardships of climbing, and some historical smoking images)|94|National Geographic Cinema Ventures|Mark Halliley|Eighty-five years after George Mallory s final attempt to summit Mount Everest, The Wildest Dream explores Mallory s obsession with becoming the first person to reach the highest place on Earth. Told through the explorer s poignant and evocative letters to his wife, Ruth, previously unseen photos and film archive from 1924 (restored from the original nitrate especially for the film), dramatization and a modern-day expedition retracing the original route taken in 1924, Mallory s incredible adventure lives again. The expedition was led by renowned mountaineer Conrad Anker, whose life became inextricably linked with Mallory s after he found Mallory s body on Everest in 1999. Using replica 1920s-era clothing and equipment, Anker sets out to solve the great mystery of whether Mallory succeeded in summiting Everest before he died he was last seen just 800 feet from the summit before the clouds closed in and he disappeared into legend. The most heartbreaking clue: All of Mallory s belongings were found intact on his body, except the photograph of his beloved Ruth, which he promised to leave at the top of the world if he succeeded. -- (C) National Geographic|6.9/10|35|27|8|6.2/10|15|9|6|3.7/5|1,903
770872894|The People I've Slept With|Quentin Lee|Comedy|Aug 13, 2010|Mar 22, 2011|$16,383|NR|89|408 Films|Koji Steven Sakai|The People I've Slept With - a promiscuous woman who finds herself with an unplanned pregnancy and needs to figure out who the baby daddy is...NOW. -- (C) Official Site|5.5/10|11|3|8|5.6/10|6|2|4|3/5|1,631
770873457|The Next Three Days|Paul Haggis|Drama, Horror, Mystery & Suspense, Romance|Nov 19, 2010|Mar 8, 2011|$21,100,000|PG-13 (for violence, drug material, language, some sexuality and thematic elements)|133|Lionsgate|Paul Haggis|His wife convicted of a murder she swears she did not commit, a college professor plots to break her out of prison in this thriller starring Russell Crowe and Liam Neeson. John Brennan (Crowe) and his wife, Lara (Elizabeth Banks), were happily married and raising a family when their lives fell apart in the blink of an eye. Lara has been charged with murder, and despite every effort to prove her innocence, the judge sentences her to an extended prison sentence. Meanwhile, on the outside, John files multiple appeals while struggling to raise their children and maintain his career. Lara's future starts to look especially grim, however, after the final appeal is rejected, and she admits that she'd rather commit suicide than spend the rest of her life behind bars. Determined to save his wife after the justice system fails her, John seeks the advice of ex-convict Damon Pennington (Liam Neeson), who staged his own daring prison escape, in order to draw up an airtight plan. Later, John prepares to put his life on the line for the woman he loves, and sets the plan into motion with the knowledge that one false move could be their last. ~ Jason Buchanan, Rovi|5.8/10|166|84|82|5.5/10|36|12|24|3.5/5|51,500
770874169|Helena From The Wedding|Joseph Infantolino|Drama|Nov 12, 2010|Mar 8, 2011||NR|89|Film Movement|Joseph Infantolino|In this nuanced and comedic portrait of marriage, newlyweds Alex (Lee Tergesen) and Alice (Melanie Lynskey) host a New Year's Eve party for their closest friends at their remote cabin in the mountains. However, when Alice's friend brings along a surprise guest-the very young and beautiful Helena (Gillian Jacobs)-the group's facades begin to crumble. -- (C) Film Movement|4.9/10|10|5|5|6/10|5|4|1|2.6/5|3,376
771035591|The Tourist|Florian Henckel von Donnersmarck|Action & Adventure, Mystery & Suspense, Romance|Dec 10, 2010|Mar 22, 2011|$67,631,157|PG-13 (for violence and brief strong language)|103|Columbia Pictures|Florian Henckel von Donnersmarck, Christopher McQuarrie, Julian Fellowes|American tourist Frank (Johnny Depp) meets a mysterious beauty who drags him into a dangerous world of intrigue and espionage while traveling through Europe in director Florian Henckel von Donnersmarck's paranoid thriller. When Frank met Elise (Angelina Jolie) on the train, he thought it was a chance encounter. Little did Frank realize it was all part of a much bigger plan, one that would soon find him dodging bullets through both the historic streets of Paris and the winding canals of Venice. Now, the faster Frank and Elise run, the more intense their romance grows. ~ Jason Buchanan, Rovi|4.3/10|168|33|135|4/10|36|3|33|3/5|94,758
771198826|Meskada|Josh Sternfeld|Drama, Mystery & Suspense|Dec 3, 2010|Mar 22, 2011||R (for language, some violence and a scene of sexuality)|88|Red Flag Releasing|Josh Sternfeld|Meskada follows a small-town detective named Noah Cordin as he struggles to solve the brutal murder of a boy in the peaceful, affluent town of Hilliard. The killers left behind no clues at the crime scene, with the exception of a scrap of paper leading Cordin back to his hometown of Caswell. Here, Cordin and county detective Leslie Spencer consult with Cordin's old friends, all of whom are suffering from the economic troubles that have plunged Caswell into near destitution. As their search fails to turn up a suspect, feverish tensions rise between the towns of Hilliard and Caswell, until the film reaches its shocking climax. Meskada captures a snapshot of quintessential American small-town life. The story calls to mind our nation's history, the brutal clashes over land and territory, the class-divides and the improbable victories for equal opportunity. Meskada portrays a vivid picture of the rift between characters in two towns, people bound by loyalty, family, community, and a battle born of circumstances beyond their control. -- (C) Official Site|3.6/10|6|2|4|||||2.7/5|896
771200415|Inside Job|Charles Ferguson (III)|Documentary, Special Interest|Oct 8, 2010|Mar 8, 2011|$4,311,834|PG-13 (for some drug and sex-related material)|108|Sony Pictures Classics|Charles Ferguson (III) , Chad Beck, Adam Bolt|"From Academy Award (R) nominated filmmaker, Charles Ferguson, comes ""Inside Job,"" the first film to expose the shocking truth behind the economic crisis of 2008. The global financial meltdown, at a cost of over $20 trillion, resulted in millions of people losing their homes and jobs. Through extensive research and interviews with major financial insiders, politicians and journalists, ""Inside Job"" traces the rise of a rogue industry and unveils the corrosive relationships which have corrupted politics, regulation and academia."|8.2/10|146|143|3|8.5/10|33|32|1|4.2/5|29,555
771201460|How Do You Know|James L. Brooks|Comedy, Drama, Romance|Dec 17, 2010|Mar 22, 2011|$30,212,620|PG-13 (for sexual content and some strong language)|121|Columbia Pictures|James L. Brooks|Director James L. Brooks returns to the helm for this ensemble comedy starring Reese Witherspoon, Jack Nicholson, Paul Rudd, and Owen Wilson, which centers on the story of a passionate athlete who finds herself romantically torn between a narcissistic baseball star and a straight-laced businessman. As far back as Lisa (Witherspoon) can remember, her life has been defined by sports. Then, in the blink of an eye, she's cut from the team. With her identity in crisis as she attempts to regain her footing in life, Lisa begins dating Matty (Wilson), a Major League Baseball pitcher and notorious womanizer. Meanwhile, terminally honest businessman George (Rudd) finds himself on the road to financial ruin or worse after being wrongly implicated in a financial crime. As George struggles to clear his name and reconcile his turbulent relationship with his father, Charles (Nicholson), a chance meeting with Lisa at the lowest point in both of their lives leaves him optimistic that things may work out after all. Meanwhile, Lisa and George both realize that the only thing that's certain about the future is that we never know what fate has in store for us. ~ Jason Buchanan, Rovi|4.9/10|148|47|101|5.2/10|43|16|27|2.5/5|41,909
771202871|Every Day|Richard Levine|Comedy, Drama|Jan 14, 2011|Mar 8, 2011|$9,857|R (for language, sexual content and some drug use)|90|Image Entertainment|Richard Levine|Helen Hunt, Liev Schreiber, Brian Dennehy, Eddie Izzard and Carla Gugino star in EVERY DAY, a story about a family's struggle to survive life's curve-balls that ultimately bring out the best and worst in us and make us closer. Ned is a television writer on a seedy drama whose life is turned upside down when his wife's estranged father moves in with their family. EVERY DAY is an honest look at an ordinary family making it through life's challenges together. --© Official Site|4.6/10|32|11|21|5.2/10|12|5|7|2.8/5|4,901
771203481|Skyline|Greg Strause, Colin Strause|Mystery & Suspense, Science Fiction & Fantasy|Nov 12, 2010|Mar 22, 2011|$12,000,000|PG-13 (for sequences of intense sci-fi action and violence, some language, and brief sexual content)|92|Rogue Pictures/Universal Studios|Joshua Cordes, Liam O'Donnell|After a late night party, a group of friends is awakened in the dead of the night by an eerie light beaming through the window. Like moths to a flame, people outside are being drawn to strange lights, which have descended upon Los Angeles, and then suddenly vanishing into the air. Survivors must fight for their lives as the extraterrestrial force threatens to swallow the entire human population off the face of the Earth.|3.6/10|82|13|69|3/10|16|0|16|2.1/5|67,229
771203886|No One Killed Jessica|Rajkumar Gupta|Drama|Jan 7, 2011|Mar 8, 2011|$439,801|NR|136|UTV Communications|Rajkumar Gupta|April 1999, New Delhi. Jessica, a young attractive model hired as a celebrity bartender for a night, is shot dead at a private party. Her crime - refusing to serve a drink after closing hours. The culprit Manish, son of a prominent politician, inebriated by a deadly cocktail of alcohol and a sense of entitlement, pulls the trigger in a fit of rage. With 300 of Delhi's swish set present at the party, many of whom are witnesses to the murder, Manish looks all set to go to the gallows. Except, it doesn't quite turn out that way. Now two women, Jessica's sister, Sabrina and a feisty TV reporter, Meera, will have to drum up every resource at their disposal to outwit Manish at his own game, if the truth is to have any chance of prevailing over money and political clout. -- (C) UTV|6.8/10|8|6|2|||||3.5/5|5,636
771203941|Adventures of a Teenage Dragonslayer|Andrew Lauer|Action & Adventure, Comedy, Kids & Family, Science Fiction & Fantasy, Television||Mar 8, 2011||PG|88|Razor Sharp Productions|Jamie Nash|Bullied 12-year-old Arthur learns that he alone holds the key to slaying a vicious dragon after being rescued by a benevolent troll in this fantasy adventure for the entire family. When Arthur fails to convince his skeptical mother that their small town is about to come under attack from a fire-breathing dragon, the determined boy enlists his best friends Tim and Natalie to help slay the beast before the suburbs burn.|5.9/10|5|3|2|||||2.5/5|363
771208050|Sharktopus|Declan O'Brien|Horror, Mystery & Suspense, Science Fiction & Fantasy|Sep 25, 2010|Mar 15, 2011||NR|89|Anchor Bay Entertainment|Mike Maclean|"An eight-tentacled nightmare hybrid of shark and octopus, ""S-11"" was created by genetic scientist Nathan Sands as the U.S. Navy's next super-weapon. But when its control implants are damaged during a training experiment off the Mexican coast, the beast escapes to Puerto Vallarta to sample the local fare -- bikini babes, jet-skiers, and spring-breakers. With the ocean terror now out of control and seemingly invincible, a ragtag group -- comprised of a hotshot mercenary, an investigative reporter, and Sand's biomechanical engineer daughter -- have come together to stop the unholy beast from turning a seaside tourist resort into the ultimate human buffet."|7/10|7|4|3|||||2.3/5|1,067
771209067|Mumbai Diaries|Kiran Rao (II)|Art House & International, Drama|Jan 21, 2011|Mar 8, 2011|$576,639|PG|100|UTV Communications|Kiran Rao (II)|Dhobi Ghat (Mumbai Diaries) is the story of four people from very different backgrounds, whose worlds intersect and leave them forever altered. As they find themselves drawn into compelling relationships, the city finds its way into the crevices of their lives, separating them even as it brings them closer... Fragments of their experience - seen through a naïve video diary, black and white photographic images and painting - form a portrait of Mumbai and its people, bound together as they journey through longing, loneliness, loss and love. -- (C) UTV|6.8/10|25|17|8|6.1/10|12|7|5|3.5/5|6,242
771210013|The Man From Nowhere|Jeong-beom Lee|Action & Adventure, Art House & International|Sep 30, 2010|Mar 8, 2011||R (for strong bloody violence, pervasive language, drug content and brief nudity)|119|Well Go USA|Jeong-beom Lee|A retired special agent forges an unlikely bond with his neglected young neighbor, and vows to bring the girl back home safely after she's kidnapped by violent criminals. When Tae-Shik hung up his guns to open a small pawn shop, he also shut himself off from the world. Tae-Shik prefers to live in solitude, yet he still takes a liking to his precocious neighbor So-mi, whose mother pay her little attention. When So-Mi's mother crosses a local gang of criminals who respond by kidnapping the desperate mother and daughter, Tae-Shik realizes that he may be their only hope of making it out of the situation alive. After entering into a tenuous agreement with the local mob, Tae-Shik becomes the target of an intense police manhunt and finds himself besieged on all sides. Now the closer Tae-Shik gets to So-Mi and her mother, the more his dark past finally begins coming into focus. ~ Jason Buchanan, Rovi|6.5/10|6|6|0|||||4.2/5|5,468
771217415|Hemingway's Garden of Eden|John Irvin|Drama|Dec 10, 2010|Mar 15, 2011|$22,083|R (for strong sexual content, nudity and some language)|96|Roadside Attractions|James Scott Linville|"Produced for Tranquil Seas by Lorne Thyssen and Timothy J. Lewiston, directed by John Irvin and starring Mena Suvari, Jack Huston, Caterina Murino, Carmen Maura, Richard E. Grant and Matthew Modine, ""Hemingway's Garden Of Eden"" was adapted from the Ernest Hemingway book by former Paris Review editor James Scott Linville. The book was published posthumously and, when it finally hit the bookstores in 1986, it was an immediate success. It remains one of Hemingway's most debated novels. Set in the jazz age years, prior to the depression, the story follows a successful young American writer, David Bourne (JACK HUSTON), and his beautiful wife, Catherine (MENA SUVARI), on their extended honeymoon in Europe. Catherine soon becomes restless and starts to test her husband's devotion, pushing him to the limits of her imagination. Already unsure of the games his wife is playing, David is both uncomfortable and curious when she brings a sultry Italian girl, Marita (CATERINA MURINO), to spice things up. As the erotic game reaches new levels, the events that follow will change their lives forever. --© Roadside Attractions"|3.6/10|23|1|22|3.3/10|7|0|7|2.4/5|982
