770816172|Resident Evil: Afterlife|Paul W.S. Anderson|Action & Adventure, Horror, Mystery & Suspense, Science Fiction & Fantasy|Sep 10, 2010|Dec 28, 2010|$60,128,566|R (for sequences of strong violence and language)|97|Sony Pictures/Screen Gems|Paul W.S. Anderson|Experience a new dimension in action horror as director Paul W.S. Anderson uses the 3D technology pioneered by James Cameron and Vincent Pace to take movie lovers on a nightmare thrill-ride. It's been five years since the zombie virus swept across the globe, and Alice (Milla Jovovich) is still traveling tirelessly in search of survivors. When the Umbrella Corporation ratchets up the stakes, an old friend turns up to lend Alice a helping hand. Rumor has it that some survivors have found sanctuary in Los Angeles, but when Alice and friends show up they find the city overrun with zombies, and quickly realize they've stumbled into a diabolical trap. ~ Jason Buchanan, Rovi|4.1/10|100|23|77|3.8/10|14|5|9|3.2/5|128,224
770818147|Alamar (To the Sea)|Pedro González-Rubio|Art House & International, Drama|Jul 14, 2010|Jan 11, 2011|$61,613|G|73|Film Movement|Pedro González-Rubio|A young boy and his father learn about living in harmony with nature in this languid drama from filmmaker Pedro Gonzalez-Rubio. A man from Mexico (Jorge Machado) travels to Italy and falls in love with a beautiful local woman (Roberta Palombini). Their feelings for one another are strong, but they prove to be short lived, and when they decide to beak up after the birth of their son Natan, he returns to Mexico while she stays in Italy and takes primary custody of the child. However, the father strives to remain a presence in his son's life, and the boy visits his father at least once a year. As the five-year-old Natan travels to Mexico, his father has joined the family' fishing operation near the coral reefs of Banco Chinchorro. Living in an elevated cottage near the shore, Natan and his family devote their summer to an idyllic existence, spending their days catching the plentiful fish and observing the wildlife, and their nights sitting by the fire and admiring the stars. To the father, this simple life teaches an important lesson of existing in peace with the natural world, and Natan comes to see himself as being as much a part of this environment as the fish, the waterfowl and the seaweed. Alamar (aka To The Sea) was the first solo directorial credit for cinematographer Pedro Gonzalez-Rubio.|7.4/10|46|42|4|7.4/10|13|12|1|3.9/5|1,074
770818882|Animal Kingdom|David Michôd|Art House & International, Drama|Aug 13, 2010|Jan 18, 2011|$1,000,000|R (for vioence, drug content and pervasive language)|112|Sony Pictures Classics|David Michôd|"Welcome to the Melbourne underworld. It's the Wild West, played out on the city's streets. Armed robber Pope Cody is on the run from a gang of renegade detectives who want him dead. His business partner and best friend, Barry ""Baz"" Brown. wants out of the game. Pope's younger brotherCraig Cody is making a fortune in the illicit substances trade, whilst the youngest Cody brother, Darren, naively navigates his way through this criminal world -- the only world his family has ever known. And into this world arrives their nephew, Joshua ""J"" Cody, who comes to believe that he is a player in this world. But, as he soon discovers, this world is far larger and more menacing than he could ever imagine."|8/10|160|152|8|8.1/10|31|30|1|3.9/5|29,757
770819772|Buried|Rodrigo Cortés|Mystery & Suspense|Sep 24, 2010|Jan 18, 2011|$200,000|R (for language and some violent content)|95|Lionsgate|Chris Sparling|A man is caught in a desperate race against time in this claustrophobic thriller from director Rodrigo Cortés. Paul Conroy (Ryan Reynolds) is an American truck driver who has been contracted to work in Iraq, and while delivering a load of kitchen equipment as part of a humanitarian aid program, he's captured by insurgent guerrillas who intend to hold him hostage. Paul is struck unconscious, put into a coffin-like box, and buried, and when he comes to, all he has to help him get out is a lighter and a cell phone. Trapped underground with a limited supply of air, Paul frantically calls his family, his employer, and American military and political representatives, trying to remain calm as his chances of survival slip farther away with each passing minute. Featuring the voice talent of Robert Paterson, Stephen Tobolowsky, Samantha Mathis, and Erik Palladino, with all the action taking place within the underground box, Buried received its world premiere at the 2010 Sundance Film Festival. ~ Mark Deming, Rovi|7.3/10|155|134|21|7.1/10|27|20|7|3.4/5|63,970
770852280|The Concert (Le concert)|Radu Mihaileanu|Art House & International, Comedy, Musical & Performing Arts|Jul 30, 2010|Jan 1, 2011|$655,474|PG-13 (for brief strong language and some sexual content)|119|Weinstein Company|Radu Mihaileanu, Matthew Robbins, Alain-Michel Blanc|Thirty years ago, Andrei Filipov was the conductor of the illustrious Bolshoi orchestra until he was fired for using Jewish musicians. Now he works as a janitor and drinks too much. But when he intercepts an invitation for the Bolshoi to perform in Paris, Andrei masterminds a plan to gather his own Bolshoi to go in their place in order to make a triumphant return to the music scene. With a motley bunch of former musicians at his side, Andrei sets off for Paris to fulfill his destiny and return to his glory as a great conductor. Along the way, he will reunite with a young, beautiful violin virtuoso who holds the key to his past and to his future.|5.9/10|66|40|26|5.8/10|19|10|9|3.7/5|11,195
770856706|Catfish|Ariel Schulman, Henry Joost|Documentary, Drama, Special Interest|Sep 17, 2010|Jan 4, 2011|$3,234,373|PG-13 (for some sexual references)|86|Universal Pictures/Rogue||In late 2007, filmmakers Ariel Schulman and Henry Joost sensed a story unfolding as they began to film the life of Ariel's brother, Nev. They had no idea that their project would lead to the most exhilarating and unsettling months of their lives. A reality thriller that is a shocking product of our times, Catfish is a riveting story of love, deception and grace within a labyrinth of online intrigue.-- (C) Official Site|7.1/10|149|119|30|6.9/10|33|26|7|3.5/5|25,671
770857927|The Social Network|David Fincher|Drama|Oct 1, 2010|Jan 11, 2011|$96,400,000|PG-13 (for sexual content, drug and alcohol use and language)|120|Columbia Pictures|Aaron Sorkin|"""The Social Network"" explores the moment at which Facebook, the most revolutionary social phenomena of the new century, was invented -- through the warring perspectives of the super-smart young men who each claimed to be there at its inception. The result is a drama rife with both creation and destruction; one that audaciously avoids a singular POV, but instead, by tracking dueling narratives, mirrors the clashing truths and constantly morphing social relationships that define our time. Drawn from multiple sources, the film captures the visceral thrill of the heady early days of a culture-changing phenomenon in the making -- and the way it both pulled a group of young revolutionaries together and then split them apart."|9/10|307|293|14|9.3/10|53|53|0|4.1/5|203,272
770859186|A Film Unfinished|Yael Hersonski|Art House & International, Documentary, Special Interest, Television|Aug 18, 2010|Jan 1, 2011|$311,542|NR (for disturbing images and Holocaust atrocities including graphic nudity)|89|Oscilloscope Pictures||"Yael Hersonski's powerful documentary achieves a remarkable feat through its penetrating look at another film-the now-infamous Nazi-produced film about the Warsaw Ghetto. Discovered after the war, the unfinished work, with no soundtrack, Film Forum is proud to present Yael Hersonski's A FILM UNFINISHED, having its U.S. theatrical premiere on Wednesday, August 18. Since the end of WWII, one copy of a 60-minute (unfinished) propaganda film, shot by the Nazis in the Warsaw Ghetto in May 1942 (a year prior to the uprising), labeled simply ""Ghetto,"" sat undisturbed in an East German archive. A FILM UNFINISHED presents the entire film, both documentary and fictionalized sequences (e.g. dozens of Jewish patrons at an elegant restaurant; a luxurious funeral cortege). It includes a revealing interview with Willy Wist, the only cinematographer identified with the production (himself caught onscreen in his SS uniform), as well as scenes in which now-elderly former residents of the Warsaw Ghetto, reviewing the footage, occasionally recognize their neighbors, or report upon the filmmakers' efforts to stage fantasies of affluence and well-being, or of Jews treating their less fortunate compatriots with callous disdain. This is a film of enormous import: it documents conditions under which ghetto residents lived and the efforts (however imperfect) of the perpetrators to recast this reality to suggest an entirely different scenario. A FILM UNFINISHED is presented with support from the Joan S. Constantiner Fund for Jewish and Holocaust Film. -- (C) Film Forum"|8.4/10|64|62|2|8.8/10|22|22|0|4/5|1,247
770859969|Heartbreaker (L'Arnacoeur)|Pascal Chaumeil, Nicolas Duval-Adassovsky|Art House & International, Comedy, Romance|Sep 10, 2010|Jan 11, 2011|$504,030|PG|104|Universal|Yoann Gromb, Jeremy Doner, Laurent Zeitoun|HEARTBREAKER is an action-packed romantic comedy pairing two of France's biggest young stars: Romain Duris (THE BEAT THAT MY HEART SKIPPED, PARIS) and actress/singer Vanessa Paradis (GIRL ON THE BRIDGE). A smash hit in France, the film was also featured at the Tribeca Film Festival. Charming, funny and effortlessly cool, Alex (Duris) is a professional heartbreaker who for a fee can turn any husband, fiance or boyfriend into an ex. Alex has one ironclad rule: He only breaks up couples where the woman is unhappy. His latest job will put that rule to the test. The target is Juliette, a beautiful heiress who is set to marry the man of her dreams. With ten days until the wedding, Alex has been hired by her father to carry out his most daring seduction yet that risks him being caught by his ruthless personal creditors, angry exes, and the beautiful and independent Juliette herself. But worst of all, will he discover to his own cost that when it comes to love, the perfect plan doesn't exist? This fall no one will be able to resist HEARTBREAKER. -- (C) IFC|6.7/10|78|54|24|5.4/10|15|7|8|3.5/5|15,549
770874813|The Last Exorcism|Daniel Stamm|Horror, Mystery & Suspense|Aug 27, 2010|Jan 4, 2011|$40,990,055|PG-13 (for disturbing violent content and terror, some sexual references and thematic material)|87|Lionsgate|Andrew Gurland, Huck Botko|Disillusioned charlatan Reverend Cotton Marcus (Patrick Fabian) comes face to face with pure evil after recruiting a documentary film crew to capture the final exorcism of his career. For years, Reverend Marcus has taken advantage of the faithful and desperate. Now it's time for him to finally come clean. Just as Reverend Marcus prepares to shoot the film that will set the record straight, he receives an urgent letter from a desperate farmer. The devil has taken possession of his beloved daughter Nell (Ashley Bell), and Reverend Marcus is their last hope for salvation. Up to this point it's been all fun and games; now things are about to get serious. ~ Jason Buchanan, Rovi|6.2/10|157|112|45|6.3/10|31|23|8|2.7/5|73,358
771193058|Bitter Feast|Joe Maggio|Comedy, Horror|Jun 18, 2010|Jan 4, 2011||NR|103|Glass Eye Pix/Dark Sky|Joe Maggio|"An angry foodie develops a taste for violence in this darkly witty thriller from writer and director Joe Maggio. Peter Grey (James Le Gros) is a chef who thinks he has what it takes to become a multi-media celebrity -- he runs a popular restaurant, he's the host of a cable television series called ""The Feast,"" and he's in talks to design and endorse a line of high-end cookware. But while he knows food, Peter is also pompous, self-righteous and convinced he's smarter than everyone around him; Peter wants ""The Feast"" to carry a responsible environmental message, but his producer at the network (Mario Batali) just wants something that will attract viewers and advertisers, and pairs Peter with a pretty but thick-headed co-host, Peg (Megan Hilty). Peter is near the end of his rope when a well-known cuisine blogger, T.J. Franks (Joshua Leonard), gives his restaurant a scathing review, and soon ""The Feast"" is cancelled, the cookware company passes on its contract with Peter, and his restaurant closes due to bad business. Peter is certain Franks is to blame for this sudden flood of bad luck, and he kidnaps the blogger, determined to get some revenge, served bloody. Bitter Feast was an official selection at the 2010 Los Angeles Film Festival. ~ Mark Deming, Rovi"|5.2/10|7|4|3|||||2.7/5|254
771196289|The Freebie|Katie Aselton|Comedy, Drama|Sep 17, 2010|Jan 11, 2011|$4,500|R (for language and sexual content.)|80|Phase 4|Katie Aselton|A couple hatches a highly dubious scheme to put the spark back in their marriage in this independent comedy drama. Annie (Katie Aselton) and Darren (Dax Shepard) have been married for seven years, and they love each other as much as the day they were wed; they're affectionate, have fun together, and enjoy games such as crossword puzzle races. They would seem to have a perfect relationship, except for one thing -- they haven't had sex in ages, and seem to have lost all interest in making love with one another, no matter how they try to put each other in the mood. Hoping to put some adventure back into their lives, Annie and Darren come up with an unusual idea -- they each get one night in which they're free to find someone and have sex with them, scot-free. But is this going to help their relationship, or is it just going to turn a small problem into a big problem? The Freebie was the first directorial assignment for actress Katie Aselton, who also plays Annie (and is married to another actor and filmmaker, Mark Duplass); the film was an official selection at the 2010 Sundance Film Festival.|5.6/10|28|16|12|6/10|10|5|5|2.6/5|1,670
771197786|Death Race 2|Roel Reiné|Action & Adventure||Jan 18, 2011||R|99|Universal Studios Home Entertainment||Luke Goss, Ving Rhames, Sean Bean, and Danny Trejo headline director Roel Reiné's thrill-ride sequel to Paul W.S. Anderson's hyper-violent remake exploring the origins of the most notorious Death Race competitor ever to take the wheel. Featuring a screenplay by Tony Giglio (Chaos), Death Race 2 follows convicted cop-killer Carl Lucas (Goss) as he vies for freedom by competing in the most deadly reality show ever conceived. The U.S. economy has completely collapsed, and as lawlessness spreads, private prisons crop up all across the country. Corruption reigns in these for-profit penitentiaries, and Terminal Island is home to some of the most violent offenders in the world. Lucas has just been handed a life sentence for killing a cop. Just when it looks like he'll be spending the rest of his days behind bars, unscrupulous television producer September Jones shows up seeking contestants for a brutal new game show where prisoners battle it out in high-performance death machines equipped with lethal weapons. The reward for surviving this psychotic demolition derby: freedom. Before long Lucas is fastening his seat belt, and preparing for the ride of his life. By the time this race is over, an apocalyptic legend will be born. ~ Jason Buchanan, Rovi|3.9/10|6|1|5|||||3/5|3,947
771201796|Legendary|Mel Damski|Action & Adventure, Drama, Kids & Family|Sep 10, 2010|Dec 28, 2010|$191,875|PG-13 (for suggestive material, brief partial nudity and some fighting scenes)|107|Samuel Goldwyn Films|John Posey|In the small town of Sallisaw, Okla., the Chetley name is synonymous with victory. This inspirational tale of a young man's dream to reunite his family through amateur wrestling is as triumphant as it is profoundly touching. Mike Chetley is a former high school and collegiate champion, estranged from his family. Things change when his awkward, undersized, younger brother Cal comes back into his life with a plan to unify Mike and their widowed mother Sharon, but not without major setbacks. With the guidance of Red, Cal learns that winning against all odds is worth more then he could have ever imagined.|4.8/10|43|8|35|4.5/10|20|2|18|3.6/5|3,548
771202361|The American|Anton Corbijn|Drama, Mystery & Suspense|Sep 1, 2010|Dec 28, 2010|$35,596,227|R (for violence, sexual content and nudity)|105|Focus Features|Rowan Joffe|Story: Academy Award winner George Clooney stars in the title role of this suspense thriller. As an assassin, Jack is constantly on the move and always alone. After a job in Sweden ends more harshly than expected for this American abroad, Jack retreats to the Italian countryside. He relishes being away from death for a spell as he holes up in a small medieval town. While there, Jack takes an assignment to construct a weapon for a mysterious contact, Mathilde (Thekla Reuten). Savoring the peaceful quietude he finds in the mountains of Abruzzo, Jack accepts the friendship of local priest Father Benedetto (Paolo Bonacelli) and pursues a torrid liaison with a beautiful woman, Clara (Violante Placido). Jack and Clara's time together evolves into a romance, one seemingly free of danger. But by stepping out of the shadows, Jack may be tempting fate.-- (C) Focus|6.5/10|219|142|77|6.6/10|47|32|15|2.8/5|66,133
771203827|Hugh Hefner: Playboy, Activist and Rebel|Brigitte Berman|Documentary, Special Interest|Jul 30, 2010|Jan 1, 2011|$21,878|R (for graphic nudity and sexual content)|135|Phase 4 Films|Brigitte Berman|An intimate look at the outspoken, flamboyant founder of the Playboy empire. With humor and insight, the film captures Hefner's fierce battles with the government, the religious right and militant feminists. Rare footage and compelling interviews with a remarkable who's who of 20th Century American pop culture, present a brilliant and entertaining snapshot of the life of an extraordinary man and the controversies that surrounded him. -- (C) Phase 4|6.5/10|44|27|17|5.9/10|21|12|9|3.6/5|394
771203903|Aftershocks (Tangshan dadizhen)|Feng Xiaogang|Art House & International, Drama|Oct 29, 2010|Dec 27, 2010||NR|128|China Film Group|Wu Si|Two natural disasters frame a story of a mother, her children and a painful decision that scars them forever in this grand-scale drama from China. In 1976, Li Yuanni (Xu Fan) is living in the city of Tangshan with her two children, seven year old twins Fang Da and Fang Deng. The family's life is simple but full of joy until a massive earthquake levels the city and leaves a swath of destruction in its wake. Amidst the wreckage, Li Yuanni discovers both Fang Da and Fang Deng are caught under a concrete slab, and if enough is broken to rescue one of the children, it would tip the balance and crush the other. Li Yuanni is asked which child should be saved, and she impulsively answers her son Fang Da. The boy is rescued, but the effort costs him his arm; meanwhile, the daughter Fang Deng is left for dead but miraculously survives, and is eventually adopted by another family without Li Yuanni's knowledge. The mother is forced to live with the shame of her decision, Fang Da grows to be a physically and emotionally broken man, and Fang Deng studies medicine, starts a family on her own and leaves China for Canada. It's not until 2008 that the story of the mother and the daughter she lost comes full circle in the wake of another earthquake in Sichuan. A massive commercial success in China, Tang Shan Da Di Zhen (aka Aftershock) made its North American debut at the 2010 Toronto International Film Festival.|6.3/10|11|10|1|||||4/5|4,780
771204095|Make Out With Violence||Drama||Jan 18, 2011||NR|105|Factory 25 (dvd)|Eric Lehning, Cody DeVos|"""MAKE-OUT with VIOLENCE,"" the first feature-length film from the Deagol Brothers, is a genre-bending tale of a boy trying to fulfill his unrequited love for a girl who has risen from the dead. Set against the backdrop of a summer of cicadas and melty milkshakes, the film blends elements of up-beat teenager melodrama with the strange gravity of classic coming of age stories. It tells the story of twin brothers Patrick and Carol Darling, newly graduated from high school and struggling to come to terms with the mysterious disappearance of their friend, the bright and beautiful Wendy Hearst. When a drive through the countryside surrounding their posh suburban community leads to the discovery of Wendy's mysteriously animated corpse, the boys secretly transport the zombie Wendy to an empty house in hopes of somehow bringing her back to life. As the sweltering summer pushes on, they must maintain the appearance of normalcy for their friends and family as they search for ways to revive the Wendy they once knew, or, failing that, to satisfy their own quests for love amonst the living and the dead. At once dark and warm, humorous and tragic, ""MAKE-OUT with VIOLENCE"" offers a fresh perspective on the supernatural and a sincere and heartfelt look at the sorrow of loss and the pain of growing up. --© Official Site"|5.3/10|13|8|5|||||3/5|180
771204351|The Virginity Hit|Huck Botko, Andrew Gurland|Comedy|Sep 10, 2010|Jan 18, 2011|$535,249|R (for strong crude and sexual content, nudity, pervasive language, drug and alcohol use)|86|Sony Pictures/Columbia|Andrew Gurland, Huck Botko|"""The Virginity Hit"" is down and dirty filmmaking at its finest in just about every way one can imagine. It's four guys, one camera, and their hilarious experience chronicling the exhilarating and terrifying rite of passage: losing your virginity. As these guys help their buddy get laid, they'll have to survive friends with benefits, internet hookups, even porn stars during an adventure that proves why you will always remember your first."|4.2/10|49|14|35|4.8/10|17|6|11|2.6/5|13,748
771206408|And Soon the Darkness|Marcos Efron|Horror, Mystery & Suspense|Dec 17, 2010|Dec 28, 2010||R (for some violence and brief torture)|91|Anchor Bay Films|Terry Nation, Jennifer Derwingson, Marcos Efron, Brian Clemens|Stephanie (Amber Heard) and Ellie's (Odette Yustman) vacation to an exotic village in Argentina is a perfect 'girl's getaway' to bask in the sun, shop and flirt with the handsome locals. After a long night of bar-hopping, the girls get into an argument, and Stephanie heads out alone in the morning to cool off. But when she returns, Ellie has disappeared. Finding signs of a struggle, Stephanie fears the worst, and turns to the police for help. But the local authorities have their hands full already - with a string of unsolved kidnappings targeting young female tourists. Skeptical of the sheriff's competency, she enlists help from Michael (Karl Urban), an American ex-pat staying at their hotel. Together they go on a frantic search for Ellie, but Stephanie soon realizes that trusting his seemingly good intentions may drag her farther from the truth. With danger mounting, and time running out, Stephanie must find her friend before darkness falls.-- (C) Anchor Bay|4.8/10|6|1|5|||||2.4/5|3,056
771208287|Bonded By Blood|Sacha Bennett|Drama||Jan 18, 2011||NR|96|Gateway Films|Sacha Bennett, Graeme Muir|This biographical thriller charts the notorious rise of southern England's most famous gangsters-- Tony Tucker, Patrick Tate, and Craig Rolfe. The trio of drug suppliers and career criminals were found in 1995, blasted to death by a shot gun in a Range Rover in Essex. A stronghold of fear and violence that allowed them to maintain a large, drug fuelled empire perhaps led to their untimely deaths.|4/10|11|1|10|||||2.7/5|362
771217962|Guzaarish|Sanjay Leela Bhansali|Drama, Romance|Nov 19, 2010|Jan 18, 2011|$1,017,335|NR|135|UTV Communications|Bhavani Iyer, Sanjay Leela Bhansali, Vibhu Puri|Ethan Mascarenhas, one of the greatest magicians of his time, has been immobilized with a spinal injury for the last 14 years of his life. He still manages to spread magic and hope through his irrepressible wit and humor to every listener on his radio show. Ethan is aided through every moment of his life by his nurse, Sofia D'Souza. Theirs is a love beautiful in its implicit silence, unwavering in its quiet strength and spirited in their constant verbal sparring. On the 14th anniversary of his accident, Ethan makes a petition to the court that shocks the world and leaves Sofia in an impasse. Ethan fights to demand the most basic right that every human being is entitled to -- the right to his own life.|7/10|7|5|2|||||3.7/5|1,796
770673627|The Human Comedy|Clarence Brown|Classics, Comedy, Drama, Kids & Family|Mar 2, 1943|Dec 22, 2010||NR|117|Warner Home Video|Howard Estabrook|In this filmization of William Saroyan's novel, narrator Ray Collins is dead before the film begins, thus he is able to provide an all-seeing overview of the tiny community of Ithaca, California. The principal character, is Collins' son, who keeps in close contact with virtually every family in town.|5.8/10|5|4|1|||||3.6/5|351
