770816171|The Other Guys|Adam McKay|Action & Adventure, Comedy|Aug 6, 2010|Dec 14, 2010|$119,219,978|PG-13 (for crude and sexual content, language, violence and some drug material)|107|Columbia Pictures|Adam McKay, Chris Henchy|A desk-jockey detective and his tough-talking partner get their moment to shine in this buddy police comedy starring Will Ferrell and Mark Wahlberg, and directed by Adam McKay (Anchorman: The Legend of Ron Burgundy, Talladega Nights: The Ballad of Ricky Bobby). New York City detective Allen Gamble (Ferrell) is more comfortable pushing pencils than busting bad guys. A meticulous forensic accountant, his numbers are never off. Detective Terry Hoitz (Wahlberg) is Gamble's reluctant partner. Try as Detective Hoitz might to get back on the streets, an embarrassing encounter with Derek Jeter has left a sizable black mark on his permanent record. Detectives Danson (Dwayne Johnson) and Highsmith (Samuel L. Jackson) are the complete opposites of Gamble and Hoitz: unwaveringly confident, they always get their man, and they do it with style to spare. When the time comes for Gamble and Hoitz to prove their mettle and save the day, their incompetence becomes the stuff of legend. ~ Jason Buchanan, Rovi|6.7/10|202|158|44|6.9/10|40|31|9|3.4/5|160,330
770816539|The Trotsky|Jacob Tierney|Art House & International, Comedy|May 5, 2010|Dec 14, 2010|$439,880|NR|113|Park Ex|Jacob Tierney|An unusually intense teenager gets the idea that his name defines his destiny in this offbeat comedy. Leon Bronstein (Jay Baruchel) is a young man who has made the discovery that his birth name is the same as that of Leon Trotsky, the celebrated Russian revolutionary and socialist theorist. This coincidence leads Leon to believe that he is the reincarnation of Trotsky and it is his destiny to follow his path as closely as possible -- which is a bit difficult when you have rich parents and attend an upscale private school in Montreal. Leon's father (Saul Rubinek) gives his son a part-time job in one of his clothing factories, and within a day Leon is leading his fellow workers in a sit-down strike. Father isn't amused and punishes Leon by making him attend public school, but there the world-be revolutionary finds new ways to battle fascism -- which in this case is represented by Principal Berkhoff (Colm Feore) and Mrs. Davis (Domini Blythe), a teacher eager to give her students detention. Leon's pursuit of social justice causes him to fall in with Frank (Michael Murphy), a burned-out activist-turned-college professor, but Leon also finds himself infatuated with Frank's current girlfriend -- who, like Trotsky's great love, is named Alexandra (Emily Hampshire) and is nine years older than he. Directed by Jacob Tierney, The Trotsky was an official selection at the 2009 Toronto International Film Festival.|6.9/10|14|11|3|||||3.6/5|1,952
770856614|GasLand|Josh Fox|Documentary|Sep 15, 2010|Dec 14, 2010|$30,846|NR|107|Independent Pictures|Josh Fox|"Can you imagine being able to light your tap water on fire? This is just one of the many shocking results due to the natural gas drilling boom which has swept the United States. The Halliburton-developed drilling technology called hydraulic fracturing or ""fracking"" has unlocked a ""Saudi Arabia of natural gas"" just beneath us. But is fracking safe? Part verite travelogue, part expose, part mystery, part bluegrass banjo meltdown, part showdown. Josh Fox encounters EPA whistleblowers, congressmen, world recognized scientists, and some of the most incredibly inspiring and heart-wrenching stories of ordinary Americans fighting against fossil fuel giants for environmental justice."|7/10|39|38|1|7/10|7|7|0|3.9/5|8,462
770856621|Peepli Live|Mahmood Farooqui, Anusha Rizvi|Art House & International, Comedy, Drama|Aug 13, 2010|Dec 21, 2010|$748,128|NR|106|UTV Communications|Anusha Rizvi|"Natha, a poor farmer from Peepli village, is about to lose his plot of land due to an unpaid government loan. A quick fix to the problem is the very same government's program that aids the families of indebted farmers who have committed suicide. As a means of survival Farmer Natha can choose to die!. His brother is happy to push him towards this unique ""honor"" but Natha is reluctant. Local elections are around the corner and what might've been another unnoticed event turns into a ""cause celebré"" with everyone wanting a piece of the action. Political bigwigs, high-ranking bureaucrats, local henchmen and the ever-zealous media descend upon sleepy Peepli to stake their claim. The question on everyone's lips -- ""Will he or Won't he?"""|6.3/10|26|22|4|6.7/10|9|9|0|3.6/5|2,787
770856624|Cyrus|Jay Duplass, Mark Duplass|Comedy|Jun 18, 2010|Dec 14, 2010|$7,455,447|R (for language and some sexual material)|91|Fox Searchlight|Jay Duplass, Mark Duplass|Directed by mumblecore stalwarts Jay and Mark Duplass, Cyrus stars John C. Reilly as John, a middle-aged lonely divorced guy who, as the film opens, gets dragged to a party by his remarried ex-wife (Catherine Keener) -- who remains his best friend. After a few clumsy, drunken passes at a variety of women, John encounters Molly (Marisa Tomei), an attractive single-mom who finds John's social awkwardness appealing. They hit it off, and quickly begin a tender new relationship. Problems soon arise in the form of Cyrus (Jonah Hill), Molly's twentysomething son, who has an off-puttingly close relationship to his mom. Soon the jealous Cyrus sets about trying to break them up, and John must figure out how to deal with this unhinged and unexpected rival.|6.9/10|154|123|31|6.8/10|42|31|11|3.1/5|44,579
770859300|Joan Rivers: A Piece Of Work|Ricki Stern, Anne Sundberg|Comedy, Documentary, Television|Jun 11, 2010|Dec 14, 2010|$2,927,972|R (for language and sexual humor)|84|IFC Films|Ricki Stern|A glimpse into the comedic process and private dramas of legendary comedian and pop icon Joan Rivers as she fights tooth and nail to keep her American dream alive.|7.6/10|105|96|9|7.9/10|37|33|4|3.8/5|12,421
770860526|Exit Through The Gift Shop|Banksy|Comedy, Documentary, Musical & Performing Arts, Special Interest|Apr 16, 2010|Dec 14, 2010|$3,288,699|R (for some language)|86|Abarorama||"Banksy is a graffiti artist with a global reputation. Fiercely guarding his anonymity to avoid prosecution, Banksy has so far resisted all attempts to be captured on film. ""Exit Through the Gift Shop"" tells the incredible true story of how an eccentric French shop keeper turned documentary maker attempted to locate and befriend Banksy, only to have the artist turn the camera back on its owner with spectacular results. The film contains exclusive footage of Banksy, Shepard Fairey, Invader and many of the worlds most infamous graffiti artists at work, on walls and in interviews. As Banksy describes it, ""It's basically the story of how one man set out to film the un-filmable. And failed!"""|8.1/10|110|105|5|8.2/10|32|31|1|4.2/5|24,673
770866920|Legend of the Guardians: The Owls of Ga'Hoole|Zack Snyder|Action & Adventure, Animation, Science Fiction & Fantasy|Sep 24, 2010|Dec 17, 2010|$54,400,000|PG|90|Warner Bros. Pictures|John Orloff, John Collee, Emil Stern|"Acclaimed filmmaker Zack Snyder makes his animation debut with the fantasy family adventure ""Legend of the Guardians: The Owls of Ga'Hoole"" based on the beloved Guardians of Ga'Hoole books by Kathryn Lasky. The film follows Soren, a young owl enthralled by his father's epic stories of the Guardians of Ga' Hoole, a mythic band of winged warriors who had fought a great battle to save all of owlkind from the evil Pure Ones. While Soren dreams of someday joining his heroes, his older brother, Kludd, scoffs at the notion, and yearns to hunt, fly and steal his father's favor from his younger sibling. But Kludd's jealousy has terrible consequences--causing both owlets to fall from their treetop home and right into the talons of the Pure Ones. Now it is up to Soren to make a daring escape with the help of other brave young owls. Together they soar across the sea and through the mist to find the Great Tree, home of the legendary Guardians--Soren's only hope of defeating the Pure Ones and saving the owl kingdoms. -- (C) Warner Bros"|5.7/10|128|65|63|5.7/10|22|10|12|3.5/5|70,687
771041878|Nanny McPhee Returns|Susanna White|Comedy, Kids & Family, Science Fiction & Fantasy|Aug 20, 2010|Dec 14, 2010|$28,995,450|PG (for rude humor, some language and mild thematic elements)|109|Universal Studios|Emma Thompson|A struggling mother receives some much-needed assistance tending to the family farm and raising a group of spirited children while her military husband is fighting overseas in this sequel to the whimsical 2005 fantasy comedy Nanny McPhee. Mrs. Isabel Green (Maggie Gyllenhaal) lives in a scenic valley with her two sons and one daughter. They each understand the importance of working together as a family, and things are going remarkably smoothly for the rural quartet until a pair of spoiled cousins arrives for an extended stay, effectively turning the quaint little farm into a virtual zoo. As the situation quickly gets out of hand, Nanny McPhee (Emma Thompson) suddenly appears on Isabel's doorstep claiming that she can bring a much-needed sense of order to the out-of-control household. In time the mysterious helper does just that, using powerful magic to teach her young charges the importance of getting along, and gradually winning their trust in the process. But when the piglets escape from their sty, the contentious kids must work together to recover the family farm's most valued assets, or risk losing everything their father worked so hard to build before he went off to fight in the war. Rhys Ifans and Maggie Smith co-star. ~ Jason Buchanan, Rovi|6.6/10|119|90|29|6.3/10|33|24|9|3.3/5|51,305
771203480|Devil|John Erick Dowdle|Horror, Mystery & Suspense|Sep 17, 2010|Dec 21, 2010|$33,583,175|PG-13 (for violence and disturbing images, thematic material and some language including sexual references)|80|Universal Pictures|M. Night Shyamalan, Brian Nelson|"Five strangers trapped in an elevator realize that one of them is the Devil in this thriller from director John E. Dowdle (Quarantine) and screenwriter Brian Nelson (Hard Candy, 30 Days of Night). The first installment of ""The Night Chronicles,"" a film series in which up-and-coming filmmakers bring to life stories conceived by M. Night Shyamalan, Devil opens to find five Philadelphia office workers filing into the elevator of an inner-city office building. But a typical day at the office takes a sudden detour into terror when the elevator becomes stuck between floors, and the passengers discover that the Devil does exist, and he's standing right before them. As emergency workers work frantically to free them, secrets are revealed and the passengers realize their only hope for survival is to confront their darkest sins in front of the others. ~ Jason Buchanan, Rovi"|5.1/10|95|49|46|4.2/10|14|4|10|3.1/5|66,972
771207058|Legacy: Black Ops|Thomas Ikimi|Drama, Mystery & Suspense||Dec 27, 2010||R (for strong brutal violence including some torture and pervasive language)|95|Code Black Entertainment|Thomas Ikimi|A haunted black-ops soldier struggles with paranoia and anxiety while hiding out in a seedy Brooklyn tenement building, and plotting to expose his brother - a rising New York Senator with White House ambitions. Malcolm Gray (Idris Elba) was on a mission to assassinate a powerful Eastern European chemical weapons dealer when he was captured, and brutally tortured. Years later Malcolm has returned home, but the psychological wounds from his harrowing ordeal still run deep. Now, shut away from the world with nothing but his suffocating memories to keep him company, Malcolm begins to suspect that his politician brother has succumbed to corruption, and vows to prevent him from reaching the White House by whatever means possible. ~ Jason Buchanan, Rovi|6.6/10|6|5|1|||||3/5|290
450826799|Greaser's Palace|Robert Downey Sr., Robert Downey Sr.|Classics, Comedy, Drama, Western|Jan 1, 1972|Nov 22, 2010||NR|91|Greaser's Palace|Robert Downey Sr.|Set in a mystical frontier town where Seaweedhead Greaser runs his eponymous saloon, this freewheeling social satire features, among other things, a vaudeville Jesus, a topless Indian scout and a homosexual cowboy.|4/10|6|3|3|||||3.5/5|596
770679843|Disney's A Christmas Carol|Robert Zemeckis|Animation, Drama, Kids & Family, Science Fiction & Fantasy|Nov 6, 2009|Nov 16, 2010|$137,816,456|PG (for scary sequences and images)|96|Walt Disney Studios|Robert Zemeckis|Ebenezer Scrooge begins the Christmas holiday with his usual miserly contempt, barking at his faithful clerk and his cheery nephew. But, when the ghosts of Christmas Past, Present and Yet to Come take him on an eye-opening journey revealing truths Old Scrooge is reluctant to face, he must open his heart to undo years of ill will before it's too late.|5.9/10|194|104|90|5.9/10|39|21|18|3.2/5|776,182
770683156|Flipped|Rob Reiner|Comedy, Drama, Romance|Aug 6, 2010|Nov 23, 2010|$1,752,214|PG (for language and some thematic material)|89|Warner Bros. Pictures|Rob Reiner, Andrew Scheinman|"When second-graders Bryce and Juli first meet, Juli knows it's love. Bryce isn't so sure. Beginning that day, and for the next six years, young Bryce (Callan McAuliffe) does everything he can to keep his outspoken wannabe girlfriend at arm's length...which isn't easy since they go to the same school and live across the street from each other. Smart, dreamy, independent and willing to stand up for what she believes in, Juli (Madeline Carroll) is different from anyone else he knows and, frankly, it's a little overwhelming. What's a guy supposed to do when a girl tells him his hair smells like watermelon or wants him to sit in a tree for the spectacular view? There's just no telling what Juli will do next, and Bryce is one guy who'd rather be safe than sorry. Though disappointed by Bryce's unwillingness to see things her way, or even to see the things in life she finds most meaningful, Juli continues to give her potential dreamboat the benefit of the doubt. Until those doubts stack up so high that she finally thinks maybe she was wrong about him. It's just about the same time Bryce starts to think maybe he was wrong about her, too. But is he too late? The coming-of-age romantic comedy ""Flipped,"" from director Rob Reiner, takes Bryce and Juli from Grade School to Junior High, through triumph and disaster, family drama and first love, as they make the discoveries that will define who they are--and who they are to each other. -- (C) Warner Bros."|6/10|75|41|34|5.8/10|23|12|11|3.8/5|20,062
770796548|The Sorcerer's Apprentice|Jon Turtletaub, Jon Turteltaub|Action & Adventure, Comedy, Drama, Kids & Family, Science Fiction & Fantasy|Jul 14, 2010|Nov 30, 2010|$63,143,812|PG (for fantasy action violence, some mild rude humor and brief language)|111|Walt Disney Studios|Lawrence Konner, Mark Rosenthal, Doug Miro, Matt Lopez, Carlo Bernard|Inspired by the beloved segment of the Walt Disney classic Fantasia, The Sorcerer's Apprentice moves the setting of the story to modern-day Manhattan, where decidedly average teen Dave Stutler (Jay Baruchel) hones his magical powers under the tutelage of master sorcerer Balthazar Blake (Nicolas Cage). Malevolent wizard Maxim Horvath (Alfred Molina) is determined to claim New York City as his own. And Horvath isn't alone in his diabolical endeavor, because by joining forces with the sinister sorcerer, pop illusionist Drake Stone (Toby Kebbell) aspires to gain powers beyond his wildest imagination. Realizing that he can't take on Horvath and Stone alone, Blake recruits Stutler as his reluctant assistant and begins training him the battle that will determine the fate of the Big Apple. Teresa Palmer and Monica Bellucci co-star. ~ Jason Buchanan, Rovi|5.2/10|169|69|100|5.1/10|36|12|24|3.3/5|142,519
770802233|The Winning Season|James C. Strouse|Comedy|Sep 3, 2010|Nov 23, 2010||PG-13 (for some thematic elements, language including some sexual references, alcohol abuse and smoking)|104|Roadside Attractions|James C. Strouse|Set in suburban Indiana, the film stars Rockwell as Bill Greaves, an adult misfit recruited by the local high school principal (Corddry) to coach the school's floundering girls' basketball team. Initially retreating from what appears to be a hopeless situation, Bill perseveres and manages to help the team and its captain (Roberts) ratchet up its competitive spirit, while the girls offer Bill a renewed life focus. THE WINNING SEASON also stars Shareeka Epps, Emily Rios and Margo Martindale.-- (C) Lionsgate|5.1/10|22|11|11|5.6/10|6|3|3|3.3/5|1,938
770802244|The Expendables|Sylvester Stallone|Action & Adventure, Mystery & Suspense|Aug 13, 2010|Nov 23, 2010|$102,981,571|R (for strong action and bloody violence throughout, and for some language)|103|Lionsgate Films|Dave Callaham, Sylvester Stallone|An all-star cast of action-movie icons headline Sylvester Stallone's explosive action thriller about a group of hard-nosed mercenaries who are double-crossed during a treacherous mission. Approached by the shadowy Church (Bruce Willis) to overthrow tyrannical South American dictator General Gaza (David Zayas) and restore order to the troubled island country of Vilena, stoic soldier of fortune Barney Ross (Stallone) rounds up an unstoppable team that includes former SAS soldier and blade specialist Lee Christmas (Jason Statham); martial arts expert Yin (Jet Li); trigger-happy Hale Caesar (Terry Crews); and cerebral demolitions expert Toll Road (Randy Couture). Traveling to Vilena on a reconnaissance mission with his old pal Christmas, Barney meets their local contact, a cagey guerrilla fighter named Sandra (Giselle Itie), and together the trio scopes out the landscape.. It isn't long before Barney and Christmas have discovered that their actual target is not General Gaza but James Monroe (Eric Roberts), a former CIA operative who has recently gone rogue. Monroe won't be easy to get to either, because his hulking bodyguard Paine (Steve Austin) is a force to be reckoned with. When their mission is compromised, Barney and Christmas are forced to flee, leaving Sandra behind to face almost certain death. But Barney isn't the kind of soldier to abandon a mission, or a hostage, and now in order to get the job done he'll need the help of his old crew. ~ Jason Buchanan, Rovi|5.3/10|203|86|117|5/10|39|14|25|3.6/5|297,280
770802477|Metropia|Tarik Saleh|Animation, Art House & International, Science Fiction & Fantasy|May 12, 2010|Nov 16, 2010||NR|86|Film i Väst|Tarik Saleh, Fredrik Edin, Stig Larsson|"A man who hears voices in his head discovers he's not crazy, but something far worse is going on in this animated sci-fi drama from director Tarik Saleh. It's the year 2024, and the global oil supply ha finally bottomed out; poverty is widespread, and with automobiles no longer practical, a system of underground trains links most of the cities of Europe. Roger Olafsson (voice of Vincent Gallo) is a low-level office worker who spends his days toiling away in a telephone center and his night cooped up in a tiny flat. One day, Roger begins hearing a voice in his head; the voice tells Roger that it is his conscience, and that he should take a chance and approach Nina (voice of Juliette Lewis), a beautiful woman he's seen while riding the train. Roger decides to take the voice's advice, but it turns out that he's actually been hearing messages from Stefan (voice of Alexander Skarsgard), a functionary of the all-powerful Trexx Corporation, and he's not trying to start a romance by pairing Roger and Nina, but tie the unsuspecting telephone worker into a plot involving a gang of terrorists. Also featuring the voice talents of Udo Kier and Stellan Skarsgard, Metropia was screened as part of the ""Critics' Week"" program at the 2009 Venice International Film Festival."|5.1/10|6|3|3|||||3.3/5|2,976
770802762|Barking Water|Sterlin Harjo|Drama|Jan 17, 2009|Nov 16, 2010||NR|85|New Video Group|Sterlin Harjo|A couple who've been apart for years are brought back together by difficult circumstances in this independent drama. Frank (Richard Ray Whitman) is a man of Native-American heritage with a checkered past who was once married to Irene (Casey Camp-Horinek). While Frank's love for Irene never died, she grew tired of his wayward ways and they broke up. After many years apart, Irene gets word that Frank is in the hospital; he's dying of cancer, and desperately wants to make his peace with his daughter and granddaughter before he goes. Since Frank isn't well enough to travel on his own, Irene agrees to help him drive across Oklahoma for the meeting, and as they make their way across the state they're reminded of why they fell for one another (and why their love didn't last). Frank and Irene also meet a variety of interesting characters along the way as they travel through Oklahoma's Native American communities. Barking Water received its world premiere at the 2009 Sundance Film Festival.|6.4/10|5|3|2|||||3.6/5|58
770804941|I Knew It Was You: Rediscovering John Cazale|Richard Shepard|Documentary, Drama, Television|Jan 16, 2009|Nov 30, 2010||NR|40|Oscilloscope Laboratories||John Cazale's resume as a film actor isn't long, but it's distinguished. Cazale appeared in five feature films, and each one received an Academy Award nomination for Best Picture, while three of them -- The Godfather, The Godfather Part II and The Deer Hunter -- won the category. Al Pacino, who made three films with Cazale, considered him one his finest acting partners, and many film buffs cite Cazale as one of the best actors of his generation. But Cazale was thirty-seven years old before making his film debut after distinguishing himself in the New York theater community, and shortly after completing work on The Deer Hunter, cancer claimed his life in the spring of 1978. I Knew It Was You: Rediscovering John Cazale is a short documentary celebrating the life and art of Cazale, featuring clips from his memorable performances and interviews with friends, colleagues and fans, including Meryl Streep (who was also Cazale's wife), Al Pacino, Robert De Niro, Gene Hackman, Francis Ford Coppola, Sidney Lumet, Steve Buscemi, Philip Seymour Hoffman and many others. I Knew It Was You was an official selection at the 2009 Sundance Film Festival.|6.8/10|5|4|1|||||4/5|790
770805223|Cats & Dogs: The Revenge of Kitty Galore|Brad Peyton|Action & Adventure, Comedy, Kids & Family|Jul 30, 2010|Nov 16, 2010|$43,400,000|PG (for animal action and humor)|82|Warner Bros. Pictures|Ron J. Friedman, Steve Bencich|The epic struggle for control of planet Earth continues in this sequel to the 2001 comedy that confirmed everyone's worst suspicions about our furry four-legged companions. A former top spy for the clandestine feline espionage bureau MEOWS, Kitty Galore is determined to rule the world and finally gain the upper paw over her canine rivals. But when an unforeseen threat appears, cats and dogs must band together to defeat a common foe. Chris O'Donnell and 30 Rock's Jack McBrayer head up the cast of the production, with scripting duties being handled by Brother Bear's Ron J. Friedman and Steve Bencich. ~ Jason Buchanan, Rovi|3.6/10|98|13|85|4/10|26|7|19|2.9/5|70,153
770805388|The Twilight Saga: Eclipse|David Slade|Drama, Science Fiction & Fantasy, Romance|Jun 30, 2010|Dec 4, 2010|$300,523,113|PG-13 (for intense sequences of action and violence, and some sensuality)|124|Summit Entertainment|Melissa Rosenberg|The third film in the Twilight series explores a love triangle between Bella (Kristen Stewart), Edward (Robert Pattinson), and Jacob (Taylor Lautner) as the werewolf pack and the Cullen clan join together to fight a new breed of vampires. Melissa Rosenberg provides the screenplay for the Summit Entertainment adaptation of Stephenie Meyer's best-selling novel, with director David Slade calling the shots behind the camera. Bryce Dallas Howard joins the cast as Victoria, the role originally played by Rachelle Lefevre in the first film. ~ Jeremy Wheeler, Rovi|5.4/10|241|116|125|6.2/10|47|28|19|3.6/5|334,002
770807514|Living in Emergency: Stories of Doctors Without Borders|Mark Hopkins|Documentary, Special Interest|Jun 4, 2010|Dec 1, 2010||NR|93|Truly Indie/BEV Pictures||Bosnia. Rwanda. Kosovo. Sierra Leone. Pakistan. Just a few of the world's humanitarian and political crises in the past years. Whether the result of war or nature, these disasters devastate populations and cripple health systems. Despite the immense dangers and difficulties of the work, one organization, Doctors Without Borders, has continuously intervened at these frontlines of overwhelming human need. Set in war-torn Congo and post-conflict Liberia, Living in Emergency interweaves the stories of four volunteers with Doctors Without Borders as they struggle to provide emergency medical care under the most extreme conditions. Two volunteers are new recruits: a 26 year-old Australian doctor stranded in a remote bush clinic and an American surgeon struggling to cope under the load of emergency cases in a shattered capital city. Two others are experienced field hands: a dynamic Head of Mission, valiantly trying to keep morale high and tensions under control, and an exhausted veteran, who has seen too much horror and wants out. Amidst the chaos, each volunteer must confront the severe challenges of the work, the tough choices, and the limits of their own idealism.|7.2/10|27|25|2|7.1/10|16|14|2|3.8/5|283
