496273653|Ryan's Daughter|David Lean|Drama, Romance|Nov 9, 1970|Feb 28, 2006||R|174|MGM Home Entertainment|Robert Bolt|This romantic war drama takes place in the political turmoil of Ireland in 1916. While the British battle European aggressors in World War I, The Irish Republican Army makes a secret deal with the Germans for a cache of weapons to battle British rule. Charles (Robert Mitchum) who meets rosy (Sarah Miles) on a return trip to Dublin. They fall sin love and marry, but Rosy has an illicit affair with British officer Randolph Doryan (Christopher Jones). Tim O'Leary (Barry Foster) is the IRA gun runner waiting for a shipment of German rifles to arrive by sea on the West coast of Ireland. When evidence of the affair (a military button) is paraded in the streets to discredit the unfaithful Rosy, Charles ignores the indignant neighbors. He does tell British authorities of the impending gun shipment in an effort to halt reprisals from the occupied forces. IRA loyalists break in to their home, stripping Rosy and shaving her head when they believe she is the one who tipped off the British. Leo McKern plays Rosy's father, and Trevor Howard plays the kindly Catholic priest. John Mills won an Oscar for his portrayal of the village idiot Michael as did cinematographer Freddie Young for his excellent lensing of this wartime romantic triangle.|5.3/10|17|8|9|5/10|6|2|4|3.8/5|2,735
410651124|Solitude|Susan Kraker, Pi Ware|Comedy, Drama|Nov 11, 2002|Feb 28, 2006||R|84|Indican|Pi Ware, Susan Kraker|A woman is caught in the middle of an emotional crossfire between two siblings in this independent drama. Soledad (Ronne Orenna) is an artist who is heading from California to New Mexico to show her work to a gallery owner. Soledad is traveling with the current object of her affections, Hilary (Mary Thornton), but when their car breaks down en route, Hilary suggests they pay a visit to her brother, who could be persuaded to lend them his car. It doesn't take long for Soledad to realize that Hilary and her brother, Louis (Patrick Belton), do not have a cordial relationship, and while she prefers not to get in the middle of their squabbling, by the end of the evening she learns more than she ever wanted to know about their past and the ugly secrets they share. Solitude was the first feature film from the husband-and-wife writing and directing team of Pi Ware and Susan Kraker.|5.7/10|6|4|2||||||178
321958314|Flaming Star|Don Siegel|Action & Adventure, Classics, Drama, Musical & Performing Arts, Western|Jan 1, 1960|Feb 28, 2006||PG|101|Twentieth Century Fox|Clair Huffaker, Nunnally Johnson|Tensely directed by Don Siegel, Flaming Star is the grittiest of Elvis Presley's post-Army films. Elvis plays Pacer Burton, a half-breed youth in the old West, torn between loyalty to the whites, as represented by his father (John McIntyre), and the Indians, represented by his mother (Dolores Del Rio). A series of brutal Kiowa raids, and the subsequent reprisals by the white settlers, sorely test Pacer's fortitude. Though offered moral support from his loved ones, Pacer is forced to work things out himself. The film was based on a novel by Clair Huffaker. ~ Hal Erickson, Rovi|7.3/10|11|10|1|||||3.6/5|5,096
287449364|Viridiana|Luis Buñuel|Art House & International, Comedy, Drama|May 1, 1961|Feb 28, 2006||R|90|Criterion Collection|Luis Buñuel, Julio Alejandro, Juan Buñuel|A woman visits her rich uncle before taking her vows as a nun. When he dies, he leaves his estate to her and his son. She becomes a nun and opens up the estate to house some wretched derelicts. When the wretches nearly rape her, she rethinks her religious calling.|9/10|20|19|1|||||4.2/5|6,789
246239040|Twist of Faith|Kirby Dick|Documentary|Aug 20, 2004|Feb 21, 2006||NR|87|Chain Camera Pictures||A man must reconcile his religion with a need for justice and closure in this documentary. Tony Comes was a firefighter living in Toledo, OH, with his wife and children. While Comes was a solid family man and had the respect of his fellow firemen, he was hiding a secret that had been haunting him for almost 20 years -- when he was 14 years old, Comes was sexually abused by a Catholic priest, an event that left him with emotional scars that were slow to heal. In 2002, as stories of child sexual abuse at the hands of Catholic clergy were appearing in newspapers across the country, Comes decided it was time to take action. Comes met with the bishop in his parish and told him of the incident, but he soon discovered that he was not being told the truth about what was being done to prevent the priest from molesting other children. Seeing little alternative and concerned about the safety of others, Comes filed a lawsuit against the parish. Twist of Faith is a documentary that follows Comes as he deals with his inner turmoil and the often uncharitable reactions of others as he attempts to bring his abuser to justice, while maintaining his sincere faith in God and his loyalty to the Catholic Church. Produced for the premium cable network HBO, Twist of Faith was nominated for Best Documentary Feature honors at the 2005 Academy Awards.|8.2/10|20|20|0|7.9/10|8|8|0|3.5/5|899
120401555|Metropolitan|Whit Stillman|Comedy, Drama|Aug 3, 1990|Feb 14, 2006||PG-13|98|Rialto Pictures|Whit Stillman|An ironically comic look at Manhattan's endangered debutante scene, Metropolitan chronicles the rise and ultimate decline of a group of young Park Avenue socialites who gather nightly to discuss love, honor, and the impending demise of their class.|7.7/10|34|31|3|7.1/10|12|10|2|3.9/5|5,299
51879877|Club Paradise|Harold Ramis|Comedy|Jul 11, 1986|Feb 14, 2006||PG-13 (adult situations/language)|96|Warner Home Video|Harold Ramis, Brian Doyle-Murray, Chris Miller (III), Tom Leopold, Harry Shearer, Janis Hirsch|In this comedy, Jack Moniker (Robin Williams) and Ernest Reed (Jimmy Cliff) become partners in a deal to modernize a run-down Caribbean resort and turn it into a swank attraction for the rich and playful. Jack leaves behind his life as a fireman and Ernest hops to convert his talents as a reggae singer into administrative prowess. Multiple sketches involve a range of quirky and complaining guests at the resort, and exactly how their complaints are handled. In the meantime, the corrupt prime minister of the island (Adolph Caesar) plans to sell the lot to an international corporation.|4/10|27|3|24|5.8/10|8|1|7|2.8/5|6,932
14116|The Unbearable Lightness of Being|Philip Kaufman|Drama, Romance|Feb 5, 1988|Feb 28, 2006||R|171|Orion Home Video|Philip Kaufman, Jean-Claude Carriere|In Philip Kaufman's surprisingly successful film adaptation of Czech author Milan Kundera's demanding 1984 best-seller, Daniel Day-Lewis stars as Tomas, an overly amorous Prague surgeon, while Juliette Binoche plays Tereza, the waiflike beauty whom he marries. Even though he's supposedly committed, Tomas continues his wanton womanizing, notably with his silken mistress Sabina (Lena Olin). Escaping the 1968 Russian invasion of Prague by heading for Geneva, Sabina takes up with another man and unexpectedly develops a friendship with Tereza. Meanwhile, Tomas, who previously was interested only in sex, becomes politicized by the collapse of Czechoslovakia's Dubcek regime. The Unbearable Lightness of Being may be too leisurely for some viewers, but other viewers may feel the same warm sense of inner satisfaction that is felt after finishing a good, long novel.|8/10|24|21|3|7.5/10|5|3|2|3.9/5|19,424
9365|Yours, Mine & Ours|Raja Gosnell|Comedy, Kids & Family, Romance|Nov 23, 2005|Feb 28, 2006|$53,359,917|PG (for mild crude humor)|88|Paramount Pictures|Ron Burch, David Kidd|When Frank Beardsley, a widower with eight children, runs into his high school sweetheart, Helen North, it's as if 30 years never passed! Helen, also a widow with 10 kids of her own that include the six she and her husband adopted, feels the attraction as well. It's no wonder they rush into marriage without telling their kids. True love can conquer all -- right? Unfortunately for Frank and Helen, the families don't mesh quite as easily as the newlyweds had hoped. They probably should have seen the culture clash coming: the disciplined Beardsleys run things by the book; for the energetic and vivacious Norths, there is no book. Helen's kids aren't pleased about moving and sharing rooms with a bunch of uptight strangers. Frank's children have nothing in common with the unruly Norths. Since both sets of kids aren't happy, they devise a plan to undermine the marriage and team up to plot the breakup. East meets west as the two families find a way to work together -- in order to separate! Just when it appears that the kids have succeeded, they realize they like each other despite their differences -- they don't want their families to split up! Can they save Frank and Helen's marriage after they so brilliantly split them up? It's up to Frank and Helen.|3.3/10|107|6|101|3.5/10|34|1|33|3.2/5|398,059
9364|Rent|Chris Columbus|Comedy, Musical & Performing Arts, Romance|Nov 23, 2005|Feb 21, 2006|$29,077,547|PG-13 (for mature thematic material involving drugs and sexuality, and for some strong language)|135|Sony Pictures|Stephen Chbosky|"In New York's East Village, a group of bohemians struggle to express themselves through their art and strive for success and acceptance while enduring the obstacles of poverty, illness and the AIDS epidemic. Roger is an aspiring songwriter who has emotionally shut down after his girlfriend's suicide. Despite his attraction, he is reluctant to start a new romance with his downstairs neighbor Mimi Marquez, an exotic dancer struggling with ""baggage of her own."" Roger's roommate Mark is a filmmaker trying to balance art and commerce. His girlfriend Maureen, a self-indulgent performance artist, recently left him for a lawyer named Joanne. Also part of this close-knit circle is Tom Collins, a professor of philosophy who, after being mugged, is rescued by his soul mate, a high-spirited street drummer, Angel Shunard. Benny, who alienated his friends after he married their landlord's daughter, has reneged on his promise to provide rent-free artist space to his bohemian friends. Once a close friend, he is now viewed as the enemy, threatening them with eviction."|5.9/10|172|79|93|5.6/10|38|15|23|3.5/5|341,074
9361|The Ice Harvest|Harold Ramis|Action & Adventure, Comedy, Mystery & Suspense|Nov 23, 2005|Feb 28, 2006|$8,819,059|R (for violence, language and sexuality/nudity)|88|Focus Features|Robert Benton, Richard Russo|In icebound Wichita, Kan., its Christmas Eve, and this year Charlie Arglist just might have something to celebrate. Charlie, an attorney for the sleazy businesses of Wichita, and his unsavory associate, the steely Vic Cavanaugh have just successfully embezzled $2 million from Kansas City boss Bill Guerrard. But the real prize for Charlie is the stunning Renata, who runs the Sweet Cage strip club. Charlie hopes to slip out of town with Renata. But as daylight fades and an ice storm whirls, everyone from Charlie's drinking buddy Pete Van Heuten to the local police begin to wonder just what exactly is in Charlie's Christmas stocking -- and the 12 hours of Christmas Eve are filled with surprises|5.5/10|132|61|71|5.6/10|34|17|17|2.9/5|60,342
9273|Walk the Line|James Mangold|Drama|Nov 18, 2005|Feb 28, 2006|$119,317,827|PG-13 (for some language, thematic material and depiction of drug dependency)|94|20th Century Fox|James Mangold, Gill Dennis|"""Walk the Line"" follows the early years in the career of American music legend Johnny Cash. The young Cash sets out on life's journey battered by his brother's accidental death and an abusive father, who blames him for the incident. His rise to fame with such hits as ""A Boy Named Sue"" and ""Ring of Fire"" is countered by his struggle with amphetamines, barbiturates and alcohol. His instability, both financial and emotional, leads to the failure of his first marriage. The few comforts of his unhappy youth had come from the radio programs of June Carter, the luminous daughter of country music's first family. When their paths cross, it's her devotion and support that becomes his salvation."|7.2/10|208|172|36|7.1/10|43|33|10|3.9/5|545,362
9185|Pride and Prejudice|Joe Wright|Comedy, Drama, Romance|Nov 11, 2005|Feb 28, 2006|$38,251,759|PG (for some mild thematic elements)|128|Focus Features|Deborah Moggach|Jane Austen's perennially popular story of the game of love among the British upper classes returns to the screen in this polished film adaptation. The Bennets (Brenda Blethyn and Donald Sutherland) are the parents of five daughters near the close of the 18th century. Comfortable within their means but well short of rich, Mr. and Mrs. Bennet are looking for suitable husbands for their girls, and they are encouraged to learn that an eligible young bachelor from a wealthy family, Charles Bingley (Simon Woods), has moved into a nearby estate. Eager to see if a match can be made, the Bennets bring their daughters Elizabeth (Keira Knightley) and Jane (Rosamund Pike) to a ball thrown by their new neighbor to see if sparks will fly. Jane seems to like Charles, and he appears to feel the same, but Elizabeth takes an immediate dislike to Darcy (Matthew MacFadyen), Charles' egocentric best friend. While Elizabeth is infatuated with military man Lt. Wickham (Rupert Friend) and finds herself courted by William Collins (Tom Hollander), a well-meaning but drab man of the cloth, fate causes Elizabeth and Darcy to frequently cross paths, and while they don't care for one another, they can't stop thinking about each other, either. Pride & Prejudice also stars Jena Malone, Judi Dench, and Penelope Wilton. ~ Mark Deming, Rovi|7.7/10|173|148|25|7.5/10|42|36|6|3.9/5|459,100
9176|Pulse (Kairo)|Kiyoshi Kurosawa|Drama, Horror, Mystery & Suspense|Nov 9, 2005|Feb 21, 2006||R (for some violent images.)|110|Magnolia Pictures|Kiyoshi Kurosawa|A website, which at first appears to be merely a scary hoax with an irresistible marketing ploy, turns out to be run by a sinister and deadly force. As people repeatedly tap into the site's frightening images of the dead, the supernatural force begins controlling their lives.|6.8/10|53|39|14|6.4/10|16|11|5|3.3/5|11,935
8923|Three...Extremes (Saam gaang yi)|Takashi Miike, Fruit Chan, Chan-wook Park, Kim Jee-woon, Nonzee Nimibutr|Art House & International, Horror|Oct 28, 2005|Feb 28, 2006||R (for strong disturbing violent content, some involving abortion and torture, and for sexuality and language)|125|Lionsgate|Lilian Lee, Chan-wook Park, Haruko Fukushima|"Three Asian directors, from Hong Kong, Korea, and Japan, join forces to create an omnibus horror film, Three...Extremes. In Fruit Chan's ""Dumplings,"" shot by Christopher Doyle, Mrs. Li (Miriam Yeung), a thirtysomething former actress with a philandering husband (Tony Leung) goes to visit Aunt Mei (Bai Ling), who sells the most expensive dumplings in Hong Kong. Mrs. Li knows about their rejuvenating powers, and she also knows about their unpleasant main ingredient, but after some initial nausea, she digs right in. In Oldboy writer/director Park Chan-wook's ""Cut,"" a successful filmmaker (Lee Byung-hun of Joint Security Area) arrives home to find that a disgruntled extra (Lim Won-hee) has taken over his home, and fastened his pianist wife (Kang Hye-jun of Oldboy) to the grand piano. The madman threatens to cut off the wife's fingers, one by one, unless the director strangles the helpless child he's tied to the couch. Takashi Miike directs the last segment, ""Box,"" about a young author and former circus performer, Kyoko (Kyoko Hasegawa), seemingly haunted by the ghost of her twin sister, who died a mysterious and horrible death while practicing their act. Adding to Kyoko's trauma, her editor (Atsuro Watabe) is a dead ringer for her old stepfather/ringmaster, who may have perished in the same ""accident"" that took her sister's life. Three...Extremes was shown at Subway Cinema's New York Asian Film Festival in 2005. For the American release of Three...Extremes, the order in which the films are presented was altered from the original ""Box,"" ""Dumplings,"" and ""Cut"" to ""Dumplings,"" ""Cut,"" and ""Box."" This film was actually preceded by another omnibus film, Three, that was nevertheless retitled Three...Extremes II for the English-language market and issued after this one. ~ Josh Ralske, Rovi"|6.8/10|61|51|10|6.3/10|25|17|8|3.7/5|15,552
8919|The Weather Man|Phedon Papamichael, Gore Verbinski|Comedy, Drama|Oct 28, 2005|Feb 21, 2006|$12,469,811|R (for strong language and sexual content)|101|Paramount Pictures|Steven Conrad|A man struggles to get a grip on a life that's spinning out of control in this emotional comedy drama. Dave Spritz (Nicolas Cage) is a television weatherman on a high-profile Chicago news program. Professionally, Dave is doing just fine -- he makes great money for a job that demands little effort, and he has a shot at an assignment with a network morning news and chat show. But Dave's personal life leaves a lot to be desired -- his father, respected author Robert Spritzel (Michael Caine), is in failing health, he's divorced from his wife, Noreen (Hope Davis), and his relationship with his children is tenuous at best, especially his overweight daughter, Shelly (Gemmenne de la Pena). If Dave is to land his new job, he'll have to move to New York City, and with his time in Chicago running short, he dedicates himself to trying to salvage his ties with his family before it's too late, though he discovers this is even harder than he imagines.|6.1/10|136|80|56|6.1/10|37|20|17|2.9/5|213,963
8841|North Country|Niki Caro|Drama|Oct 21, 2005|Feb 21, 2006|$18,324,242|R (for sequences involving sexual harassment including violence and dialogue, and for language)|127|Warner Bros. Pictures|Michael Seitzman|This true story centers on Lori Jenson, who took a job at a Minnesota iron mine in 1975. She and other female miners endured harassment from male co-workers, ranging from verbal taunts to pornographic graffiti and worse. Jenson eventually filed suit in 1984 and won a landmark legal decision.|6.7/10|172|118|54|6.9/10|43|31|12|3.5/5|93,121
8766|Where the Truth Lies|Atom Egoyan|Drama, Mystery & Suspense|Oct 28, 2005|Feb 28, 2006|$753,158|NC17 (Sexuality)|108|ThinkFilm|Atom Egoyan|Kevin Bacon and Colin Firth star as a famous comedy team that splits up after a woman is found dead in their hotel suite. Two decades later, a journalist investigates what really happened in this stylish and riveting mystery directed by Atom Egoyan.|5.4/10|100|40|60|5.2/10|32|10|22|3/5|28,081
8760|Domino|Tony Scott|Action & Adventure, Drama, Mystery & Suspense|Oct 14, 2005|Feb 21, 2006|$10,137,232|R (for strong violence, pervasive language, sexual content/nudity and drug use)|128|New Line Cinema|Richard Kelly, Tobias Emmerich|The daughter of respected actor and matinee idol Lawrence Harvey, and model-turned-socialite Sophie Wynn, Domino Harvey was born into a life of wealth and privilege -- a lifestyle that did not interest her. Even from her earliest years, Domino rebelled against convention and the jet set. When Domino was only eight, her beloved father passed away and her mother looked to the stability of boarding school in a misguided attempt to tame her wild child. But nothing could repress Domino's fiery nature -- not friendships, not school, not her mother's high society. Even the extraordinary excesses paraded before her during a brief stint at modeling paled in comparison to her own escapades. Not until she stumbled upon a job seminar recruiting aspiring bounty hunters was her thirst for excitement at long last quenched. To Sophie's horror, Domino not only fell in love with the job but also with her fellow adventurers, who over the years would become her family.|3.9/10|156|29|127|3.7/10|36|3|33|3.1/5|247,052
7588|Separate Lies|Julian Fellowes|Drama, Mystery & Suspense, Romance|Sep 16, 2005|Feb 21, 2006|$849,496|R (for language including some sexual references)|98|Fox Searchlight Pictures|Julian Fellowes|A damaged relationship is stretched to its desperate limits in this drama. Anne (Emily Watson) and James (Tom Wilkinson) are a seemingly happy and prosperous British couple who divide their time between a flat in London and a house in the country. However, their marriage is not as contented as one might imagine, and for years James has turned a blind eye to just how deeply unhappy Anne has become with him. Their lives together reach a crossroads when Anne meets the handsome and charming Bill Bule (Rupert Everett); Anne becomes deeply infatuated with him, which only reinforces her dissatisfaction with James, but when the two become involved in an accident that kills another man, Bill drops out of the picture and James decides he must step forward to protect the woman he wed. Separate Lies was the directorial debut from screenwriter Julian Fellowes.|6.8/10|87|62|25|7.1/10|31|24|7|3.2/5|2,929
5623|De zaak Alzheimer (The Memory of a Killer)|Erik Van Looy|Action & Adventure, Drama, Mystery & Suspense|Aug 26, 2005|Feb 21, 2006||R (for violence, sexuality and nudity)|120|Sony Pictures Classics|Jef Geeraerts, Carl Loos, Erik Van Looy|A French assassin suffering from the onset of Alzheimer's disease finds himself on the run after refusing to carry out a hit on a 12-year-old prostitute. Jan Decleir stars in this riveting thriller from director Erik Van Looy.|6.8/10|67|56|11|6.8/10|25|21|4|3.7/5|3,875
5076|Reel Paradise||Documentary, Musical & Performing Arts, Special Interest|Sep 2, 2005|Feb 14, 2006||R (for language including sexual references, and brief crude humor)|113|Miramax Films|Steve James (II)|Reel Paradise tells the story of John Pierson's family at the end of a year-long adventure on a remote island in Fiji where they ran the 180 Meridian Cinema, showing free movies to the locals.|6.5/10|48|33|15|6.7/10|19|14|5|3.4/5|751
770711649|The Talent Given Us|Andrew Wagner|Comedy|Jun 11, 2004|Mar 7, 2006||NR|98||Andrew Wagner|"Fact and fiction begin to blur in this comedy drama in which a filmmaker casts his parents, his siblings, and himself in a story loosely adapted from their own lives and personalities. Judy and Allen Wagner (played by Judy Wagner and Allen Wagner) are an elderly couple living in New York City who haven't seen their son, Andrew (Andrew Wagner), in some time. Deciding it's time they paid him a visit, Judy and Allen pack up their van and head out to Los Angeles, where Andrew is trying to make a name for himself as a director and screenwriter. Along the way, Judy and Allen decide to bring their daughters, Maggie (Maggie Wagner) and Emily (Emily Wagner), and the camera plays ""fly on the wall"" as Judy and Allen openly ponder the successes and failings of their children while they work on crossword puzzles, stop for meals, engage in small talk, and deal with the presence of fellow traveler Bumby (Judy Dixon). The first feature from Andrew Wagner, The Talent Given Us was awarded the Grand Jury Prize at the 2004 CineVegas Film Festival."|6.2/10|51|30|21|6.5/10|21|15|6|2.9/5|108
770679763|This Thing of Ours|Danny Provenzano|Drama|Jul 18, 2003|Mar 7, 2006||NR|133|Small Planet|Danny Provenzano, Ted A. Bohus|Grandnephew of the famous mobster known as Tony Pro, Danny Provenzano is the co-writer, director, and star of the independent crime drama This Thing of Ours (the title is a literal translation of the crime organization La Cosa Nostra). Provenzano plays young mobster Nick Santini, who wishes to impress his Uncle Danny (Frank Vincent) and the other elders of a New Jersey mob. Nick plans a major bank heist with his old pal Robert Biaggio (Christian Maelen) and computer geek Austin Palermo (Louis Vanaria). Using a complicated Internet scam to distort a communications satellite, they plan to steal more than 50 million dollars. Nick is eventually stuck with having to choose between his friends and the mob when high-ranking Patsy DeGrazio (Michael DelGaizo) kidnaps Austin. This Thing of Ours also stars Vincent Pastore (The Sopranos), James Caan (The Godfather), and Pat Cooper (Analyze This). Incidentally, Provenzano was arresting in 1999 under a 44-count felony indictment that included charges of racketeering, kidnapping, and money laundering. He eventually pleaded guilty to racketeering and was scheduled to begin a ten-year prison sentence in August 2003, just weeks after his film is released.|5/10|15|6|9|4.7/10|7|2|5|2.8/5|262
770677722|A League of Ordinary Gentlemen|Chris Browne, Christopher Browne|Comedy, Documentary, Special Interest, Television, Sports & Fitness|May 27, 2005|Mar 21, 2006||R|93|Magnolia Pictures||"Can one of America's least glamorous sports survive a media-savvy makeover...and can it survive without one? In the 1950s and '60s, bowling was one of America's most popular sports, with millions spending their spare time on the lanes and watching professional bowling on television. However, the game's popularity took a nosedive in the 1980s and '90s, and matters only got worse when network television dropped regular bowling coverage. Eventually, the Professional Bowlers Association was bought out by a group of Microsoft executives, who pumped five million dollars into the organization and hired former football player Steve Miller to give the game a PR makeover in hopes of attracting a new audience. In A League of Ordinary Gentlemen, documentary filmmaker Chris Browne follows four professional bowlers -- Pete Weber, Walter Ray Williams Jr., Chris Barnes, and Wayne Webb -- as they scrape out a living on the pro bowling circuit and try to make sense of Miller's attempts to give the game a higher profile, with the solid play of Williams, who has won the PBA championship a whopping 39 times, often overlooked in favor of the ""bad boy"" showboating of Webber."|7.3/10|34|31|3|7.2/10|15|14|1|3.5/5|402
