770814722|Casino Jack|George Hickenlooper|Comedy, Drama, Mystery & Suspense|Dec 17, 2010|Apr 5, 2011|$1,039,869|R (for pervasive language, some violence and brief nudity)|108|ATO Pictures|Norman Snider|Two-time Academy Award Winner Kevin Spacey gives the performance of a lifetime in CASINO JACK, a riotous new film starring Spacey as a man hell bent on acquiring all that the good life has to offer. He plays in the same game as the highest of rollers and resorts to awe-inspiring levels of conning, scheming and fraudulent antics to get what he wants. Inspired by true events that are too over-the-top for even the wildest imaginations to conjure, CASINO JACK lays bare the wild excesses and escapades of Jack Abramoff. Aided by his business partner Michael Scanlon (Barry Pepper), Jack parlays his clout over some of the world's most powerful men with the goal of creating a personal empire of wealth and influence. When the two enlist a mob-connected buddy (Jon Lovitz) to help with one of their illegal schemes, they soon find themselves in over their heads, entrenched in a world of mafia assassins, murder and a scandal that spins so out of control that it makes worldwide headlines. Directed by George Hickenlooper (FACTORY GIRL, THE MAN FROM ELYSIAN FIELDS), CASINO JACK returns Spacey to the type of role that made him famous - a cool-headed, articulate snake charmer whose wild ambitions knows no limits or boundaries. The film also stars Kelly Preston and Rachelle Lefevre and is produced by Gary Howsam, Bill Marks and George Vitetzakis from an original screenplay by Norman Snider. Executive Producers are Richard Rionda Del Castro, Lewin Webb, Donald Zuckerman, Dana Brunetti, Patricia Eberle, Warren Nimchuk, Angelo Paletta and Domenic Serafino. The Associate Producer is Rick Chad. -- (C) Art Takes Over|5.5/10|97|39|58|5.5/10|29|12|17|2.9/5|11,567
770816878|Ghost Bird|Scott Crocker|Documentary|May 6, 2009|Apr 11, 2011||NR|85|Anthology Archives||"It is estimated that between 50 and 70 million Americans pursue bird watching as a hobby, and most of them are people who thrive on the prospect of finding a specimen they haven't seen before. In February 2004, a birder kayaking in an Arkansas swamp videotaped what he believed was a remarkable find -- an ivory-billed woodpecker, a large and impressive creature that was believed to have been extinct for half a century after unregulated clear-cutting of forests destroyed its habitat. The sighting was major news among avian researchers, and Cornell University's Ornithology Lab sent a team to Arkansas in hopes of finding a living ivory-billed woodpecker. Hundreds of bird watchers followed them to Brinkley, AR, in hopes of seeing the great bird themselves, and in a town that had been caught in an economic tailspin, the appearance of the woodpecker seemed like a stroke of remarkable good luck. Soon local entrepreneurs were opening gift shops and motels to take advantage of the influx of birders, and a local barber even devised a ""woodpecker haircut."" But amidst the excitement came a number of researchers who said that they had little hard evidence that what had been sighted was in fact an ivory-billed woodpecker, leading to a contentious debate among bird fanciers and folks in Brinkley who didn't want to lose their windfall. Filmmaker Scott Crocker takes an in-depth look at the sudden reappearance of the ivory-billed woodpecker and its many consequences in the documentary Ghost Bird, which was an official selection at the 2009 Hot Docs International Film Festival."|7.1/10|11|10|1|7.3/10|5|5|0|3.5/5|95
770817053|Farewell (L'affaire Farewell)|Christian Carion|Art House & International, Drama, Mystery & Suspense|Jul 23, 2010|Apr 12, 2011|$309,262|NR|112|Neoclassic Films|Christian Carion, Eric Raynaud|"Engaging, emotional and riveting, ""Farewell"" is an intricate and highly intelligent thriller pulled from the pages of history -- about an ordinary man thrust into the biggest theft of Soviet information of the Cold War. Ronald Reagan called this piece of history -- largely unknown until now, ""one of the most important espionage cases of the 20th century."""|7.1/10|77|66|11|6.9/10|26|22|4|3.6/5|5,031
770817146|White Material|Claire Denis|Art House & International, Drama|Nov 19, 2010|Apr 12, 2011|$302,819|NR|102|IFC Films|Claire Denis, Marie N'Diaye|From Claire Denis, the incomparable director of BEAU TRAVAIL, L'INTRUS and 35 SHOTS OF RHUM, comes WHITE MATERIAL: a rich and thrilling account of a woman driven to the edge. An official selection of the Venice, Toronto and New York Film Festivals, the film is a riveting exploration of the complexities of racial conflict and the limits of human will. The legendary Isabelle Huppert (LA CEREMONIE, THE PIANO TEACHER, 8 WOMEN), is Maria Vial, a fearless French woman attempting to run her family's coffee plantation in an unnamed African country. Torn violently apart by hate-fueled civil conflict, this unforgiving setting soon turns against the foreign family, declaring them outlaws in their new home. In a brash effort to save her family and livelihood, Maria risks everything, fighting with every shred of her will to buck the rebel forces wrestling for control of local power. -- (C) IFC|7.3/10|88|76|12|7.6/10|23|21|2|3.2/5|11,143
770851303|Teenage Paparazzo|Adrian Grenier|Documentary, Special Interest|Dec 31, 2010|Mar 29, 2011||NR|91|HBO Documentary|Adrian Grenier, Thomas de Zengotita|After several years of playing a famous actor on the HBO series Entourage, Adrian Grenier has become a celebrity in real life, and just as his show often explores the nature of fame in our culture, Grenier profiles a young man who is a unique product of our star-struck society in this documentary. One evening, while being pursued by a handful of celebrity photographers, Grenier noticed that one of them looked like a boy barely in his teens, and he later discovered that the paparazzo in question, Austin Visschedyk, was indeed just thirteen years old, but already working as a free lance photographer and earning up to $2,000 a shot for pictures of the right star. Home schooled by divorced parents who often give in to their young son's demands, Visschedyk prowls the streets of Hollywood at nights, keeping his eye peeled for a A-list personalities whose images are in demand from the tabloids and celebrity press, and while not all of his older colleagues care for Visschedyk, some admit that his youth makes it easier for him to find a cooperative subject. In Teenage Paparazzo, Grenier interviews Visschedyk, joins him for a night of stalking the famous and learns more about the nature of the celebrity press. But by turning a spotlight on his thirteen-year-old subject, is he only making his youthful ego more problematic? Teenage Paparazzo was an official selection at the 2010 Sundance Film Festival.|6.7/10|5|5|0|||||4.6/5|2,545
770856660|The Taqwacores|Eyad Zahra|Drama|Oct 22, 2010|Apr 5, 2011|$11,175|NR|84|Strand Releasing|Michael Muhammad Knight, Michael Muhammad Knight, Eyad Zahra|"Yusef is a first-generation Pakistani-American engineering student who moves off-campus with a group of Muslim punks in Buffalo, New York. His new ""un-orthodox"" housemates soon introduce him to Taqwacore - a hardcore, Muslim punk rock scene. As the seasons change, Taqwacore influences the house more and more. The living room becomes a mosque during the day, while it continues to host punk shows at night. Ultimately, Yusef begins to challenge his own faith and ideologies. A powerful and original story of punk Islam in the USA and the discovery of oneself within the confines of religion. -- (C) Strand"|5.1/10|26|11|15|4.9/10|10|3|7|2.8/5|4,808
770860109|Hubble 3D|Toni Myers|Documentary, Drama|Mar 19, 2010|Mar 28, 2011|$51,710,208|G|44|Warner Bros.||"Experience the gripping story -- full of hope, crushing disappointment, dazzling ingenuity, bravery, and triumph -- in ""Hubble 3D"", the seventh awe-inspiring film from the award-winning IMAX (R) Space Team. Through the power of IMAX (R) 3D, ""Hubble 3D"" will enable movie-goers to journey through distant galaxies to explore the grandeur and mysteries of our celestial surroundings, and accompany space-walking astronauts as they attempt the most difficult and important tasks in NASA's history. The film will offer an inspiring and unique look into the Hubble Space Telescope's legacy and highlight its profound impact on the way we view the universe and ourselves."|7.8/10|38|33|5|6.9/10|13|9|4|4.1/5|16,723
770867062|Strange Powers: Stephin Merritt And The Magnetic Fields|Gail O'Hara, Kerthy Fix|Documentary, Musical & Performing Arts|Oct 27, 2010|Apr 1, 2011|$68,094|PG|89|Variance Films||Performing with the Magnetic Fields since 1991, Stephin Merritt has composed some of his generation's most intellectually incisive, whimsical, witty and acerbic music. A dedicated, growing army of admirers flocks to the group's concerts and makes Merritt an odd sort of anti-celebrity, one who is happiest not being recognized, whiling away the hours in gay bars on either coast or spending a good part of the day soaking up obscure movie classics. Ten years in the making, the film follows the famously grumpy Merritt and explores his relationship with Claudia Gonson, his creative collaborator and the band's manager. It paints a portrait of an artist whose music brilliantly holds up a mirror to the fears, joys, and insecurities of his time.|6.6/10|31|24|7|6.7/10|14|10|4|3.8/5|192
770873084|Behind The Burly Q|Leslie Zemeckis|Documentary, Musical & Performing Arts|Apr 23, 2010|Apr 11, 2011||NR|98|First Run Features|Leslie Zemeckis|"Although its origins derive from France, Great Britain and Greece, burlesque became a wildly popularAmerican form of art that thrived in the early to mid part of the 20th century. Because of the sexualinnuendo and the barely-there costumes it has largely been left out of the history books.In the 1840s burlesque was applied to a wide range of comedic plays that entertained the lower and middleclasses in Great Britain. Coming to America, burlesque evolved into shows performed by scantily-cladbeauties. It thrived, appealing to the masses of working class people who weekly stormed the theatres tosee troupes like ""The British Blondes"", a bevy of beauties dressed in tights. Burlesque poked fun at theupper classes, at sex, and at what people were willing to do in the pursuit of obtaining sex. By the 1920sthe old burlesque circuits closed and strip tease was introduced to offer something vaudeville and film didnot.During the Great Depression, for a dime a man could fall into a big gaudy burlesque show and forget histroubles. From theatres to nightclubs, burlesque was a raucous sexy show filled with gorgeous women,strippers, comedians, acrobats and singers. The tame by today's standards, the shows were consideredrisqué, and most performers were looked down on as second rate.Backed by public outrage, in 1937 New York Mayor Fiorello La Guardia closed the burlesque houses in hisstate. The use of the word ""burlesque"" was outlawed in advertising. The Minsky brothers, who some sayintroduced nudity to the burly audiences, were so closely associated with burlesque that La Guardia bannedthe use of the name Minsky. Once again, burlesque changed, moving across the river to New Jersey toescape censure. Eventually comedians and musicians' parts were reduced in the shows and more stripperswere brought on. By the 1960s hard-core porn was available and burlesque had died. But what happened tothe thousands of performers? Where did they go?""Behind the Burly Q"" is the behind-the-scenes stories of these men and women as told by the performersthemselves. For the first time ever, the performers from the golden age of burlesque relate theirheartbreaking, triumphant stories of life on the road performing in the burly circuit. Many were ashamed oftheir past and had never talked about their experiences. Just as many had never been asked.Director Leslie Zemeckis and producer Sheri Hellard traveled extensively across the country from theBayous of post-Katrina Mississippi, to New Jersey, Florida and all points between. The duo tracked downand recorded dozens of interviews with little-known performers to the last of the living legends ofburlesque. They spoke with relatives of many deceased stars. The men and women in this documentaryopened their scrapbooks as well as their hearts, relating memories they had all but forgotten.Amongst those interviewed were former musicians, strippers, novelty acts, club owners, funny men andwomen, authors and historians assembled together for the first time ever to tell you just what reallyhappened in a burlesque show. Sadly, many of the performers have since passed away, making this theirlast, and often times only interview. We dedicate this film to their memory.""Behind the Burly Q"" is the definitive history of burlesque during its heyday. Funny, shocking,unbelievable and heartbreaking, their stories will touch your hearts. Hear the performers in their ownwords. See the performers in action. We invite you to peek behind the curtain at the burly show. -- (C) First Run Features"|6.5/10|27|21|6|6/10|11|7|4|3.5/5|147
771041046|Made in Dagenham|Nigel Cole|Drama|Nov 19, 2010|Mar 29, 2011|$1,094,798|R (for language and brief sexuality)|113|Sony Pictures Classics|William Ivory|Based on the 1968 strike at the Ford Dagenham car plant, in which 850 female workers walked out in protest of sexual discrimination.|6.8/10|127|102|25|7/10|31|21|10|3.6/5|19,302
771048664|Come Undone (Cosa voglio di più)|Silvio Soldini|Art House & International, Comedy, Drama|Dec 3, 2010|Apr 5, 2011|$2,664|NR|126|Film Movement||"Anna (Alba Rohrwacher) has everything she thought she could ever need: a respectable career, a caring family, and a loving partner, Alessio. But when she meets Domenico (Pier Francesco Favino), a handsome, married waiter, her neatly ordered world begins to fall apart. They quickly fall into a heated affair, based on secret meetings, stolen caresses, cell phone fights, and endless lies. Anna's increasingly distant behavior goes unnoticed by Alessio, while Domenico's wife becomes steadily more suspicious of her husband. As the two lovers begin to fall deeper under the spell of passion, they are faced with a life-changing choice which neither is entirely prepared to make. COME UNDONE is Silvio Soldini's third film to be distributed in the US by Film Movement, which originally released AGATA AND THE STORM in 2006 and DAYS AND CLOUDS in 2009. Long committed to telling an array of intimate stories of private and passionate relationships, in COME UNDONE Solidni explores themes of lust, forbidden desire and infidelity, and their myriad ramifications. In depicting his protagonists' clandestine affair, it was very important to Soldini that, in his words, he ""shows very real characters, with problems that we all have, as if they were people that we know, in situations that we all experience."" Unlike his previous purely fictional films, COME UNDONE is based on stories that a close friend of the director related to him about her own romantic affairs. -- (C) Film Movement"|6.7/10|7|6|1|||||3/5|374
771198393|Marwencol|Jeff Malmberg|Documentary, Science Fiction & Fantasy|Oct 8, 2010|Apr 12, 2011|$112,036|NR|83|The Cinema Guild||"On April 8, 2000, Mark Hogancamp was brutally attacked by five men in his hometown of Kingston, New York. The assault left the ex-navyman, carpenter, and showroom designer in a coma for nine days; he emerged with brain damage that initially made it impossible for him to walk, eat, or speak. Physical and occupational therapy helped him regain basic motor skills, but after less than a year he discovered that without insurance, he could no longer afford it. Determined ""not to let those five guys win,"" Hogancamp turned to art as a therapeutic tool. He revisited his childhood hobbies of collecting toy soldiers and building and painting models. Commandeering a pile of scrap wood left behind by a contractor, he constructed ""Marwencol,"" a fictional Belgian town built to one-sixth scale in his backyard. He populated it with military figurines and Barbie dolls representing World War II personages like Patton and Hitler as well as stand-ins for himself, his friends, and his family. Finally, he dusted off an old camera and used it to capture staged events ranging from pitched battles between occupying German and American forces to catfights in the town bar.-- (C) Cinema Guild"|8.4/10|60|59|1|8.2/10|20|20|0|4/5|2,415
771203479|What If...|Dallas Jenkins|Drama, Special Interest|Aug 20, 2010|Apr 4, 2011|$814,348|PG|118|10 West Studios|Andrea Gyertson Nasfell, Chuck Konzelman, Andrea Gyertson, Cary Solomon|What If tells the story of Ben Walker, who fifteen years ago left his college sweetheart Wendy, and his calling to be a preacher, in order to pursue a business opportunity. Now with a high-paying executive gig, a trophy fiancé, and a new Mercedes, he hasn't considered a family nor felt the need to set foot in a church in fifteen years. But God has other plans. While on a thrill ride outside the city, his new car mysteriously breaks down, and he's visited by a tow truck driver named Mike who claims to be an angel sent to show Ben what his life would look like had he followed his true calling.|5.8/10|6|2|4|||||3.8/5|724
771203530|Country Strong|Shana Feste|Drama, Musical & Performing Arts|Jan 7, 2011|Apr 12, 2011|$20,218,921|PG-13 (for thematic elements involving alcohol abuse and some sexual content)|112|Screen Gems|Shana Feste|Soon after a rising young singer-songwriter (Hedlund) gets involved with a fallen, emotionally unstable country star (Paltrow), the pair embarks on a career resurrection tour helmed by her husband/manager (McGraw) and featuring a beauty-queen-turned-singer (Meester). Between concerts, romantic entanglements and old demons threaten to derail them all. -- (C) Columbia|4.5/10|131|29|102|4.7/10|40|6|34|3.3/5|32,966
771203933|Ticked-off Trannies With Knives|Israel Luna|Drama, Mystery & Suspense, Gay & Lesbian|Oct 20, 2010|Mar 29, 2011||NR|95|Independent Pictures|Israel Luna|"A group of transgender women are violently beaten by three straight guys and left for dead. After regaining their consciousness, the violated vixens turn deadly divas. With their new found confidence and courage, the ticked-off trannies slice their way to vengeance. An homage to the exploitation/revenge films of the 70's and 80's, ""Ticked-Off Trannies With Knives"" is loaded with titillating dialog, buckets of blood...and extreme violence. -- (C) Official Site"|6/10|5|4|1|||||3.1/5|703
771209001|Cool It|Ondi Timoner|Documentary|Nov 12, 2010|Mar 29, 2011|$62,713|PG (for thematic elements)|104|Roadside Attractions|Terry Botwick, Sarah Gibson, Bjorn Lomborg, Ondi Timoner|Climate catastrophe? Normal solar activity? The end of civilization as we know it? Cool It is based upon the book of the same name and lectures by Bjorn Lomborg, the controversial author of The Skeptical Environmentalist. Acclaimed award-winning filmmaker Ondi Timoner travels the world with Lomborg exploring the real facts and true science of global warming and its impact. Lomborg is the founder of the economic think tank, Copenhagen Consensus, which brings together the world's leading economists to prioritize major global problems -- among them malaria, the lack of potable water and HIV/AIDS -- based upon a cost/benefit analysis of available solutions. Amidst the strong and polarized opinions within the global warming debate, Cool It follows Lomborg on his mission to bring the smartest solutions to our energy needs, carbon emissions and other major problems in the world. -- (C) Roadside Attractions|6.1/10|42|22|20|6.3/10|16|8|8|3.8/5|1,006
771217724|Break Ke Baad|Danish Aslam|Art House & International, Comedy, Drama, Romance|Nov 24, 2010|Apr 4, 2011||NR|113|Reliance Big Pictures|Renuka Kunzru|"This Thanksgiving holiday weekend, Reliance Big Pictures unveils the highly anticipated pairing of Imran Khan (I Hate Luv Stories) and Deepika Padukone (Om Shanti Om) in the Bollywood romantic comedy BREAK KE BAAD (""After the Break"") which hits theaters across North America on Wednesday, November 24. Producer Kunal Kohli (Hum Tum, Fanaa) brings audiences a heart-warming story of long-distance love set on different continents featuring two of India's most popular young stars. -- (C) Reliance Big Pictures"|0/10|5|1|4|||||2.8/5|1,111
771233814|A Summer In Genoa|Michael Winterbottom|Drama|Mar 27, 2009|Apr 12, 2011||R (for language, some sexuality and drug use)|93|Entertainment One|Michael Winterbottom, Laurence Coriat|In the wake of a family tragedy, an English ex-patriot living in the United States decides to relocate himself and his daughters to Italy, only to discover that grief has followed them overseas when the youngest girl proves unable to move past her acute emotional pain. An Englishman at heart, Joe (Colin Firth) now lives a happy life with his wife and daughters in the United States. Their happy existence is turned upside down in an instant, however, when his wife is driving their daughters home one day and becomes momentarily distracted from the road. Later, as Joe and his daughters attempt to contend with the thick fog of grief hanging over their household, the loving father surmises that a change of scenery may be in order; accepting a teaching job in Italy in hopes that it will help them contend with their bereavement. For teenage daughter Kelly (Willa Holland), at least, the move works miracles: though Kelly was sullen and withdrawn back home, she seems awakened by the endless possibilities that the future may hold in Europe - even entering into a clandestine romance with a handsome Italian boy. Kelly's younger sister Mary (Perla Haney-Jardine), unfortunately, is another case entirely. Despite her father's most valiant efforts to assuage her grief, Mary just doesn't seem capable of shaking the loss. Meanwhile, as Joe rekindles an old friendship with a university colleague (Catherine Keener), his family soaks in the marvelous medley of medieval, Renaissance, and contemporary influences of the scenic, northern Italian city.|6.3/10|43|34|9|||||3/5|2,303
770671941|The Fighter|David O. Russell|Drama, Sports & Fitness|Dec 10, 2010|Mar 15, 2011|$93,571,803|R (for language throughout, drug content, some violence and sexuality)|115|Paramount Pictures|Eric Johnson, Scott Silver, Paul Tamasy, Paul Attanasio|"Mark Wahlberg stars in Paramount Pictures' inspirational docudrama exploring the remarkable rise of Massachusetts-born, junior welterweight title winner ""Irish"" Micky Ward. A determined pugilist whose career in the ring was shepherded by his loyal half-brother, Dicky (Christian Bale) -- a hard-living boxer-turned-trainer whose own career in the ring was nearly sent down for the count due to drugs and crime -- perennial underdog Irish Micky rebounded from a disheartening series of defeats to win both the WBU Intercontinental Lightweight title and the WBU Light Welterweight title thanks to a fierce combination of determination and hard work. David O. Russell directs from a script by 8 Mile's Scott Silver and Paul Attanasio (The Bourne Ultimatum). ~ Jason Buchanan, Rovi"|7.8/10|241|218|23|7.7/10|44|37|7|4.1/5|121,184
770793400|The Windmill Movie|Alexander Olch|Documentary, Drama, Special Interest|Jun 17, 2009|Mar 22, 2011||NR|80|Film Forum|Alexander Olch|"As conceived and edited together by Alexander Olch, this documentary pays homage to the life of the late filmmaker and professor Richard P. ""Dick"" Rogers (Pictures from a Revolution). Director of the Harvard University Film Study Center, Rogers died in July 2001. He left behind boxes upon boxes of footage intended for an unrealized autobiographical film; working together with Rogers's wife and creative partner, Susan Meiselas (who assumed the role of producer here), Olch began assembling the footage in its intended form. The resultant work sits poised halfway between fiction and documentary; it employs a linear chronology that spans Rogers's life, from his youth to his premature passing from melanoma at the age of 57. Olch uses the loosely-knit footage to meditate, pensively, on the nature of film, art, and the cycle of life, as well as Rogers's need to create for the sake of progeny."|7.2/10|21|18|3|6.4/10|11|8|3|3.2/5|1,594
770797574|The Beautiful Truth|Steve Kroschel|Documentary, Drama, Special Interest|Nov 26, 2008|Mar 15, 2011||NR|91|Cinema Libre|Steve Kroschel|Hailing from a small town in Alaska, 15-year-old Garrett sets out to investigate the direct link between diet and disease, and in the process he learns about world's simplest cure for cancer.|5.6/10|15|7|8|4.5/10|8|2|6|3.9/5|1,571
770797789|Looking for Palladin|Andrzej Krakowski|Comedy|Mar 5, 2008|Mar 22, 2011||R (for language)|115|Monterey Media|Andrzej Krakowski|Hollywood talent agent Josh Ross is sent to Guatemala to lure an old Hollywood star, Jack Palladin, out of retirement. Arrogant Josh gets frustrated by the slower pace of life in Guatemala and disregards the community's interests, even though he needs them in order to find Jack. As he journeys to find Palladin, Josh embarks in a personal journey of self-discovery that changes his life.|4.1/10|9|2|7|4.1/10|6|2|4|2.5/5|52
770802613|Jackass 3|Jeff Tremaine|Action & Adventure, Comedy, Documentary|Oct 15, 2010|Mar 8, 2011|$117,222,007|R (for male nudity, extremely crude and dangerous stunts throughout, and for language)|94|Paramount Pictures/MTV Films|Preston Lacy|Johnny Knoxville and his buddies are up to their daredevil comic antics again. And this time they're coming at ya' in 3D.-- (C) Paramount|5.9/10|110|71|39|5.8/10|26|13|13|3.7/5|93,689
