8839|Doom|Andrzej Bartkowiak|Action & Adventure, Horror, Science Fiction & Fantasy|Oct 21, 2005|Feb 7, 2006|$28,031,250|R (for strong violence/gore and language)|104|Universal Pictures|Dave Callaham, Wesley Strick|One of the most popular and influential video games ever makes its way to the big screen in this sci-fi thriller. A coalition of Earth's scientific and military interests have established a research colony called Olduvai on the planet Mars, but one day all communication from the outpost stops and no one can tell what has happened -- though the final messages suggest it's not good. Believing foul play may have overtaken Olduvai's crew, the Rapid Response Tactical Squad, a team of specially trained military personnel, are deployed to investigate the situation and, if necessary, eliminate the invaders. But Sarge (Dwayne Johnson, aka The Rock) and Reaper (Karl Urban), leaders of the RRTS team, soon discover the situation is far more grim than they could have imagined. An experiment on Olduvai has very literally opened a portal to Hades, and a variety of savage and demonic creatures have overtaken the colony. Now the RRTS must seal off Olduvai, close off any access to Earth, and exterminate the satanic beasts before they can kill again. Doom also stars Rosamund Pike (as Dr. Grimm), Dexter Fletcher, Ben Daniels, and Deobia Oparei. ~ Mark Deming, Rovi|3.9/10|132|25|107|3.7/10|29|5|24|2.7/5|333,489
8765|Nine Lives|Rodrigo García|Drama|Oct 14, 2005|Feb 14, 2006|$148,181|R (for language, brief sexual content and some disturbing images)|115|Magnolia Pictures|Rodrigo García, Rodrigo García|Filmmaker Rodrigo García takes an unusual look into the lives of nine different women in this episodic drama. Each of the film's nine sequences has been staged as a single shot, using the Steadicam system to allow the camera to follow the action fluidly and without cuts. In these short episodes (lasting between ten and 14 minutes), Holly (Lisa Gay Hamilton) has a brief moment of reverie while confronting the specters of her past in her old neighborhood. Maggie (Glenn Close) escorts her young daughter Maria (Dakota Fanning) to a cemetery as they visit the graves of their family members. Ruth (Sissy Spacek) is a married woman contemplating an affair while visiting Henry (Aidan Quinn) in his hotel room. Diana (Robin Wright Penn) unexpectedly runs into an old boyfriend, Damian (Jason Isaacs), while shopping for groceries. Camilla (Kathy Baker) is a hospital patient awaiting surgery for cancer. Samantha (Amanda Seyfried) is a teenage girl who helps look after her handicapped father Larry (Ian McShane). Sandra (Elpidia Carrillo) is a female prison inmate who is expecting a visit from her children. Sonia (Holly Hunter) lashes out at her boyfriend Martin (Stephen Dillane) when she finds out he's been cheating on her. And Lorna (Amy Brenneman) has an unexpectedly moving encounter with her ex-husband Andrew (William Fichtner) as she pays her respects to his second wife, who has just passed away. Nine Lives premiered at the 2005 Sundance Film Festival.|6.7/10|85|64|21|7.4/10|26|22|4|3.1/5|21,723
8761|Elizabethtown|Cameron Crowe|Comedy, Drama, Romance|Oct 14, 2005|Feb 7, 2006|$26,838,389|PG-13 (for language and some sexual references)|123|Paramount Pictures|Cameron Crowe|Cameron Crowe's Elizabethtown stars Orlando Bloom as Drew Baylor, a successful shoe designer, who as the film begins suffers a profound career setback that earns him the ill will of his boss (Alec Baldwin), and he learns that his estranged father has passed away. On the flight to his hometown, he makes the acquaintance of an eccentric stewardess named Claire (Kirsten Dunst). Susan Sarandon plays Drew's mother, a widow with an unusual sense of how to properly mourn her deceased husband. During the course of his stay with his extended family, Drew rediscovers what is important about life and falls in love with Claire.|4.7/10|175|50|125|4.3/10|43|10|33|3.1/5|352,579
8569|Waiting|Patrick Hasson, Rob McKittrick|Comedy|Oct 7, 2005|Feb 7, 2006|$16,101,109|R (for strong crude and sexual humor, pervasive language and some drug use)|94|Lions Gate|Rob McKittrick|"A waiter for four years since high school, Dean has never questioned his job at Shenanigan's. But when he learns that Chett, a high school classmate, now has a lucrative career in electrical engineering, he's thrown into turmoil about his dead-end life. Dean's friend Monty is in exactly the same boat, but he couldn't care less. More concerned with partying and getting laid, Monty is put in charge of training Mitch, a shy new employee. Over the course of one chaotic shift, Mitch gets to know the rest of Shenanigan's quirky staff: Monty's tough-talking ex-girlfriend, Serena, Shenanigan's over-zealous manager, Dan, and head cook Raddimus, who's obsessed with a senseless staff-wide competition known only as ""The Game""."|4.3/10|89|28|61|4.1/10|28|8|20|3.4/5|233,294
8567|In Her Shoes|Curtis Hanson|Comedy, Drama|Oct 7, 2005|Jan 31, 2006|$32,815,761|PG-13 (for thematic material, language and some sexual content)|90|20th Century Fox|Susannah Grant|Alternately hilarious and heart-rending, 'In Her Shoes' is about two sisters with nothing in common but size 8 1/2 feet. After a calamitous falling out, they travel the bumpy road toward a true appreciation for one another -- aided along the way by the grandmother they never knew they had.|6.8/10|163|122|41|6.3/10|45|27|18|3.2/5|390,846
8565|Wallace & Gromit: The Curse of the Were-Rabbit|Steve Box, Nick Park|Action & Adventure, Animation, Comedy, Kids & Family|Oct 7, 2005|Feb 7, 2006|$56,068,547|G|94|Dreamworks|Bob Baker, Steve Box, Mark Burton, Nick Park|"Eccentric inventor Wallace (voice of Peter Sallis) and his faithful if often perplexed dog Gromit are back in their first feature-length adventure from animator Nick Park. Wallace and Gromit have launched a new business venture just in time for a major gardening competition in their neighborhood of West Wallaby. ""Anti-Pesto"" is a humane pest-relocation service in which Wallace and Gromit capture rabbits and other critters who have been eating the produce from local gardens and give them new homes somewhere else. Business has been going well, and when the woman hosting the garden show, Lady Tottington (voice of Helena Bonham Carter), discovers a massive tribe of rabbits has been making a mess of her garden, she calls in Wallace and Gromit to move the bunnies elsewhere. Wallace is quite taken with Lady Tottington, but he's not the only one -- Victor Quartermaine (voice of Ralph Fiennes) is a slick but arrogant upper-class type who wants to win Lady Tottington's hand (and fortune) and is convinced he can do a better job capturing the rabbits than Wallace. However, Wallace's attempts to brainwash the rabbits away from veggies using his latest invention has disastrous results, and soon Wallace has to deal with a beastly bunny as well as a heavily-armed Quartermaine. Wallace and Gromit: The Curse of the Were-Rabbit followed Park's previous film with the duo, A Close Shave, by ten years, and was produced after Park broke through to mainstream success with the feature Chicken Run."|8.1/10|182|173|9|7.9/10|40|38|2|3.4/5|385,230
7978|Daltry Calhoun|Katrina Holden Bronson|Comedy|Sep 23, 2005|Feb 7, 2006||PG-13 (for sexual content, drug material and language.)|93|Miramax Films|Katrina Holden Bronson|When seed and sod entrepreneur Daltry Calhoun's (Johnny Knoxville) abandoned ex-girlfriend shows up on his doorstep with the daughter he never knew he had, the reformed ladies' man finds out that you can never truly escape your past -- even when it seems you may have no future. Calhoun is a local celebrity and self-made entrepreneur who made a name for himself by selling locally produced turf that blankets many of the nation's most exclusive golf courses, and his quirky television spots have won the hearts of television viewers across Ducktown, TN. When Daltry's ex-girlfriend May (Elizabeth Banks) arrives unannounced with talented teenage daughter June (Sophie Traub) in tow, she confides that her terminal illness has forced her to seek him out in hopes that he can care for their daughter after she is gone. Despite the early success of Daltry's business and the popularity of his kitschy commercials, things have been looking rather grim lately and Daltry has begun liquidating his assets in hopes of keeping his head above water. Though smitten shopkeeper Flora (Juliette Lewis) has offered financial help to Daltry, the kindly offers have fallen on deaf ears. Now, with the odds weighing heavily against him, Daltry vows to make up for lost time by doing right in the eyes of his family and community and caring for his daughter while getting his business back on track. ~ Jason Buchanan, Rovi|3.6/10|28|2|26|4/10|11|1|10|2.6/5|20,752
7591|Tim Burton's Corpse Bride|Tim Burton, Mike Johnson|Action & Adventure, Animation, Comedy, Kids & Family, Science Fiction & Fantasy|Sep 16, 2005|Jan 31, 2006|$53,300,000|PG (for some scary images and action, and brief mild language)|74|Warner Bros. Pictures|John August, Pamela Pettler, Caroline Thompson|Tim Burton returns to the dark but fanciful animated style of The Nightmare Before Christmas with this stop-motion black comedy. Victor (voice of Johnny Depp) lives in a small European village in the 19th century, where he is pledged to marry Victoria (voice of Emily Watson), a partnership arranged by their parents. The two only meet the day before their scheduled nuptials, and Victor performs disastrously in the wedding rehearsal. Later that evening, while he is walking through the woods and hopelessly practicing his vows, he puts Victoria's wedding band on what looks like a branch. Victor quickly discovers this was a big mistake; as it happens, he has put the ring on the skeletal finger of the enchanted Corpse Bride (voice of Helena Bonham Carter), who then whisks him off to a dark and mysterious netherworld where they are now married. Victor is frightened in the land of the dead, and even realizes that he has fallen in love with his true fiancée, Victoria, so he searches for a way back to his own world. Directed by Tim Burton in collaboration with animator Mike Johnson, Corpse Bride features a stellar voice cast, including Albert Finney, Christopher Lee, Richard E. Grant, Joanna Lumley, and Danny Elfman (who also composed the film's musical score). ~ Mark Deming, Rovi|7.2/10|188|157|31|7.3/10|40|34|6|3.5/5|553,133
7589|The Thing About My Folks|Raymond De Felitta|Comedy|Sep 16, 2005|Feb 14, 2006|$710,031|PG-13 (adult situations/language)|94|Picturehouse|Paul Reiser|A middle-aged man finds himself dealing with the divorce of his elderly parents as well as many years of emotional baggage in this poignant comedy drama. Ben (Paul Reiser) is a writer who is enjoying a quiet evening at home with his wife, Rachel (Elizabeth Perkins), when they receive an unexpected visitor, Ben's father, Sam (Peter Falk). As it happens, Sam has some surprising news -- his wife, Muriel (Olympia Dukakis), has left him, leaving behind a note saying she wants some time alone. While Ben gets in touch with his sisters, who immediately set out to track down Muriel, he is left to deal with Sam while he tries to figure out what has gone wrong. Eager to spend some time with his dad to talk things out, Ben invites Sam along for a trip upstate to look at some property he's interested in buying, and as the two men hit the road, they get a chance to get to know one another in a way Sam, a busy salesman, was unable to do when Ben was a boy. The Thing About My Folks was a pet project for Paul Reiser, who wrote the screenplay as well as playing the lead; he'd had the script in the works for 20 years, and always intended for Peter Falk to play the role of Sam.|5.6/10|65|29|36|5.1/10|22|9|13|2.8/5|17,512
7585|Proof|John Madden|Drama|Sep 16, 2005|Feb 14, 2006|$7,468,700|PG-13 (for some sexual content, language and drug references)|99|Miramax Films|David Auburn, Rebecca Miller|A devoted daughter comes to terms with the death of her father, a brilliant mathematician whose genius was crippled by mental insanity, forcing her to face her own long-harbored fears and emotions. She adjusts to his death with the help of one of her father's former mathematical students, who searches through her father's notebooks in the hope of discovering a bit of his old brilliance. While she comes to terms with the possibility that his genius, which she has inherited, may come at a painful price, her estranged sister arrives to help settle their father's affairs.|6.5/10|144|90|54|6.4/10|41|25|16|3.2/5|88,765
7582|Just Like Heaven|Mark Waters (VIII)|Comedy, Drama, Romance|Sep 16, 2005|Feb 7, 2006|$48,291,624|PG-13 (for some sexual content)|95|Dreamworks|Peter Tolan, Leslie Dixon|A couple who live on different sides of the divide of life and death discover just how many boundaries love can cross in this romantic comic fantasy. Elizabeth (Reese Witherspoon) is a hardworking and dedicated medical resident who, after 20 hours on duty, is heading home when she falls asleep at the wheel of her car and is involved in a fatal auto accident. Several weeks later, a man named David (Mark Ruffalo) takes over the lease on Elizabeth's apartment, but he discovers that she hasn't quite vacated the building. Elizabeth's body may be dead, but her spirit is still quite lively, and her ghost is insisting that the apartment is still hers...and that she wants him to move out. David brings in Darryl (Jon Heder), an eccentric man who claims to have psychic powers, to help sweep Elizabeth's spirit out of the apartment, but she refuses to budge, certain that she can't be completely dead, despite all evidence to the contrary. As Elizabeth and David try to share the flat, they discover that their differences aren't as great as they once imagined, and they become attracted to one another. But will Elizabeth's spirit stay in the land of the living long enough for their romance to go somewhere? Just Like Heaven marked Jon Heder's first feature film role after his breakthrough appearance in the independent hit Napoleon Dynamite.|5.6/10|150|82|68|5.1/10|32|13|19|3.6/5|541,411
5079|Supercross|Steve Boyum|Action & Adventure, Drama|Aug 17, 2005|Jan 31, 2006|$3,045,751|PG-13 (for language and some sexuality)|81|20th Century Fox|Ken Solarz, Bart Baker|Two siblings find themselves competing on and off the racetrack in this action-packed drama. K.C. Carlyle (Steve Howey) and his kid brother, Trip (Mike Vogel), are both racers in the rough and tumble world of supercross, a revved-up variation on motocross racing in which specially modified motorcycle negotiate specially built dirt tracks that send riders through tricky twists and turns, over rough terrain, and off high-flying jumps. Both are talented racers, but K.C. has a wilder and more reckless approach, while Trip follows a more cautious path. A more profound difference between them arises when K.C. is offered a lucrative deal to ride for a factory-sponsored team; he takes the deal, and leaves his brother behind to race on his own dime. However, when an accident takes Trip out of the running on the supercross circuit, he and K.C. set aside their differences as Trip helps coach his older brother so he can succeed in his drive to the championship. Made with the cooperation of a leading supercross race promoter, Supercross: The Movie also stars Sophia Bush and Cameron Richardson as the brothers' love interests, and Robert Carradine as a determined race coach.|2.8/10|73|4|69|3.1/10|21|1|20|3/5|47,233
770708567|Congo: White King, Red Rubber, Black Death|Peter Bate|Documentary, Musical & Performing Arts|Jan 1, 2003|Feb 28, 2006||NR|83|||King Leopold II took over leadership of Belgium from his father, King Leopold I, in 1865, and in 1885, hoping to gain power and wealth as well as assuming control of overseas territories like most other European nations of the time, Leopold created, through political lobbying and military force, the Belgian Free State. Its name a grim irony, the Belgian Free State gave Leopold and his cohorts power over the African territory of the Congo, which he soon exploited for its large supplies of ivory and rubber -- the latter an especially lucrative resource after the invention of the pneumatic tire. Leopold and his soldiers used the Congolese natives as forced labor, with those who refused to work for the Belgians or who violated their newly established laws punished by dismemberment, torture, or death; between 1885 and 1920, nearly ten million people were either slaughtered or worked to death in the Congo under Leopold's rule. Leopold's reign of terror in the Congo became a scandal during the last years of his rule, and he destroyed most of the documents pertaining to the Belgian Free State prior to his death; Congo: White King, Red Rubber, Black Death is a film which attempts to examine the king's crimes with the evidence that still remains. Using interviews with historians, rare documents, and historical reenactments of Leopold's atrocities, Congo: White King, Red Rubber, Black Death is framed by footage of an imagined trial with the king facing a jury for his crimes against humanity -- crimes he was never charged with in his lifetime. ~ Mark Deming, Rovi|7.1/10|11|11|0|||||3.9/5|134
770693269|The Young Unknown|Catherine Jelski|Drama|Mar 12, 2000|Feb 21, 2006||R|87|Indican Pictures|Catherine Jelski|Four friends have an unpleasant afternoon when two let their egos get the better of them in this independent drama. Charlie (Devon Gummersall) is an aspiring filmmaker with lots of ideas but little to show for them. He is house-sitting for his father, who directs television commercials and is out of town on an assignment. Charlie and his girlfriend Paloma (Arly Jover) spend much of their time getting wasted; Charlie then makes grand pronouncements about the future of cinema while she patiently listens. Things become tense, however, when Charlie's friend Joe (Eion Bailey), who has a taste for drugs, stops by with his girlfriend (Leslie Bibb) and the conversation turns ugly. The Young Unknowns was adapted from the stage drama +Magic Afternoon by Wolfgang Bauer.|4.1/10|29|4|25|4.2/10|14|3|11||261
770692327|Troublesome Creek: A Midwestern|Jeanne Jordan, Steven Ascher|Documentary, Special Interest, Television||Feb 14, 2006||NR|90||Steve Ascher, Jeanne Jordan|Chronicling the struggle of Russ Jordan and his wife, Mary Jane, to keep their debt-ridden farm in the family, married filmmakers Jeanne Jordan and Steven Ascher shine a light on the decline of the American farm in this Sundance Film Festival winner. To silence an unsympathetic bank that wants its $220,000 loan repaid, the Jordans sell everything they own, move to a tiny house in another town and pray that their son Jim can hold on to the land.|6.4/10|11|9|2|||||3.5/5|62
770682718|The Simian Line|Linda Yellen|Comedy, Drama|Jan 15, 2000|Feb 21, 2006||R (language and some sexuality)|106|Gabriel Film Group||Director Linda Yellen spins this study of four couples as they struggle to maintain their relationships. Middle-aged divorcée and landlord Katharine (Lynn Redgrave) is completely smitten with her live-in lover Rick (Harry Connick, Jr.). She loves throwing parties, and on one Halloween she hosts a dinner for some wildly dissimilar guests: her tenets Sandra (Cindy Crawford) and Paul (Jamey Sheridan) are conservative professionals, while fellow building dwellers Marta (Monica Keena) and Billy (Dylan Bruno) are rock musicians. Also at the party is wacky psychic Arnita (Tyne Daly). During dinner, Arnita sees the spirits of another couple: Mae (Samantha Mathis), a flapper from the 1920s, and Katharine's great-grandfather Edward (William Hurt). Unnerved, Arnita predicts that one couple will split up by year's end. Though initially shaken, the guests brush her off as a nut. Yet toward the year's end, Katharine grows increasingly jealousy of Rick's flirtation with Sandra.|4/10|18|4|14|3.8/10|8|2|6|3.7/5|140
770680467|Deal of the Century|William Friedkin|Comedy|Nov 4, 1983|Feb 14, 2006||PG|100|WARNER BROTHERS PICTURES|Paul Brickman, Robert Garland|The humor in this Chevy Chase comedy lies solely in the eyes of the beholder. The comic plays Eddie Muntz, an arms dealer looking to make a big sale of war planes to a South American dictator. In order to do so, his girlfriend (Sigourney Weaver) has to sleep with the dictator and his friend (Gregory Hines) has to be convinced to do one more killing. Eddie's archenemy is Stryker (Vince Edwards) who wants to make that deal himself and will stop at nothing to obtain his ends.|4.1/10|8|1|7|||||2.6/5|527
687949968|The Shaggy D.A.|Robert Stevenson|Comedy, Kids & Family|Dec 17, 1976|Mar 7, 2006||G|91|Walt Disney Productions|Don Tait|Robert Stevenson, Walt Disney Productions' house director, cobbled together his 19th family film for the organization with this slapstick sequel to the Disney comedy The Shaggy Dog (produced 17 years after the fact). Dean Jones plays Wilby Daniels, a lawyer running against the villainous John Slade (Keenan Wynn) for district attorney. His campaign is cast into doubt when he comes upon an ancient ring that transforms him into a fat sheepdog. But the campaign progresses on a level playing field when the unscrupulous Slade finds himself also turned into a canine -- a disgruntled bulldog. Another sequel, The Return of the Shaggy Dog, followed.|5.4/10|8|4|4|||||3.2/5|886
535727839|The Lords of Discipline|Franc Roddam|Drama, Mystery & Suspense|Feb 18, 1983|Feb 28, 2006||R|103|Paramount Pictures|Lloyd Fonvielle, Thomas Pope|"In this melodramatic polemic against the hazing of young recruits -- especially one racially different recruit -- in a fictitious Carolina Military Institute, director Franc Roddam reveals increasingly vicious levels of abuse as the story progresses. Adapted from a long novel by Pat Conroy, the tale is shortened to focus on the travails of Will (David Keith), a senior student confidentially charged with making sure that the initiation of the young Afro-American Pearce (Mark Breland) does not get too violent. Yet that is exactly what happens, and Will becomes alarmed when it seems like someone is out to kill Pearce. He knows there is a secret group called ""The Ten"" who exercise an unseen control over weeding out cadets they do not want, for one reason or another. As Will's dangerous investigation into the identity of these ten people continues, with the reluctant help of some of his friends, corruption and a cover-up at the top seem like an increasingly certain scenario."|5.2/10|8|3|5|||||3.3/5|869
528348514|Joshua|George Ratliff|Art House & International, Drama, Mystery & Suspense|Jun 16, 2007|Feb 28, 2006|$442,201|R (for language and some disturbing behavior by a child)|105|Fox Searchlight Pictures|David Gilbert, George Ratliff|"Sam Rockwell and Vera Farmiga star in director George Ratliff's uncomfortable psychological thriller Joshua, as Brad and Abby Cairn, an affluent young stockbroker and his wife, raising children in New York City. Their firstborn, the nine-year-old Joshua (Jacob Kogan), is a frighteningly intelligent child -- to such a degree that he thinks and acts decades ahead of his age. Nearly always clad in formal wear and demonstrating limitless brilliance as a pianist -- with a marked predilection for ""dissonant"" classical pieces -- Joshua gravitates toward his gay aesthete uncle (Dallas Roberts) as a close friend, but distances himself from his immediate kin -- particularly when Abby brings a newborn baby sister home from the hospital and unwisely alienates the young tyke. As the days pass, one at a time, the mood at the house regresses from healthy and happy to strange, unsettled, and disorienting; meanwhile, bizarre events transpire. As the baby's whines drive an already strained Abby to the point of a nervous breakdown, Joshua devolves from eccentric to downright sociopathic behavior, discarding all of his toys, disemboweling a stuffed animal, and killing off pets. One at a time, family members also begin to suffer tragic fates -- but are they Joshua's fevered and psychotic doings or merely the result of happenstance? ~ Nathan Southern, Rovi"|6.3/10|98|61|37|6.9/10|34|27|7|2.9/5|19,465
518817263|La Bête Humaine (Judas Was a Woman)(The Human Beast)|Jean Renoir|Art House & International, Drama|Jan 1, 1938|Feb 14, 2006||NR|90|Criterion Collection|Jean Renoir, Émile Zola|Based on a novel by Emile Zola, La Bete Humaine weaves a mesmerizing tale of a tragic triangle. Train engineer Jean Gabin lusts after Simone Simon, the wife of his co-worker Fernand Ledoux. When Ledoux is in danger of losing his job, Simon offers herself to her husband's boss. In jealous pique, Ledoux kills the man. Gabin is witness to this, so Simon promises to reward him sexually if he'll keep quiet. As this romance intensifies, Simon tries to finagle Gabin into killing Ledoux. Sick of the whole sordid affair, Gabin murders Simon and then kills himself. When Fritz Lang remade La Bete Humaine as Human Desire in 1953, he carefully copied several of the best visual selections made by Jean Renoir in the original film; what he was not permitted to copy was the story itself, which had to be heavily laundered to accommodate Hollywood's censorship limitations. ~ Hal Erickson, Rovi|8.1/10|15|14|1|||||3.9/5|1,938
