771458534|Enter The Warriors Gate (Warrior's Gate)|Matthias Hoene|Action & Adventure, Science Fiction & Fantasy|May 5, 2017|Jun 6, 2017|PG-13 (for martial arts fantasy violence)|108|Fundamental Films|Luc Besson, Robert Mark Kamen|Epic fantasy-adventure meets martial arts action in this thrilling film written by Luc Besson & Robert Mark Kamen. After a mysterious chest opens a gateway through time, teen gamer Jack (Uriah Shelton) is transported to an ancient empire terrorized by a cruel barbarian king (former WWE superstar Dave Bautista). Jack will need all of his gaming skills as he battles to defeat the barbarian, protect a beautiful princess, and somehow find his way back home.|4.5/10|8|4|4|||||3/5|214
771467712|Journey to the West: The Demons Strike Back|Hark Tsui|Action & Adventure, Comedy, Science Fiction & Fantasy|Feb 3, 2017|Jun 6, 2017|PG-13 (for fantasy action violence, some suggestive content, rude humor and thematic elements)|109|Star Overseas|Stephen Chow, Hark Tsui, Lee Si Zhen Kelvin|A monk and his disciples travel to the West to exorcise demonic possessions, but first need to understand their own personal anxieties. Tsui Hark directed this historical fantasy epic.|5.8/10|12|7|5|||||3.2/5|584
771470530|96 Souls|Stanley Jacobs|Drama, Science Fiction & Fantasy|May 26, 2017|May 30, 2017|NR|112|SJPL Films|Stanley Jacobs|In this intriguing sci-fi drama, a scientist gains the ability to see other people's thoughts following an accident in his lab.|2.9/10|6|0|6|||||3.8/5|140
771472291|Be Afraid|Drew Gabreski|Mystery & Suspense, Science Fiction & Fantasy|Jun 1, 2017|Jun 1, 2017|NR|99|DarkShed|Gerald Nott|Not long after John Chambers and his family arrive at their new home in a small country town of Pennsylvania, John begins to experience sleep paralysis. Lying there paralyzed, trapped within his own nightmare, other-worldly beings visit John. They are entities which exist in the darkest shadows of the night and can only be seen out of the corner of one's eye. These encounters begin to haunt John, transforming to complete terror as he discovers the entities' sole purpose... the abduction of his seven-year-old son. In the end, John will uncover the town's horrific secret, a portal on his land, and make one last attempt to save his son before the shadow people permanently take him away to their world.|4.6/10|11|2|9|||||2.7/5|105
771473011|Shimmer Lake|Oren Uziel|Drama, Mystery & Suspense|Jun 9, 2017|Jun 9, 2017|NR|83|Netflix|Oren Uziel|An inventive crime thriller told backwards--reversing day by day through a week--following a local sheriff's quest to unlock the mystery of three small town criminals and a bank heist gone wrong.|5.3/10|10|6|4|||||3.5/5|464
770701440|Burning Annie|Van Flesher|Art House & International, Comedy, Drama|Mar 8, 2003|May 15, 2017|R|95|Sundance Creative Distribution Initiative|Zack Ordynans, Randy Mack|A college student and aspiring radio personality finds his obsession with Woody Allen's Annie Hall may be hindering his love life in director Van Flesher's heartfelt tribute to the master of the neurotic comedy drama. Max is a college student whose love of Annie Hall is beginning to border on unhealthy. Though his friends are quick to point out the main hurdle preventing Max from connecting with the opposite sex, the obsessive cinephile himself is in a constant state of denial. When Julie, the one and only fan of Max's late-night radio show, begins to take a romantic interest in Max, it finally dawns on the lovelorn broadcaster just how wild he has allowed his rampant film fanaticism to run. Now, in order to find true love, the man who loved Annie Hall will be forced to kiss his fictional sweetheart goodbye and take a chance on real life.|5.6/10|8|4|4|5/10|5|3|2|2.9/5|95
770771660|Rings|F. Javier Gutiérrez|Drama, Horror|Feb 3, 2017|May 2, 2017|PG-13 (for violence/terror, thematic elements, some sexuality and brief drug material)|117|Paramount Pictures|Jacob Aaron Estes, Akiva Goldsman, David Loucka|"A new chapter in the beloved RING horror franchise. A young woman becomes worried about her boyfriend when he explores a dark subculture surrounding a mysterious videotape said to kill the watcher seven days after he has viewed it. She sacrifices herself to save her boyfriend and in doing so makes a horrifying discovery: there is a ""movie within the movie"" that no one has ever seen before..."|3.2/10|108|8|100|3.1/10|20|2|18|2.4/5|21,958
770805755|xXx: Return of Xander Cage|D.J. Caruso|Action & Adventure, Drama|Jan 20, 2017|May 16, 2017|PG-13 (for extended sequences of gunplay and violent action, and for sexual material and language)|110|Paramount Pictures||"The third explosive chapter of the blockbuster franchise that redefined the spy thriller finds extreme athlete turned government operative Xander Cage (Vin Diesel) coming out of self-imposed exile and on a collision course with deadly alpha warrior Xiang and his team in a race to recover a sinister and seemingly unstoppable weapon known as Pandora's Box. Recruiting an all-new group of thrill-seeking cohorts, Xander finds himself enmeshed in a deadly conspiracy that points to collusion at the highest levels of world governments. Packed with the series' signature deadpan wit and bad-ass attitude, ""xXx: RETURN OF XANDER CAGE"" will raise the bar on extreme action with some of the most mind-blowing stunts to ever be caught on film."|4.9/10|133|62|71|4.5/10|25|9|16|2.9/5|25,125
771258859|A Fantastic Fear of Everything|Crispian Mills, Chris Hopewell|Art House & International, Comedy|Feb 7, 2014|May 9, 2017|R (for language)|141|Cinedigm Entertainment|Crispian Mills|Jack (Simon Pegg) is a children's author turned crime novelist whose detailed research into the lives of Victorian serial killers has turned him into a paranoid wreck, persecuted by an irrational fear of being murdered. When Jack is thrown a life-line by his long-suffering agent, and a mysterious Hollywood executive takes a sudden and inexplicable interest in Jack's script, what should be his 'big break' rapidly turns into his 'big breakdown' as Jack is forced to confront his worst fears; among them love, laundry and serial killers. (c) Official Facebook|4.3/10|32|11|21|3.3/10|6|0|6|2.9/5|4,662
771351917|Resident Evil: The Final Chapter|Paul W.S. Anderson|Action & Adventure, Horror, Science Fiction & Fantasy|Jan 27, 2017|May 16, 2017|R (for sequences of violence throughout)|106|Sony Pictures|Paul W.S. Anderson|The human race's last hope against apocalyptic obliteration is super soldier Alice (Milla Jovovich), but she's been stripped of her psychic powers. She must form alliances and rally survivors in Raccoon City for the climactic battle against the Umbrella Corporation and its ravenous hordes of the undead. This sixth installment of the video game-inspired franchise is directed by Paul W.S. Anderson (AWP: Alien vs. Predator).|4.5/10|97|36|61|5.6/10|13|6|7|3.2/5|59,305
771378420|Black Rose|Alexander Nevsky|Action & Adventure, Mystery & Suspense|Apr 28, 2017|May 2, 2017|NR|100|ITN Distribution|Brent Huff, George Saunders|A Russian Police Major (Alexander Nevsky) is enlisted by the LAPD to help solve a series of gruesome murders perpetrated against young women by a sadistic sociopathic killer on the mean streets of Hollywood.|2.4/10|8|1|7|||||1.5/5|48
771418016|Fifty Shades Darker|James Foley|Drama, Romance|Feb 10, 2017|May 9, 2017|R (for strong erotic sexual content, some graphic nudity, and language.)|115|Universal Pictures|Niall Leonard|Anastasia has broken off her relationship with the troubled Christian to pursue a new career in a Seattle publishing house.|3.3/10|189|22|167|3.4/10|40|4|36|3/5|27,424
771418791|Welcome To Happiness|Oliver Thompson|Comedy, Drama, Science Fiction & Fantasy|May 20, 2016|May 16, 2017|PG-13|108|Filmbuff (US)|Oliver Thompson|Woody (Kyle Gallner), a children's author, rents a strange apartment from his landlord, Moses (Nick Offerman). There's a magical door in Woody's closet that allows those who go through it to erase mistakes from their past. While he was once happy to facilitate the passage of the random strangers summoned to his apartment, Woody soon begins to question why he himself is not allowed to go through.|4.9/10|14|3|11|2.9/10|5|0|5|3.8/5|108
771424870|The Commune (Kollektivet)|Thomas Vinterberg|Art House & International, Drama|May 19, 2017|May 19, 2017|NR|111|Magnolia Pictures|Thomas Vinterberg, Tobias Lindholm|The new film by lauded Danish director Thomas Vinterberg (The Celebration, The Hunt) examines the fallout from the social upheavals of the 1970s through the microcosm of a Copenhagen commune. Anna (Trine Dyrholm, who won Best Actress at the 2016 Berlinale for her performance) is a television newswoman; her husband, Erik (Ulrich Thomsen), teaches architecture at a university. When Erik's father passes away, the couple must decide what to do with the huge house that Erik grew up in, as it's too expensive for them to occupy on their own. Erik prefers selling, but Anna - who has become frustrated with Erik's dour outlook and longs for something new - suggests that they use this opportunity to experiment with communal living (which was all the rage in Scandinavia at the time). Energized by the era's relaxed taboos, Anna and Erik assemble a diverse, rather motley crew of cohabitants and embark on their adventure, but soon take very different paths. While Anna is anxious to stay home and experience life with her new extended family, Erik finds a more traditional way of reinvigorating himself: an affair with one of his students. When Anna tries to reconcile these two situations, the commune - and the marriage at its core - begins to unravel.|6.5/10|90|64|26|6.9/10|20|15|5|3.3/5|723
771426863|Gold|Stephen Gaghan|Drama|Jan 27, 2017|May 2, 2017|R (for language throughout and some sexuality/nudity)|120|TWC-Dimension|John Zinman, Patrick Massett|"TWC-Dimension presents GOLD, a Black Bear Pictures and HWY61 production directed by Academy Award winner Stephen Gaghan (Syriana, Traffic) and produced by Teddy Schwarzman (The Imitation Game, All is Lost) for Black Bear Pictures and Michael Nozik (Syriana, The Motorcycle Diaries) for HWY61. Directed by Academy Award winner Stephen Gaghan (TRAFFIC, SYRIANA), the film stars Academy Award winner Matthew McConaughey (INTERSTELLAR, DALLAS BUYERS CLUB, THE WOLF OF WALL STREET) and Golden Globe nominees Edgar Ramirez (HANDS OF STONE, THE GIRL ON THE TRAIN) and Bryce Dallas Howard (JURASSIC WORLD, PETE'S DRAGON), Corey Stoll (Ant-Man, ""House of Cards""), Toby Kebbell (Dawn of the Planet of the Apes, Fantastic Four), Bruce Greenwood (Star Trek, Capote), Golden Globe winner Stacy Keach (American History X, Nebraska), and a powerful ensemble cast. The screenplay for GOLD was written by Patrick Massett and John Zinman (""Friday Night Lights""), who also serve as producers. Executive producers are Paul Haggis (Crash, Million Dollar Baby), Ben Stillman, and Richard Middleton (The Artist, I Love You Phillip Morris) as well as Bob Weinstein, Harvey Weinstein and David Glasser. Key members of the production team include Academy Award winning director of photography Robert Elswit (There Will Be Blood, Syriana), Academy Award nominated production designer Maria Djurkovic (Tinker Tailor), and Academy Award nominated costume designer Danny Glicker (Milk)."|5.2/10|177|74|103|5.4/10|42|13|29|3.2/5|8,528
771429027|Urban Hymn|Michael Caton-Jones|Art House & International, Drama, Musical & Performing Arts|May 12, 2017|May 12, 2017|NR|114|Level 33 Entertainment|Nick Moorcroft|A redemptive coming of age story about a wayward teen, Jamie (Letitia Wright), who is encouraged by an inspiring and unconventional social worker Kate (Shirley Henderson), to use singing as an escape from her troubled background. Jamie's loyalties soon become torn between Kate and her possessive and volatile best friend, Leanne (Isabella Laughland).|6.1/10|26|15|11|4.2/10|9|3|6|3.7/5|70
771429927|Camino|Josh Waller, Josh C. Waller|Action & Adventure|Mar 4, 2016|May 2, 2017|NR|103||Daniel Noah|"Set in 1985, war photographer Avery Taggert (Zoë Bell) has built a solid career with her stark and honest imagery, all the while remaining emotionally distant from her subjects. When she embeds in the jungles of Colombia with a squad of missionaries led by a beloved and charismatic Spaniard known as ""El Guero"" (Nacho Vigalondo), she finds herself in the middle of a conflict as violent as any she's photographed. One night, she happens upon El Guero committing a heinous atrocity, capturing the vile act on film, an image with the potential to discredit and destroy El Guero. Knowing this brilliant psychopath will employ every tactic at his disposal to destroy that photograph - and the photographer who took it - Avery flees into the harsh jungle with nothing but the camera hanging around her neck to escape from missionaries twisted into violent guerrillas by the madman intent on destroying all enemies."|5.3/10|19|6|13|||||2.5/5|70
771434794|The Space Between Us|Peter Chelsom|Action & Adventure, Science Fiction & Fantasy|Feb 3, 2017|May 16, 2017|PG-13 (for brief sensuality and language)|120|STX Entertainment|Allan Loeb, Peter Chelsom, Tinker Lindsay|In this interplanetary adventure, shortly after arriving to help colonize Mars, an astronaut dies while giving birth to the first human born on the red planet - never revealing who the father is. Thus begins the extraordinary life of Gardner Elliot - an inquisitive, highly intelligent boy who reaches the age of 16 having only met 14 people in his very unconventional upbringing. While searching for clues about his father, and the home planet he's never known, Gardner begins an online friendship with a street smart girl named Tulsa. When he finally gets a chance to go to Earth, Gardner is eager to experience all of the wonders he could only read about on Mars. But after his explorations begin, scientists discover that Gardner's organs can't withstand Earth's atmosphere. Gardner joins with Tulsa on a race against time to unravel the mysteries of how he came to be, and where he belongs in the universe.|4.2/10|129|21|108|4.4/10|32|3|29|3.4/5|14,256
771436918|A Street Cat Named Bob|Roger Spottiswoode|Comedy, Drama|Nov 18, 2016|May 9, 2017|NR|103|Cleopatra Entertainment|John Tim Burrus, Maria Nation|This film tells the moving and life-affirming true story of the unlikely friendship between a young homeless busker, James Bowen, and the stray ginger cat named Bob who changed his life.|6/10|63|49|14|4.6/10|10|7|3|3.9/5|4,837
771437821|Things to Come (L'avenir)|Mia Hansen-Løve|Art House & International, Drama|Dec 2, 2016|May 9, 2017|PG-13 (for brief language and drug use)|100|IFC Films|Mia Hansen-Løve|"What happens when the life you've worked so hard to build falls apart? In THINGS TO COME, Oscar nominee Isabelle Huppert, in ""a career-best performance"" (Jordan Hoffman, Vanity Fair), portrays Nathalie, a philosophy teacher juggling a rich life of the mind with the day-to-day demands of career and family, which include frequent visits to her drama queen mother, played by the legendary Edith Scob(Eyes Without a Face). But with the bombshell revelation that her husband of 25 years is leaving her, Nathalie finds herself adrift, but also with a newfound sense of liberation. With nothing to hold her back, Nathalie sets out to define this new phase of her life and to rediscover herself. Winner of the Best Director award at the 2016 Berlin International Film Festival, the acclaimed new film from Mia Hansen-Love (Eden) is a soul-searching look at what it means to create a life of one's own."|8.2/10|136|135|1|8.1/10|28|28|0|3.6/5|6,646
771440395|Burden|Richard Dewey, Timothy Marrinan|Documentary|May 5, 2017|May 5, 2017|NR|85|Magnolia Pictures|Richard Dewey, Timothy Marrinan|Chris Burden guaranteed his place in art history in 1971 with a period of often dangerous and at times stomach-churning performances. After having himself shot, locked up in a locker for five days, electrocuted, and crucified on the back of a VW bug, Burden reinvented himself as the creator of truly mesmerizing installations and sculptures, from a suspended gigantic flywheel that seemingly spins on its own, to an assemblage of antique streetlights rewired for solar energy and illuminated outside the Los Angeles County Museum of Art. In BURDEN, Timothy Marrinan and Richard Dewey look at the artist's works and private life with an innovative mix of still-potent videos of his 70s performances, personal videos and audio recordings, friends, fellows students and colleagues, critics' comments and latter day footage at his Topanga Canyon studio, all peppered with his thoughts and musings through the years.|7.4/10|36|35|1|8.4/10|12|11|1|4/5|299
771440396|Between Us|Rafael Palacio Illingworth|Comedy, Drama, Romance|Jan 6, 2017|May 16, 2017|NR|93|Caviar Films|Rafael Palacio Illingworth|A long-term relationship threatens to implode over the course of one tumultuous night in the engaging romantic comedy-drama BETWEEN US. After six years together, thirtysomethings Henry (Ben Feldman, Mad Men, Superstore) and Dianne (Olivia Thereby, Juno, The Stanford Prison Experiment) are caught between their fears of commitment and societal pressure to settle down and marry. An impulsive decision and a surprise revelation send them into an emotional tailspin. Heading out into the LA night, Henry and Dianne each encounter strangers - he a free-spirited rocker (Adam Goldberg, Saving Private Ryan), she a charming artist (Analeigh Tipton, Crazy Stupid Love) - who offer the possibility of new romantic thrills. The choices Henry and Dianne make will determine what - if anything - will be left of their relationship come morning. By turns brutally honest and incisively funny, BETWEEN US is a raw, real look at the rocky terrain of 21st-century romance.|6/10|7|3|4|||||3/5|101
771443367|My Life as a Zucchini (Ma vie de courgette)|Claude Barras|Animation, Art House & International, Kids & Family|Feb 24, 2017|May 23, 2017|PG-13 (for thematic elements and suggestive material)|66|Rita Productions|Céline Sciamma|After his mother's sudden death, Zucchini is befriended by a police officer, Raymond, who accompanies him to his new foster home, filled with other orphans his age. At first he struggles to find his place in this at times strange and hostile environment. But with Raymond's help and his newfound friends, Zucchini eventually learns to trust and love, as he searches for a new family of his own. Brought to life through striking character designs and expressive stop-motion animation, the story soars with laughter, sorrow, and joy, and stands as a testament to the resilience of the human heart. Beginning with its debut at Cannes, the film has stirred up an overwhelming response on the festival circuit, taking home top jury and audience prizes at Annecy, Melbourne and Angoulême, as it prepares to melt hearts in North America with its premiere at Toronto.|8.2/10|128|126|2|8.1/10|23|23|0|4.1/5|6,417
771444324|Dying Laughing|Paul Toogood, Lloyd Stanton|Documentary|Feb 24, 2017|May 9, 2017|NR|89|Gravitas Ventures||A stand-up comedian is his or her own writer, director and star performer. Unlike any other art form, there is no safety net. In its singular realization, comedy thrives on a stage--often in front of hostile audiences. For most people, baring your soul and being heckled would be a life-changing trauma. For stand-ups, it's just part of the routine. Directors Lloyd Stanton and Paul Toogood achieve a startling level of intimacy in a series of riveting interviews with Gary Shandling, Chris Rock, Kevin Hart, Jerry Seinfeld, Sarah Silverman, Billy Connolly, Amy Schumer and many other masters of the comedy universe; allowing in-depth access to the emotional and psychological highs and lows of answering the call to become a comic.|6.7/10|17|15|2|5.9/10|9|7|2|2.3/5|332
771445725|Mom and Me|Ken Wardrop|Art House & International, Documentary|May 5, 2017|May 5, 2017|NR|77|Uncork'd Entertainment|Ken Wardrop|"From Uncork'd Entertainment, Mom & Me is a ""nicely judged mirror on life and feelings"" (The Hollywood Reporter) that delicately challenges the familiar love story shared between a son and his mother. Oklahoma has recently been voted the manliest state in the US. With Mother's Day coming soon, radio show host Joe Cristiano wants to investigate if the manliest men, in the manliest state in the Union, are willing to call in and discuss their mothers on air. See the film that ""captures the universal experience of motherly love perfectly"" (FilmIreland) only at theaters and on VOD May 5."|8.3/10|7|7|0|||||3.3/5|76
771448963|Hounds of Love|Ben Young|Drama|May 12, 2017|May 12, 2017|NR|108|Gunpowder & Sky|Ben Young|In suburban Perth during the mid 1980s, people are unaware that women are disappearing at the hands of serial killer couple John and Evelyn White. After an innocent lapse in judgment, Vicki Maloney is randomly abducted by the disturbed couple. With her murder imminent, Vicki realizes she must find a way to drive a wedge between Evelyn and John if she is to survive. Hounds of Love is an exercise in expertly-crafted tension, offering a bold, challenging debut from writer/director Ben Young.|7.2/10|90|79|11|6.4/10|15|12|3|3.6/5|1,975
771450230|I Am Not Your Negro|Raoul Peck|Documentary|Feb 3, 2017|May 2, 2017|PG-13 (for disturbing violent images, thematic material, language and brief nudity.)|93|Magnolia Pictures|James Baldwin, Raoul Peck|In 1979, James Baldwin wrote a letter to his literary agent describing his next project, Remember This House. The book was to be a revolutionary, personal account of the lives and successive assassinations of three of his close friends-Medgar Evers, Malcolm X and Martin Luther King, Jr. At the time of Baldwin's death in 1987, he left behind only thirty completed pages of his manuscript. Now, in his incendiary new documentary, master filmmaker Raoul Peck envisions the book James Baldwin never finished. The result is a radical, up-to-the-minute examination of race in America, using Baldwin's original words and flood of rich archival material. I Am Not Your Negro is a journey into black history that connects the past of the Civil Rights movement to the present of #BlackLivesMatter. It is a film that questions black representation in Hollywood and beyond. And, ultimately, by confronting the deeper connections between the lives and assassination of these three leaders, Baldwin and Peck have produced a work that challenges the very definition of what America stands for.|8.9/10|192|189|3|8.9/10|35|35|0|4.1/5|14,132
771450565|The Void|Jeremy Gillespie , Steven Kostanski|Horror|Apr 7, 2017|May 9, 2017|NR|90|Screen Media Films|Jeremy Gillespie , Steven Kostanski|When police officer Carter (Aaron Poole) discovers a blood-soaked man limping down a deserted road, he rushes him to a local hospital with a barebones, night shift staff. As cloaked, cult-like figures surround the building, the patients and staff inside start to turn ravenously insane. Trying to protect the survivors, Carter leads them into the depths of the hospital where they discover a gateway to immense evil.|6/10|66|50|16|5.2/10|11|7|4|3.1/5|6,010
771454573|Get Out|Jordan Peele|Horror, Mystery & Suspense|Feb 24, 2017|May 23, 2017|R (for violence, bloody images, and language including sexual references)|104|Universal Pictures|Jordan Peele|Now that Chris and his girlfriend, Rose, have reached the meet-the-parents milestone of dating, she invites him for a weekend getaway upstate with Missy and Dean. At first, Chris reads the family's overly accommodating behavior as nervous attempts to deal with their daughter's interracial relationship, but as the weekend progresses, a series of increasingly disturbing discoveries lead him to a truth that he could have never imagined.|8.3/10|344|338|6|8.1/10|54|54|0|4.2/5|72,708
771455128|Dead Awake|Phillip Guzman|Horror, Mystery & Suspense|May 12, 2017|May 12, 2017|NR|99|FilmRise|Jeffrey Reddick|From the creator of the iconic FINAL DESTINATION franchise comes the paralyzing thriller DEAD AWAKE. Kate Bowman (Jocelin Donahue) is a straight-laced social worker who finds herself plunged into a world of supernatural terror while investigating a series of mysterious deaths. Each victim suffered from a chilling condition known as sleep paralysis, a nightmarish assault on the senses that immobilizes its victims as they dream. As a terrifying entity begins to haunt Kate's friends and loved ones, she must fight to stay awake to stop the nightmare she's unleashed!|4.1/10|8|1|7|||||2.3/5|185
771456318|Mommy Dead and Dearest|Erin Lee Carr|Documentary||May 15, 2017|NR|82|HBO||A look at the 2015 murder of Dee Dee Blanchard in Missouri features interviews with her daughter, Gypsy Rose, who was implicated in the crime and sentenced to 10 years in prison.|7.3/10|12|12|0|7.5/10|5|5|0|4/5|291
